data/corehrs/gpu_speedup/juwels_booster_32gpu/tunecache.tsv
tunecache	1.1.0	1.1.0-bbf27d48a-sm_80	cpu_arch=x86_64,gpu_arch=sm_80,cuda_version=11.5.50	# Last updated Fri Jul 29 15:16:32 2022

          volume	name	aux	block.x	block.y	block.z	grid.x	grid.y	grid.z	shared_bytes	aux.x	aux.y	aux.z	aux.w	time	comment
          131072	N4quda15TransformReduceINS_7maximumIfEENS_7complexIfEEjNS_8abs_max_IffEENS_8identityEEE	GPU-offline,batch_size=2	256	1	1	192	1	2	0	-1	-1	-1	-1	1.05046e-05	# 0.00 Gflop/s, 199.64 GB/s, tuning took 0.023746 seconds at Mon Jul 11 18:32:48 2022
          131072	N4quda15TransformReduceINS_7maximumIfEENS_7complexIiEEjNS_8abs_max_IfiEENS_11milc_mapperEEE	GPU-offline,batch_size=2	512	1	1	96	1	2	0	-1	-1	-1	-1	1.10018e-05	# 0.00 Gflop/s, 190.62 GB/s, tuning took 0.024666 seconds at Mon Jul 11 18:32:48 2022
       150994944	N4quda15TransformReduceINS_7maximumIfEENS_7complexIsEEjNS_8abs_max_IfsEENS_8identityEEE	GPU-offline,batch_size=2	1024	1	1	108	1	2	0	-1	-1	-1	-1	0.00113562	# 0.00 Gflop/s, 1063.70 GB/s, tuning took 9.641186 seconds at Mon Jul 11 18:28:21 2022
       16x16x4x4	N4quda10BlockOrthoIsfLi2ELi1ELi24ELi2ELi32EEE	GPU-offline,vol=4096,parity=2,precision=2,order=2,Ns=2,Nc=768,TwistFlavor=1,block_size=4x4x2x2,n_block_ortho=1,mVec=1	64	1	1	64	1	2	2049	1	-1	-1	-1	0.00108203	# 1476.89 Gflop/s, 430.52 GB/s, tuning took 0.174278 seconds at Mon Jul 11 18:32:46 2022
       16x16x4x4	N4quda10CalculateYILb0EL19QudaFieldLocation_s2ENS_13CalculateYArgILb0EfLi4ELi2ELi3ELi24ENS_5gauge10FieldOrderIfLi48ELi2EL21QudaGaugeFieldOrder_s2ELb1EsEENS4_IfLi48ELi2ELS5_2ELb1EiEENS4_IfLi3ELi1ELS5_2ELb1EfEENS_11colorspinor12FieldOrderCBIfLi4ELi3ELi24EL16QudaFieldOrder_s2EssLb0ELb0EEESC_SC_NS_6clover10FieldOrderIfLi3ELi4EL22QudaCloverFieldOrder_s4EEEEEEE	GPU-offline,vol=1048576,parity=2,precision=2,order=2,Ns=4,Nc=72,TwistFlavor=1,comm=0011,computeCoarseDiagonal,GPU-device	256	1	1	8	2	24	0	1	1	1	1	3.94971e-06	# 49.78 Gflop/s, 398.22 GB/s, tuning took 0.031112 seconds at Mon Jul 11 18:31:38 2022
       16x16x4x4	N4quda10CalculateYILb0EL19QudaFieldLocation_s2ENS_13CalculateYArgILb0EfLi4ELi2ELi3ELi24ENS_5gauge10FieldOrderIfLi48ELi2EL21QudaGaugeFieldOrder_s2ELb1EsEENS4_IfLi48ELi2ELS5_2ELb1EiEENS4_IfLi3ELi1ELS5_2ELb1EfEENS_11colorspinor12FieldOrderCBIfLi4ELi3ELi24EL16QudaFieldOrder_s2EssLb0ELb0EEESC_SC_NS_6clover10FieldOrderIfLi3ELi4EL22QudaCloverFieldOrder_s4EEEEEEE	GPU-offline,vol=1048576,parity=2,precision=2,order=2,Ns=4,Nc=72,TwistFlavor=1,comm=0011,computeConvert,GPU-device	64	2	1	32	24	24	0	1	1	1	1	8.9088e-05	# 2.21 Gflop/s, 1271.17 GB/s, tuning took 0.656490 seconds at Mon Jul 11 18:29:21 2022
       16x16x4x4	N4quda10CalculateYILb0EL19QudaFieldLocation_s2ENS_13CalculateYArgILb0EfLi4ELi2ELi3ELi24ENS_5gauge10FieldOrderIfLi48ELi2EL21QudaGaugeFieldOrder_s2ELb1EsEENS4_IfLi48ELi2ELS5_2ELb1EiEENS4_IfLi3ELi1ELS5_2ELb1EfEENS_11colorspinor12FieldOrderCBIfLi4ELi3ELi24EL16QudaFieldOrder_s2EssLb0ELb0EEESC_SC_NS_6clover10FieldOrderIfLi3ELi4EL22QudaCloverFieldOrder_s4EEEEEEE	GPU-offline,vol=1048576,parity=2,precision=2,order=2,Ns=4,Nc=72,TwistFlavor=1,comm=0011,computeRescale,GPU-device	256	1	1	8	48	24	0	1	1	1	1	6.2336e-05	# 3.15 Gflop/s, 1211.14 GB/s, tuning took 0.610416 seconds at Mon Jul 11 18:40:01 2022
       16x16x4x4	N4quda10CalculateYILb1EL19QudaFieldLocation_s2ENS_13CalculateYArgILb1EfLi2ELi2ELi24ELi32ENS_5gauge10FieldOrderIfLi64ELi2EL21QudaGaugeFieldOrder_s13ELb1EsEENS4_IfLi64ELi2ELS5_13ELb1EiEENS4_IfLi48ELi2ELS5_13ELb1EsEENS_11colorspinor12FieldOrderCBIfLi2ELi24ELi32EL16QudaFieldOrder_s9EssLb0ELb0EEENSA_IfLi4ELi24ELi32ELSB_9EssLb0ELb0EEESC_S8_EEEE	GPU-offline,vol=4096,parity=2,precision=2,order=9,Ns=2,Nc=768,TwistFlavor=1,comm=0011,computeUV,mma,compute_max,dim=0,dir=back,nFace=1,GPU-device	32	1	1	64	12	16	0	3	0	0	0	5.92715e-05	# 40760.19 Gflop/s, 21653.85 GB/s, tuning took 0.004934 seconds at Mon Jul 11 18:32:48 2022
       16x16x4x4	N4quda10CalculateYILb1EL19QudaFieldLocation_s2ENS_13CalculateYArgILb1EfLi2ELi2ELi24ELi32ENS_5gauge10FieldOrderIfLi64ELi2EL21QudaGaugeFieldOrder_s13ELb1EsEENS4_IfLi64ELi2ELS5_13ELb1EiEENS4_IfLi48ELi2ELS5_13ELb1EsEENS_11colorspinor12FieldOrderCBIfLi2ELi24ELi32EL16QudaFieldOrder_s9EssLb0ELb0EEENSA_IfLi4ELi24ELi32ELSB_9EssLb0ELb0EEESC_S8_EEEE	GPU-offline,vol=4096,parity=2,precision=2,order=9,Ns=2,Nc=768,TwistFlavor=1,comm=0011,computeUV,mma,compute_max,dim=0,dir=fwd,nFace=1,GPU-device	32	1	1	64	12	16	0	3	0	0	0	5.89101e-05	# 41010.26 Gflop/s, 21786.70 GB/s, tuning took 0.004991 seconds at Mon Jul 11 18:32:48 2022
       16x16x4x4	N4quda10CalculateYILb1EL19QudaFieldLocation_s2ENS_13CalculateYArgILb1EfLi2ELi2ELi24ELi32ENS_5gauge10FieldOrderIfLi64ELi2EL21QudaGaugeFieldOrder_s13ELb1EsEENS4_IfLi64ELi2ELS5_13ELb1EiEENS4_IfLi48ELi2ELS5_13ELb1EsEENS_11colorspinor12FieldOrderCBIfLi2ELi24ELi32EL16QudaFieldOrder_s9EssLb0ELb0EEENSA_IfLi4ELi24ELi32ELSB_9EssLb0ELb0EEESC_S8_EEEE	GPU-offline,vol=4096,parity=2,precision=2,order=9,Ns=2,Nc=768,TwistFlavor=1,comm=0011,computeUV,mma,compute_max,dim=1,dir=back,nFace=1,GPU-device	32	1	1	64	12	16	0	3	0	0	0	5.96329e-05	# 40513.16 Gflop/s, 21522.62 GB/s, tuning took 0.005024 seconds at Mon Jul 11 18:32:48 2022
       16x16x4x4	N4quda10CalculateYILb1EL19QudaFieldLocation_s2ENS_13CalculateYArgILb1EfLi2ELi2ELi24ELi32ENS_5gauge10FieldOrderIfLi64ELi2EL21QudaGaugeFieldOrder_s13ELb1EsEENS4_IfLi64ELi2ELS5_13ELb1EiEENS4_IfLi48ELi2ELS5_13ELb1EsEENS_11colorspinor12FieldOrderCBIfLi2ELi24ELi32EL16QudaFieldOrder_s9EssLb0ELb0EEENSA_IfLi4ELi24ELi32ELSB_9EssLb0ELb0EEESC_S8_EEEE	GPU-offline,vol=4096,parity=2,precision=2,order=9,Ns=2,Nc=768,TwistFlavor=1,comm=0011,computeUV,mma,compute_max,dim=1,dir=fwd,nFace=1,GPU-device	32	1	1	64	12	16	0	2	0	0	0	5.96932e-05	# 40472.29 Gflop/s, 21500.90 GB/s, tuning took 0.005034 seconds at Mon Jul 11 18:32:48 2022
       16x16x4x4	N4quda10CalculateYILb1EL19QudaFieldLocation_s2ENS_13CalculateYArgILb1EfLi2ELi2ELi24ELi32ENS_5gauge10FieldOrderIfLi64ELi2EL21QudaGaugeFieldOrder_s13ELb1EsEENS4_IfLi64ELi2ELS5_13ELb1EiEENS4_IfLi48ELi2ELS5_13ELb1EsEENS_11colorspinor12FieldOrderCBIfLi2ELi24ELi32EL16QudaFieldOrder_s9EssLb0ELb0EEENSA_IfLi4ELi24ELi32ELSB_9EssLb0ELb0EEESC_S8_EEEE	GPU-offline,vol=4096,parity=2,precision=2,order=9,Ns=2,Nc=768,TwistFlavor=1,comm=0011,computeUV,mma,compute_max,dim=2,dir=back,nFace=1,GPU-device	32	1	1	64	12	16	0	2	0	0	0	5.93318e-05	# 40718.81 Gflop/s, 21631.87 GB/s, tuning took 0.005006 seconds at Mon Jul 11 18:32:48 2022
       16x16x4x4	N4quda10CalculateYILb1EL19QudaFieldLocation_s2ENS_13CalculateYArgILb1EfLi2ELi2ELi24ELi32ENS_5gauge10FieldOrderIfLi64ELi2EL21QudaGaugeFieldOrder_s13ELb1EsEENS4_IfLi64ELi2ELS5_13ELb1EiEENS4_IfLi48ELi2ELS5_13ELb1EsEENS_11colorspinor12FieldOrderCBIfLi2ELi24ELi32EL16QudaFieldOrder_s9EssLb0ELb0EEENSA_IfLi4ELi24ELi32ELSB_9EssLb0ELb0EEESC_S8_EEEE	GPU-offline,vol=4096,parity=2,precision=2,order=9,Ns=2,Nc=768,TwistFlavor=1,comm=0011,computeUV,mma,compute_max,dim=2,dir=fwd,nFace=1,GPU-device	32	1	1	64	12	16	0	2	0	0	0	5.93318e-05	# 40718.81 Gflop/s, 21631.87 GB/s, tuning took 0.004998 seconds at Mon Jul 11 18:32:48 2022
       16x16x4x4	N4quda10CalculateYILb1EL19QudaFieldLocation_s2ENS_13CalculateYArgILb1EfLi2ELi2ELi24ELi32ENS_5gauge10FieldOrderIfLi64ELi2EL21QudaGaugeFieldOrder_s13ELb1EsEENS4_IfLi64ELi2ELS5_13ELb1EiEENS4_IfLi48ELi2ELS5_13ELb1EsEENS_11colorspinor12FieldOrderCBIfLi2ELi24ELi32EL16QudaFieldOrder_s9EssLb0ELb0EEENSA_IfLi4ELi24ELi32ELSB_9EssLb0ELb0EEESC_S8_EEEE	GPU-offline,vol=4096,parity=2,precision=2,order=9,Ns=2,Nc=768,TwistFlavor=1,comm=0011,computeUV,mma,compute_max,dim=3,dir=back,nFace=1,GPU-device	32	1	1	64	12	16	0	2	0	0	0	5.93318e-05	# 40718.81 Gflop/s, 21631.87 GB/s, tuning took 0.005077 seconds at Mon Jul 11 18:32:48 2022
       16x16x4x4	N4quda10CalculateYILb1EL19QudaFieldLocation_s2ENS_13CalculateYArgILb1EfLi2ELi2ELi24ELi32ENS_5gauge10FieldOrderIfLi64ELi2EL21QudaGaugeFieldOrder_s13ELb1EsEENS4_IfLi64ELi2ELS5_13ELb1EiEENS4_IfLi48ELi2ELS5_13ELb1EsEENS_11colorspinor12FieldOrderCBIfLi2ELi24ELi32EL16QudaFieldOrder_s9EssLb0ELb0EEENSA_IfLi4ELi24ELi32ELSB_9EssLb0ELb0EEESC_S8_EEEE	GPU-offline,vol=4096,parity=2,precision=2,order=9,Ns=2,Nc=768,TwistFlavor=1,comm=0011,computeUV,mma,compute_max,dim=3,dir=fwd,nFace=1,GPU-device	32	1	1	64	12	16	0	2	0	0	0	5.92113e-05	# 40801.66 Gflop/s, 21675.88 GB/s, tuning took 0.005019 seconds at Mon Jul 11 18:32:48 2022
       16x16x4x4	N4quda10CalculateYILb1EL19QudaFieldLocation_s2ENS_13CalculateYArgILb1EfLi2ELi2ELi24ELi32ENS_5gauge10FieldOrderIfLi64ELi2EL21QudaGaugeFieldOrder_s13ELb1EsEENS4_IfLi64ELi2ELS5_13ELb1EiEENS4_IfLi48ELi2ELS5_13ELb1EsEENS_11colorspinor12FieldOrderCBIfLi2ELi24ELi32EL16QudaFieldOrder_s9EssLb0ELb0EEENSA_IfLi4ELi24ELi32ELSB_9EssLb0ELb0EEESC_S8_EEEE	GPU-offline,vol=4096,parity=2,precision=2,order=9,Ns=2,Nc=768,TwistFlavor=1,comm=0011,computeUV,mma,dim=0,dir=back,nFace=1,GPU-device	32	1	1	64	12	16	0	3	0	0	0	9.39287e-05	# 25720.77 Gflop/s, 13128.31 GB/s, tuning took 0.005478 seconds at Mon Jul 11 18:32:48 2022
       16x16x4x4	N4quda10CalculateYILb1EL19QudaFieldLocation_s2ENS_13CalculateYArgILb1EfLi2ELi2ELi24ELi32ENS_5gauge10FieldOrderIfLi64ELi2EL21QudaGaugeFieldOrder_s13ELb1EsEENS4_IfLi64ELi2ELS5_13ELb1EiEENS4_IfLi48ELi2ELS5_13ELb1EsEENS_11colorspinor12FieldOrderCBIfLi2ELi24ELi32EL16QudaFieldOrder_s9EssLb0ELb0EEENSA_IfLi4ELi24ELi32ELSB_9EssLb0ELb0EEESC_S8_EEEE	GPU-offline,vol=4096,parity=2,precision=2,order=9,Ns=2,Nc=768,TwistFlavor=1,comm=0011,computeUV,mma,dim=0,dir=fwd,nFace=1,GPU-device	32	1	1	64	12	16	0	2	0	0	0	9.33702e-05	# 25874.63 Gflop/s, 13206.84 GB/s, tuning took 0.005518 seconds at Mon Jul 11 18:32:48 2022
       16x16x4x4	N4quda10CalculateYILb1EL19QudaFieldLocation_s2ENS_13CalculateYArgILb1EfLi2ELi2ELi24ELi32ENS_5gauge10FieldOrderIfLi64ELi2EL21QudaGaugeFieldOrder_s13ELb1EsEENS4_IfLi64ELi2ELS5_13ELb1EiEENS4_IfLi48ELi2ELS5_13ELb1EsEENS_11colorspinor12FieldOrderCBIfLi2ELi24ELi32EL16QudaFieldOrder_s9EssLb0ELb0EEENSA_IfLi4ELi24ELi32ELSB_9EssLb0ELb0EEESC_S8_EEEE	GPU-offline,vol=4096,parity=2,precision=2,order=9,Ns=2,Nc=768,TwistFlavor=1,comm=0011,computeUV,mma,dim=1,dir=back,nFace=1,GPU-device	32	1	1	64	12	16	0	3	0	0	0	9.38356e-05	# 25746.29 Gflop/s, 13141.33 GB/s, tuning took 0.005486 seconds at Mon Jul 11 18:32:48 2022
       16x16x4x4	N4quda10CalculateYILb1EL19QudaFieldLocation_s2ENS_13CalculateYArgILb1EfLi2ELi2ELi24ELi32ENS_5gauge10FieldOrderIfLi64ELi2EL21QudaGaugeFieldOrder_s13ELb1EsEENS4_IfLi64ELi2ELS5_13ELb1EiEENS4_IfLi48ELi2ELS5_13ELb1EsEENS_11colorspinor12FieldOrderCBIfLi2ELi24ELi32EL16QudaFieldOrder_s9EssLb0ELb0EEENSA_IfLi4ELi24ELi32ELSB_9EssLb0ELb0EEESC_S8_EEEE	GPU-offline,vol=4096,parity=2,precision=2,order=9,Ns=2,Nc=768,TwistFlavor=1,comm=0011,computeUV,mma,dim=1,dir=fwd,nFace=1,GPU-device	32	1	1	64	12	16	0	3	0	0	0	9.40218e-05	# 25695.30 Gflop/s, 13115.31 GB/s, tuning took 0.005491 seconds at Mon Jul 11 18:32:48 2022
       16x16x4x4	N4quda10CalculateYILb1EL19QudaFieldLocation_s2ENS_13CalculateYArgILb1EfLi2ELi2ELi24ELi32ENS_5gauge10FieldOrderIfLi64ELi2EL21QudaGaugeFieldOrder_s13ELb1EsEENS4_IfLi64ELi2ELS5_13ELb1EiEENS4_IfLi48ELi2ELS5_13ELb1EsEENS_11colorspinor12FieldOrderCBIfLi2ELi24ELi32EL16QudaFieldOrder_s9EssLb0ELb0EEENSA_IfLi4ELi24ELi32ELSB_9EssLb0ELb0EEESC_S8_EEEE	GPU-offline,vol=4096,parity=2,precision=2,order=9,Ns=2,Nc=768,TwistFlavor=1,comm=0011,computeUV,mma,dim=2,dir=back,nFace=1,GPU-device	32	1	1	64	12	16	0	3	0	0	0	9.41149e-05	# 25669.89 Gflop/s, 13102.34 GB/s, tuning took 0.005492 seconds at Mon Jul 11 18:32:48 2022
       16x16x4x4	N4quda10CalculateYILb1EL19QudaFieldLocation_s2ENS_13CalculateYArgILb1EfLi2ELi2ELi24ELi32ENS_5gauge10FieldOrderIfLi64ELi2EL21QudaGaugeFieldOrder_s13ELb1EsEENS4_IfLi64ELi2ELS5_13ELb1EiEENS4_IfLi48ELi2ELS5_13ELb1EsEENS_11colorspinor12FieldOrderCBIfLi2ELi24ELi32EL16QudaFieldOrder_s9EssLb0ELb0EEENSA_IfLi4ELi24ELi32ELSB_9EssLb0ELb0EEESC_S8_EEEE	GPU-offline,vol=4096,parity=2,precision=2,order=9,Ns=2,Nc=768,TwistFlavor=1,comm=0011,computeUV,mma,dim=2,dir=fwd,nFace=1,GPU-device	32	1	1	64	12	16	0	3	0	0	0	9.40218e-05	# 25695.30 Gflop/s, 13115.31 GB/s, tuning took 0.005497 seconds at Mon Jul 11 18:32:48 2022
       16x16x4x4	N4quda10CalculateYILb1EL19QudaFieldLocation_s2ENS_13CalculateYArgILb1EfLi2ELi2ELi24ELi32ENS_5gauge10FieldOrderIfLi64ELi2EL21QudaGaugeFieldOrder_s13ELb1EsEENS4_IfLi64ELi2ELS5_13ELb1EiEENS4_IfLi48ELi2ELS5_13ELb1EsEENS_11colorspinor12FieldOrderCBIfLi2ELi24ELi32EL16QudaFieldOrder_s9EssLb0ELb0EEENSA_IfLi4ELi24ELi32ELSB_9EssLb0ELb0EEESC_S8_EEEE	GPU-offline,vol=4096,parity=2,precision=2,order=9,Ns=2,Nc=768,TwistFlavor=1,comm=0011,computeUV,mma,dim=3,dir=back,nFace=1,GPU-device	32	1	1	64	12	16	0	3	0	0	0	9.36494e-05	# 25797.47 Gflop/s, 13167.46 GB/s, tuning took 0.005472 seconds at Mon Jul 11 18:32:48 2022
       16x16x4x4	N4quda10CalculateYILb1EL19QudaFieldLocation_s2ENS_13CalculateYArgILb1EfLi2ELi2ELi24ELi32ENS_5gauge10FieldOrderIfLi64ELi2EL21QudaGaugeFieldOrder_s13ELb1EsEENS4_IfLi64ELi2ELS5_13ELb1EiEENS4_IfLi48ELi2ELS5_13ELb1EsEENS_11colorspinor12FieldOrderCBIfLi2ELi24ELi32EL16QudaFieldOrder_s9EssLb0ELb0EEENSA_IfLi4ELi24ELi32ELSB_9EssLb0ELb0EEESC_S8_EEEE	GPU-offline,vol=4096,parity=2,precision=2,order=9,Ns=2,Nc=768,TwistFlavor=1,comm=0011,computeUV,mma,dim=3,dir=fwd,nFace=1,GPU-device	32	1	1	64	12	16	0	2	0	0	0	9.40218e-05	# 25695.30 Gflop/s, 13115.31 GB/s, tuning took 0.005489 seconds at Mon Jul 11 18:32:48 2022
       16x16x4x4	N4quda10CalculateYILb1EL19QudaFieldLocation_s2ENS_13CalculateYArgILb1EfLi2ELi2ELi24ELi32ENS_5gauge10FieldOrderIfLi64ELi2EL21QudaGaugeFieldOrder_s13ELb1EsEENS4_IfLi64ELi2ELS5_13ELb1EiEENS4_IfLi48ELi2ELS5_13ELb1EsEENS_11colorspinor12FieldOrderCBIfLi2ELi24ELi32EL16QudaFieldOrder_s9EssLb0ELb0EEENSA_IfLi4ELi24ELi32ELSB_9EssLb0ELb0EEESC_S8_EEEE	GPU-offline,vol=4096,parity=2,precision=2,order=9,Ns=2,Nc=768,TwistFlavor=1,comm=0011,computeVUV,MMA,dim=0,dir=back,nFace=1,bidirectional,GPU-device,coarse_vol=4x4x2x2	32	2	1	64	4	4	16384	1	0	0	0	0.000212582	# 15152.83 Gflop/s, 11404.09 GB/s, tuning took 0.008819 seconds at Mon Jul 11 18:32:48 2022
       16x16x4x4	N4quda10CalculateYILb1EL19QudaFieldLocation_s2ENS_13CalculateYArgILb1EfLi2ELi2ELi24ELi32ENS_5gauge10FieldOrderIfLi64ELi2EL21QudaGaugeFieldOrder_s13ELb1EsEENS4_IfLi64ELi2ELS5_13ELb1EiEENS4_IfLi48ELi2ELS5_13ELb1EsEENS_11colorspinor12FieldOrderCBIfLi2ELi24ELi32EL16QudaFieldOrder_s9EssLb0ELb0EEENSA_IfLi4ELi24ELi32ELSB_9EssLb0ELb0EEESC_S8_EEEE	GPU-offline,vol=4096,parity=2,precision=2,order=9,Ns=2,Nc=768,TwistFlavor=1,comm=0011,computeVUV,MMA,dim=0,dir=fwd,nFace=1,bidirectional,GPU-device,coarse_vol=4x4x2x2	32	2	1	64	4	4	16384	2	0	0	0	0.000327936	# 9822.73 Gflop/s, 7392.62 GB/s, tuning took 0.011760 seconds at Mon Jul 11 18:32:48 2022
       16x16x4x4	N4quda10CalculateYILb1EL19QudaFieldLocation_s2ENS_13CalculateYArgILb1EfLi2ELi2ELi24ELi32ENS_5gauge10FieldOrderIfLi64ELi2EL21QudaGaugeFieldOrder_s13ELb1EsEENS4_IfLi64ELi2ELS5_13ELb1EiEENS4_IfLi48ELi2ELS5_13ELb1EsEENS_11colorspinor12FieldOrderCBIfLi2ELi24ELi32EL16QudaFieldOrder_s9EssLb0ELb0EEENSA_IfLi4ELi24ELi32ELSB_9EssLb0ELb0EEESC_S8_EEEE	GPU-offline,vol=4096,parity=2,precision=2,order=9,Ns=2,Nc=768,TwistFlavor=1,comm=0011,computeVUV,MMA,dim=1,dir=back,nFace=1,bidirectional,GPU-device,coarse_vol=4x4x2x2	32	2	1	64	4	4	16384	1	0	0	0	0.000213197	# 15109.16 Gflop/s, 11371.22 GB/s, tuning took 0.008838 seconds at Mon Jul 11 18:32:48 2022
       16x16x4x4	N4quda10CalculateYILb1EL19QudaFieldLocation_s2ENS_13CalculateYArgILb1EfLi2ELi2ELi24ELi32ENS_5gauge10FieldOrderIfLi64ELi2EL21QudaGaugeFieldOrder_s13ELb1EsEENS4_IfLi64ELi2ELS5_13ELb1EiEENS4_IfLi48ELi2ELS5_13ELb1EsEENS_11colorspinor12FieldOrderCBIfLi2ELi24ELi32EL16QudaFieldOrder_s9EssLb0ELb0EEENSA_IfLi4ELi24ELi32ELSB_9EssLb0ELb0EEESC_S8_EEEE	GPU-offline,vol=4096,parity=2,precision=2,order=9,Ns=2,Nc=768,TwistFlavor=1,comm=0011,computeVUV,MMA,dim=1,dir=fwd,nFace=1,bidirectional,GPU-device,coarse_vol=4x4x2x2	32	2	1	64	4	4	16384	1	0	0	0	0.000329216	# 9784.54 Gflop/s, 7363.88 GB/s, tuning took 0.011748 seconds at Mon Jul 11 18:32:48 2022
       16x16x4x4	N4quda10CalculateYILb1EL19QudaFieldLocation_s2ENS_13CalculateYArgILb1EfLi2ELi2ELi24ELi32ENS_5gauge10FieldOrderIfLi64ELi2EL21QudaGaugeFieldOrder_s13ELb1EsEENS4_IfLi64ELi2ELS5_13ELb1EiEENS4_IfLi48ELi2ELS5_13ELb1EsEENS_11colorspinor12FieldOrderCBIfLi2ELi24ELi32EL16QudaFieldOrder_s9EssLb0ELb0EEENSA_IfLi4ELi24ELi32ELSB_9EssLb0ELb0EEESC_S8_EEEE	GPU-offline,vol=4096,parity=2,precision=2,order=9,Ns=2,Nc=768,TwistFlavor=1,comm=0011,computeVUV,MMA,dim=2,dir=back,nFace=1,bidirectional,GPU-device,coarse_vol=4x4x2x2	32	2	1	64	4	4	16384	1	0	0	0	0.000252672	# 12748.65 Gflop/s, 9594.68 GB/s, tuning took 0.009142 seconds at Mon Jul 11 18:32:48 2022
       16x16x4x4	N4quda10CalculateYILb1EL19QudaFieldLocation_s2ENS_13CalculateYArgILb1EfLi2ELi2ELi24ELi32ENS_5gauge10FieldOrderIfLi64ELi2EL21QudaGaugeFieldOrder_s13ELb1EsEENS4_IfLi64ELi2ELS5_13ELb1EiEENS4_IfLi48ELi2ELS5_13ELb1EsEENS_11colorspinor12FieldOrderCBIfLi2ELi24ELi32EL16QudaFieldOrder_s9EssLb0ELb0EEENSA_IfLi4ELi24ELi32ELSB_9EssLb0ELb0EEESC_S8_EEEE	GPU-offline,vol=4096,parity=2,precision=2,order=9,Ns=2,Nc=768,TwistFlavor=1,comm=0011,computeVUV,MMA,dim=2,dir=fwd,nFace=1,bidirectional,GPU-device,coarse_vol=4x4x2x2	32	2	1	64	4	4	16384	2	0	0	0	0.000328192	# 9815.06 Gflop/s, 7386.86 GB/s, tuning took 0.011720 seconds at Mon Jul 11 18:32:48 2022
       16x16x4x4	N4quda10CalculateYILb1EL19QudaFieldLocation_s2ENS_13CalculateYArgILb1EfLi2ELi2ELi24ELi32ENS_5gauge10FieldOrderIfLi64ELi2EL21QudaGaugeFieldOrder_s13ELb1EsEENS4_IfLi64ELi2ELS5_13ELb1EiEENS4_IfLi48ELi2ELS5_13ELb1EsEENS_11colorspinor12FieldOrderCBIfLi2ELi24ELi32EL16QudaFieldOrder_s9EssLb0ELb0EEENSA_IfLi4ELi24ELi32ELSB_9EssLb0ELb0EEESC_S8_EEEE	GPU-offline,vol=4096,parity=2,precision=2,order=9,Ns=2,Nc=768,TwistFlavor=1,comm=0011,computeVUV,MMA,dim=3,dir=back,nFace=1,bidirectional,GPU-device,coarse_vol=4x4x2x2	32	2	1	64	4	4	16384	3	0	0	0	0.000255744	# 12595.51 Gflop/s, 9479.43 GB/s, tuning took 0.009200 seconds at Mon Jul 11 18:32:48 2022
       16x16x4x4	N4quda10CalculateYILb1EL19QudaFieldLocation_s2ENS_13CalculateYArgILb1EfLi2ELi2ELi24ELi32ENS_5gauge10FieldOrderIfLi64ELi2EL21QudaGaugeFieldOrder_s13ELb1EsEENS4_IfLi64ELi2ELS5_13ELb1EiEENS4_IfLi48ELi2ELS5_13ELb1EsEENS_11colorspinor12FieldOrderCBIfLi2ELi24ELi32EL16QudaFieldOrder_s9EssLb0ELb0EEENSA_IfLi4ELi24ELi32ELSB_9EssLb0ELb0EEESC_S8_EEEE	GPU-offline,vol=4096,parity=2,precision=2,order=9,Ns=2,Nc=768,TwistFlavor=1,comm=0011,computeVUV,MMA,dim=3,dir=fwd,nFace=1,bidirectional,GPU-device,coarse_vol=4x4x2x2	32	2	1	64	4	4	16384	2	0	0	0	0.000333141	# 9669.25 Gflop/s, 7277.11 GB/s, tuning took 0.010199 seconds at Mon Jul 11 18:32:48 2022
       16x16x4x4	N4quda10CopySpinorIffLi2ELi24ENS_11colorspinor12FieldOrderCBIfLi2ELi24ELi1EL16QudaFieldOrder_s2EffLb0ELb0EEES4_EE	GPU-offline,vol=4096,parity=2,precision=4,order=2,Ns=2,Nc=24,TwistFlavor=1	256	1	1	8	1	1	0	-1	-1	-1	-1	1.10436e-05	# 0.00 Gflop/s, 284.85 GB/s, tuning took 0.010963 seconds at Mon Jul 11 18:32:04 2022
       16x16x4x4	N4quda10CopySpinorIssLi2ELi768ENS_11colorspinor12FieldOrderCBIfLi2ELi768ELi1EL16QudaFieldOrder_s9EssLb0ELb0EEENS2_IfLi2ELi768ELi1ELS3_2EssLb0ELb0EEEEE	GPU-offline,vol=4096,parity=2,precision=2,order=2,Ns=2,Nc=768,TwistFlavor=1	192	1	1	11	1	1	0	-1	-1	-1	-1	0.000460459	# 0.00 Gflop/s, 109.38 GB/s, tuning took 0.141864 seconds at Mon Jul 11 18:32:47 2022
       16x16x4x4	N4quda11SpinorNoiseIfLi2ELi24EL16QudaFieldOrder_s2EEE	GPU-offline,vol=4096,parity=2,precision=4,order=2,Ns=2,Nc=24,TwistFlavor=1,uniform	64	1	1	32	2	1	1586	-1	-1	-1	-1	1.15103e-05	# 0.00 Gflop/s, 136.65 GB/s, tuning took 0.034042 seconds at Mon Jul 11 18:32:04 2022
       16x16x4x4	N4quda12ExtractGhostIsLi48ENS_5gauge10FieldOrderIfLi48ELi1EL21QudaGaugeFieldOrder_s2ELb0EsEEEE	GPU-offline,vol=4096stride=3072precision=2geometry=8Nc=48fine-grained,extract	128	1	4	8	48	2	0	-1	-1	-1	-1	9.56975e-05	# 0.00 Gflop/s, 493.07 GB/s, tuning took 1.106346 seconds at Mon Jul 11 18:31:41 2022
       16x16x4x4	N4quda12ExtractGhostIsLi48ENS_5gauge10FieldOrderIfLi48ELi1EL21QudaGaugeFieldOrder_s2ELb0EsEEEE	GPU-offline,vol=4096stride=3072precision=2geometry=8Nc=48fine-grained,inject	512	1	1	2	48	8	0	-1	-1	-1	-1	5.0432e-05	# 0.00 Gflop/s, 935.63 GB/s, tuning took 0.924308 seconds at Mon Jul 11 18:32:04 2022
       16x16x4x4	N4quda13CalculateYhatIL19QudaFieldLocation_s2EfNS_5gauge10FieldOrderIfLi48ELi1EL21QudaGaugeFieldOrder_s13ELb1EsEES5_NS3_IfLi48ELi1ELS4_13ELb1EfEELi48ELi4ELi2ELb0ELb1EEE	GPU-offline,vol=4096stride=3072precision=2geometry=8Nc=48,GPU-device,comm=0011,mma	8	1	1	256	24	96	0	0	0	0	0	0.000721579	# 39967.97 Gflop/s, 45199.38 GB/s, tuning took 0.005105 seconds at Mon Jul 11 18:31:58 2022
       16x16x4x4	N4quda13CalculateYhatIL19QudaFieldLocation_s2EfNS_5gauge10FieldOrderIfLi48ELi1EL21QudaGaugeFieldOrder_s13ELb1EsEES5_NS3_IfLi48ELi1ELS4_13ELb1EfEELi48ELi4ELi2ELb1ELb1EEE	GPU-offline,vol=4096stride=3072precision=2geometry=8Nc=48,GPU-device,comm=0011,mma,compute_max	8	1	1	256	24	96	0	0	0	0	0	0.000534869	# 53919.78 Gflop/s, 33876.30 GB/s, tuning took 0.003800 seconds at Mon Jul 11 18:31:58 2022
       16x16x4x4	N4quda4blas3ax_IfEE	GPU-offline,vol=4096,parity=2,precision=4,order=2,Ns=2,Nc=24,TwistFlavor=1	256	1	1	216	2	1	0	-1	-1	-1	-1	3.45717e-06	# 113.74 Gflop/s, 909.91 GB/s, tuning took 0.009416 seconds at Mon Jul 11 18:32:46 2022
       16x16x4x4	N4quda4blas4CdotIdfEE	GPU-offline,nParity=2,vol=4096,parity=2,precision=4,order=2,Ns=2,Nc=24,TwistFlavor=1	512	1	1	96	1	1	0	-1	-1	-1	-1	1.19769e-05	# 131.32 Gflop/s, 262.65 GB/s, tuning took 0.074879 seconds at Mon Jul 11 18:32:46 2022
       16x16x4x4	N4quda4blas5Norm2IdfEE	GPU-offline,nParity=2,vol=4096,parity=2,precision=4,order=2,Ns=2,Nc=24,TwistFlavor=1	800	1	1	64	1	1	0	-1	-1	-1	-1	1.06857e-05	# 73.60 Gflop/s, 147.19 GB/s, tuning took 0.070135 seconds at Mon Jul 11 18:32:46 2022
       16x16x4x4	N4quda4blas6caxpy_IfEE	GPU-offline,vol=4096,parity=2,precision=4,order=2,Ns=2,Nc=24,TwistFlavor=1	448	2	1	216	1	1	0	-1	-1	-1	-1	3.72506e-06	# 422.24 Gflop/s, 1266.72 GB/s, tuning took 0.009382 seconds at Mon Jul 11 18:32:46 2022
       16x16x4x4	N4quda7RNGInitE	GPU-offline,vol=4096,parity=2,precision=4,order=2,Ns=2,Nc=24,TwistFlavor=1	64	1	1	32	2	1	0	-1	-1	-1	-1	0.000311296	# 0.00 Gflop/s, 0.00 GB/s, tuning took 0.053638 seconds at Mon Jul 11 18:32:04 2022
       16x16x4x4	N4quda9CopyGaugeINS_12CopyGaugeArgIffLi4608ELb1ENS_5gauge10FieldOrderIfLi48ELi1EL21QudaGaugeFieldOrder_s13ELb1EfEENS3_IfLi48ELi1ELS4_2ELb1EsEEEEEE	GPU-offline,vol=4096stride=2048precision=2geometry=1Nc=48,vol=4096stride=2048precision=4geometry=1Nc=48,fine-grained	64	1	1	32	48	2	3511	-1	-1	-1	-1	0.000472064	# 0.00 Gflop/s, 239.90 GB/s, tuning took 1.486465 seconds at Mon Jul 11 18:31:40 2022
       16x16x4x4	N4quda9CopyGaugeINS_12CopyGaugeArgIffLi4608ELb1ENS_5gauge10FieldOrderIfLi48ELi1EL21QudaGaugeFieldOrder_s13ELb1EsEENS3_IfLi48ELi1ELS4_2ELb1EsEEEEEE	GPU-offline,vol=4096stride=2048precision=2geometry=1Nc=48,vol=4096stride=2048precision=2geometry=1Nc=48,fine-grained	256	1	1	8	48	2	16385	-1	-1	-1	-1	0.000400725	# 0.00 Gflop/s, 188.40 GB/s, tuning took 1.226159 seconds at Mon Jul 11 18:32:47 2022
       16x16x4x4	N4quda9CopyGaugeINS_12CopyGaugeArgIffLi4608ELb1ENS_5gauge10FieldOrderIfLi48ELi1EL21QudaGaugeFieldOrder_s13ELb1EsEENS3_IfLi48ELi1ELS4_2ELb1EsEEEEEE	GPU-offline,vol=4096stride=3072precision=2geometry=8Nc=48,vol=4096stride=3072precision=2geometry=8Nc=48,fine-grained	32	1	8	64	48	2	12289	-1	-1	-1	-1	0.00319966	# 0.00 Gflop/s, 283.15 GB/s, tuning took 15.071491 seconds at Mon Jul 11 18:31:57 2022
       16x16x4x4	N4quda9CopyGaugeINS_12CopyGaugeArgIffLi4608ELb1ENS_5gauge10FieldOrderIfLi48ELi1EL21QudaGaugeFieldOrder_s13ELb1EsEENS3_IfLi48ELi1ELS4_2ELb1EsEEEEEE	GPU-offline,vol=4096stride=3072precision=2geometry=8Nc=48,vol=4096stride=3072precision=2geometry=8Nc=48,fine-grained,ghost	128	1	7	4	48	2	0	-1	-1	-1	-1	0.000172715	# 0.00 Gflop/s, 819.60 GB/s, tuning took 0.990546 seconds at Mon Jul 11 18:31:58 2022
       16x16x4x4	N4quda9CopyGaugeINS_12CopyGaugeArgIffLi4608ELb1ENS_5gauge10FieldOrderIfLi48ELi1EL21QudaGaugeFieldOrder_s2ELb0EsEENS3_IfLi48ELi1ELS4_2ELb1EsEEEEEE	GPU-offline,vol=4096stride=3072precision=2geometry=8Nc=48,vol=4096stride=3072precision=2geometry=8Nc=48,fine-grained,ghost	256	1	1	2	48	8	0	-1	-1	-1	-1	5.28707e-05	# 0.00 Gflop/s, 2677.43 GB/s, tuning took 0.630296 seconds at Mon Jul 11 18:32:03 2022
       16x16x4x4	N4quda9CopyGaugeINS_12CopyGaugeArgIffLi4608ELb1ENS_5gauge10FieldOrderIfLi48ELi1EL21QudaGaugeFieldOrder_s2ELb1EsEENS3_IfLi48ELi1ELS4_13ELb1EfEEEEEE	GPU-offline,vol=4096stride=2048precision=4geometry=1Nc=48,vol=4096stride=2048precision=2geometry=1Nc=48,fine-grained	32	4	1	64	12	2	3073	-1	-1	-1	-1	0.000122539	# 0.00 Gflop/s, 924.17 GB/s, tuning took 0.439617 seconds at Mon Jul 11 18:31:40 2022
       16x16x4x4	N4quda9CopyGaugeINS_12CopyGaugeArgIffLi4608ELb1ENS_5gauge10FieldOrderIfLi48ELi1EL21QudaGaugeFieldOrder_s2ELb1EsEENS3_IfLi48ELi1ELS4_13ELb1EsEEEEEE	GPU-offline,vol=4096stride=3072precision=2geometry=8Nc=48,vol=4096stride=3072precision=2geometry=8Nc=48,fine-grained	32	2	1	64	24	16	1586	-1	-1	-1	-1	0.00064512	# 0.00 Gflop/s, 1404.34 GB/s, tuning took 3.491682 seconds at Mon Jul 11 18:32:02 2022
       16x16x4x4	N4quda9CopyGaugeINS_12CopyGaugeArgIffLi4608ELb1ENS_5gauge10FieldOrderIfLi48ELi1EL21QudaGaugeFieldOrder_s2ELb1EsEENS3_IfLi48ELi1ELS4_13ELb1EsEEEEEE	GPU-offline,vol=4096stride=3072precision=2geometry=8Nc=48,vol=4096stride=3072precision=2geometry=8Nc=48,fine-grained,ghost	32	12	1	16	4	8	16385	-1	-1	-1	-1	6.04762e-05	# 0.00 Gflop/s, 2340.72 GB/s, tuning took 0.353140 seconds at Mon Jul 11 18:32:02 2022
       16x16x4x4	N4quda9CopyGaugeINS_12CopyGaugeArgIffLi4608ELb1ENS_5gauge10FieldOrderIfLi48ELi1EL21QudaGaugeFieldOrder_s2ELb1EsEENS3_IfLi48ELi1ELS4_2ELb0EsEEEEEE	GPU-offline,vol=4096stride=3072precision=2geometry=8Nc=48,vol=4096stride=3072precision=2geometry=8Nc=48,fine-grained,ghost	256	1	1	2	48	8	0	-1	-1	-1	-1	5.41103e-05	# 0.00 Gflop/s, 2616.10 GB/s, tuning took 0.633100 seconds at Mon Jul 11 18:31:42 2022
       16x16x4x4	N4quda9GhostPackIssL16QudaFieldOrder_s9ELi2ELi768EEE	GPU-offline,vol=4096,parity=2,precision=2,order=9,Ns=2,Nc=768,TwistFlavor=1,halo_prec=2,comm=0011,topo=1148,order=0123,dest=00001111,nFace=1,spins_per_thread=2,colors_per_thread=2,shmem=0	32	16	1	64	24	2	0	-1	-1	-1	-1	0.000183125	# 0.00 Gflop/s, 137.42 GB/s, tuning took 0.124363 seconds at Mon Jul 11 18:32:47 2022
16x16x4x4,32x64x16x16	N4quda16ProlongateLaunchIfsLi4ELi3ELi2ELi24EEE	GPU-offline,vol=4096,parity=2,precision=4,order=2,Ns=2,Nc=24,TwistFlavor=1,vol=524288,parity=1,precision=4,order=2,Ns=4,Nc=3,TwistFlavor=1	128	1	1	4096	1	3	0	-1	-1	-1	-1	0.000513707	# 2351.46 Gflop/s, 1284.93 GB/s, tuning took 0.739382 seconds at Mon Jul 11 18:33:05 2022
        29360128	N4quda15TransformReduceINS_7maximumIdEEKNS_7complexIdEEmNS_8abs_max_IddEENS_8identityEEE	GPU-offline,batch_size=1	1024	1	1	216	1	1	0	-1	-1	-1	-1	0.000336213	# 0.00 Gflop/s, 1397.21 GB/s, tuning took 1.912220 seconds at Mon Jul 11 18:22:55 2022
        29360128	N4quda15TransformReduceINS_7maximumIfEEKNS_7complexIfEEmNS_8abs_max_IffEENS_8identityEEE	GPU-offline,batch_size=1	1024	1	1	192	1	1	0	-1	-1	-1	-1	0.000179883	# 0.00 Gflop/s, 1305.75 GB/s, tuning took 1.810903 seconds at Mon Jul 11 18:22:57 2022
         2x4x2x2	N4quda10CopySpinorIffLi2ELi32ENS_11colorspinor12FieldOrderCBIfLi2ELi32ELi1EL16QudaFieldOrder_s2EffLb0ELb0EEES4_EE	GPU-offline,vol=32,parity=1,precision=4,order=2,Ns=2,Nc=32,TwistFlavor=1	96	1	1	1	1	1	0	-1	-1	-1	-1	1.28731e-05	# 0.00 Gflop/s, 2.55 GB/s, tuning took 0.011163 seconds at Mon Jul 11 18:33:03 2022
         2x4x2x2	N4quda12DslashCoarseIfssLi2ELi32ELb0ELb1ELb0ELNS_10DslashTypeE2EEE	policy_kernel,GPU-offline,vol=32,parity=1,precision=4,order=2,Ns=2,Nc=32,TwistFlavor=1,comm=0011,full,halo=00001111	128	1	2	2	1	32	9831	8	1	1	1	4.68025e-06	# 223.17 Gflop/s, 119.02 GB/s, tuning took 0.058455 seconds at Mon Jul 11 18:33:03 2022
         2x4x2x2	N4quda12DslashCoarseIfssLi2ELi32ELb0ELb1ELb0ELNS_10DslashTypeE2EEE	policy_kernel,GPU-offline,vol=32,parity=1,precision=4,order=2,Ns=2,Nc=32,TwistFlavor=1,comm=0011,full,halo=00002222	128	1	2	2	1	32	4096	8	1	1	1	4.71166e-06	# 221.68 Gflop/s, 118.23 GB/s, tuning took 0.058461 seconds at Mon Jul 11 18:33:03 2022
         2x4x2x2	N4quda12DslashCoarseIfssLi2ELi32ELb1ELb0ELb0ELNS_10DslashTypeE2EEE	policy_kernel,GPU-offline,vol=32,parity=1,precision=4,order=2,Ns=2,Nc=32,TwistFlavor=1,comm=0011,full,halo=00001111	96	1	4	3	1	32	6144	8	2	1	1	8.704e-06	# 963.29 Gflop/s, 498.82 GB/s, tuning took 0.095227 seconds at Mon Jul 11 18:33:03 2022
         2x4x2x2	N4quda12DslashCoarseIfssLi2ELi32ELb1ELb0ELb0ELNS_10DslashTypeE2EEE	policy_kernel,GPU-offline,vol=32,parity=1,precision=4,order=2,Ns=2,Nc=32,TwistFlavor=1,comm=0011,full,halo=00002222	32	1	12	4	1	11	24577	4	2	1	1	2.04364e-05	# 410.27 Gflop/s, 212.45 GB/s, tuning took 0.151870 seconds at Mon Jul 11 18:33:03 2022
         2x4x2x2	N4quda22DslashCoarsePolicyTuneINS_18DslashCoarseLaunchILb0EEEEE	policy,clover,vol=32,parity=1,precision=4,order=2,Ns=2,Nc=32,TwistFlavor=1,gauge_prec=2,halo_prec=2,comm=0011,topo=1148,order=0123,p2p=7,gdr=1,nvshmem=0,pol=11110011111,full	32	1	1	1	1	1	0	2	0	0	0	4.71166e-06	# 221.68 Gflop/s, 118.23 GB/s, tuning took 0.007551 seconds at Mon Jul 11 18:33:03 2022
         2x4x2x2	N4quda22DslashCoarsePolicyTuneINS_18DslashCoarseLaunchILb0EEEEE	policy,dslash,vol=32,parity=1,precision=4,order=2,Ns=2,Nc=32,TwistFlavor=1,gauge_prec=2,halo_prec=2,comm=0011,topo=1148,order=0123,p2p=7,gdr=1,nvshmem=0,pol=11110011111,full	32	1	1	1	1	1	0	9	0	0	0	4.13607e-05	# 202.72 Gflop/s, 104.97 GB/s, tuning took 0.020962 seconds at Mon Jul 11 18:33:03 2022
         2x4x2x2	N4quda4blas11multicaxpy_IfEE	GPU-offline,vol=32,parity=1,precision=4,order=2,Ns=2,Nc=32,TwistFlavor=1,Nxz=4,Nyw=1	128	1	1	216	1	1	0	1	0	0	0	7.6847e-06	# 8.53 Gflop/s, 12.79 GB/s, tuning took 0.010212 seconds at Mon Jul 11 18:33:04 2022
         2x4x2x2	N4quda4blas12TileSizeTuneINS0_9multiCdotES2_St7complexIdEEE	nested_policy,vol=32,parity=1,precision=4,order=2,Ns=2,Nc=32,TwistFlavor=1,vol=32,parity=1,precision=4,order=2,Ns=2,Nc=32,TwistFlavor=1,n=4,m=5,multi-blas-n=4,max_nyw_tile=8	32	1	1	1	1	1	0	4	5	0	0	1.29052e-05	# 0.00 Gflop/s, 0.00 GB/s, tuning took 0.023469 seconds at Mon Jul 11 18:33:03 2022
         2x4x2x2	N4quda4blas12TileSizeTuneINS0_9multiCdotES2_St7complexIdEEE	nested_policy,vol=32,parity=1,precision=4,order=2,Ns=2,Nc=32,TwistFlavor=1,vol=32,parity=1,precision=4,order=2,Ns=2,Nc=32,TwistFlavor=1,n=5,m=4,multi-blas-n=4,max_nyw_tile=8	32	1	1	1	1	1	0	4	4	0	0	2.39017e-05	# 0.00 Gflop/s, 0.00 GB/s, tuning took 0.013178 seconds at Mon Jul 11 18:33:04 2022
         2x4x2x2	N4quda4blas13TransposeTuneINS0_9multiCdotES2_St7complexIdEEE	policy,vol=32,parity=1,precision=4,order=2,Ns=2,Nc=32,TwistFlavor=1,vol=32,parity=1,precision=4,order=2,Ns=2,Nc=32,TwistFlavor=1,n=4,m=5,multi-blas-n=4,max_nyw_tile=8	32	1	1	1	1	1	0	0	0	0	0	1.35078e-05	# 0.00 Gflop/s, 0.00 GB/s, tuning took 0.002817 seconds at Mon Jul 11 18:33:04 2022
         2x4x2x2	N4quda4blas5Norm2IdfEE	GPU-offline,nParity=1,vol=32,parity=1,precision=4,order=2,Ns=2,Nc=32,TwistFlavor=1	1024	1	1	1	1	1	0	-1	-1	-1	-1	8.28595e-06	# 0.99 Gflop/s, 1.98 GB/s, tuning took 0.010897 seconds at Mon Jul 11 18:33:03 2022
         2x4x2x2	N4quda4blas7axpbyz_IfEE	GPU-offline,vol=32,parity=1,precision=4,order=2,Ns=2,Nc=32,TwistFlavor=1	608	1	1	216	1	1	0	-1	-1	-1	-1	2.77943e-06	# 4.42 Gflop/s, 17.68 GB/s, tuning took 0.007949 seconds at Mon Jul 11 18:33:03 2022
         2x4x2x2	N4quda4blas9multiCdotIdfEE	policy_kernel,GPU-offline,nParity=1,vol=32,parity=1,precision=4,order=2,Ns=2,Nc=32,TwistFlavor=1,Nxz=1,Nyw=1,max_nyw_tile=8	512	1	1	1	1	1	0	-1	-1	-1	-1	9.42498e-06	# 1.74 Gflop/s, 3.48 GB/s, tuning took 0.007183 seconds at Mon Jul 11 18:33:03 2022
         2x4x2x2	N4quda4blas9multiCdotIdfEE	policy_kernel,GPU-offline,nParity=1,vol=32,parity=1,precision=4,order=2,Ns=2,Nc=32,TwistFlavor=1,Nxz=1,Nyw=1,max_nyw_tile=8,norm	512	1	1	1	1	1	0	-1	-1	-1	-1	9.33094e-06	# 1.76 Gflop/s, 3.51 GB/s, tuning took 0.007157 seconds at Mon Jul 11 18:33:03 2022
         2x4x2x2	N4quda4blas9multiCdotIdfEE	policy_kernel,GPU-offline,nParity=1,vol=32,parity=1,precision=4,order=2,Ns=2,Nc=32,TwistFlavor=1,Nxz=1,Nyw=2,max_nyw_tile=8	512	1	1	1	1	2	0	-1	-1	-1	-1	9.42478e-06	# 3.48 Gflop/s, 6.95 GB/s, tuning took 0.012402 seconds at Mon Jul 11 18:33:03 2022
         2x4x2x2	N4quda4blas9multiCdotIdfEE	policy_kernel,GPU-offline,nParity=1,vol=32,parity=1,precision=4,order=2,Ns=2,Nc=32,TwistFlavor=1,Nxz=2,Nyw=1,max_nyw_tile=8	512	1	1	1	1	1	0	-1	-1	-1	-1	1.03781e-05	# 3.16 Gflop/s, 4.74 GB/s, tuning took 0.007139 seconds at Mon Jul 11 18:33:03 2022
         2x4x2x2	N4quda4blas9multiCdotIdfEE	policy_kernel,GPU-offline,nParity=1,vol=32,parity=1,precision=4,order=2,Ns=2,Nc=32,TwistFlavor=1,Nxz=2,Nyw=2,max_nyw_tile=8	512	1	1	1	1	2	0	-1	-1	-1	-1	1.04356e-05	# 6.28 Gflop/s, 9.42 GB/s, tuning took 0.011887 seconds at Mon Jul 11 18:33:03 2022
         2x4x2x2	N4quda4blas9multiCdotIdfEE	policy_kernel,GPU-offline,nParity=1,vol=32,parity=1,precision=4,order=2,Ns=2,Nc=32,TwistFlavor=1,Nxz=2,Nyw=2,max_nyw_tile=8,norm	512	1	1	1	1	2	0	-1	-1	-1	-1	1.02515e-05	# 6.39 Gflop/s, 9.59 GB/s, tuning took 0.012057 seconds at Mon Jul 11 18:33:03 2022
         2x4x2x2	N4quda4blas9multiCdotIdfEE	policy_kernel,GPU-offline,nParity=1,vol=32,parity=1,precision=4,order=2,Ns=2,Nc=32,TwistFlavor=1,Nxz=2,Nyw=4,max_nyw_tile=8	512	1	1	1	1	4	0	-1	-1	-1	-1	1.09508e-05	# 11.97 Gflop/s, 17.95 GB/s, tuning took 0.011354 seconds at Mon Jul 11 18:33:03 2022
         2x4x2x2	N4quda4blas9multiCdotIdfEE	policy_kernel,GPU-offline,nParity=1,vol=32,parity=1,precision=4,order=2,Ns=2,Nc=32,TwistFlavor=1,Nxz=3,Nyw=4,max_nyw_tile=8	512	1	1	1	1	4	0	-1	-1	-1	-1	1.17011e-05	# 16.80 Gflop/s, 22.40 GB/s, tuning took 0.012496 seconds at Mon Jul 11 18:33:03 2022
         2x4x2x2	N4quda4blas9multiCdotIdfEE	policy_kernel,GPU-offline,nParity=1,vol=32,parity=1,precision=4,order=2,Ns=2,Nc=32,TwistFlavor=1,Nxz=4,Nyw=2,max_nyw_tile=8	512	1	1	1	1	2	0	-1	-1	-1	-1	1.15492e-05	# 11.35 Gflop/s, 14.19 GB/s, tuning took 0.013330 seconds at Mon Jul 11 18:33:03 2022
         2x4x2x2	N4quda4blas9multiCdotIdfEE	policy_kernel,GPU-offline,nParity=1,vol=32,parity=1,precision=4,order=2,Ns=2,Nc=32,TwistFlavor=1,Nxz=4,Nyw=3,max_nyw_tile=8	512	1	1	1	1	3	0	-1	-1	-1	-1	1.22206e-05	# 16.09 Gflop/s, 20.11 GB/s, tuning took 0.012138 seconds at Mon Jul 11 18:33:03 2022
         2x4x2x2	N4quda4blas9multiCdotIdfEE	policy_kernel,GPU-offline,nParity=1,vol=32,parity=1,precision=4,order=2,Ns=2,Nc=32,TwistFlavor=1,Nxz=4,Nyw=5,max_nyw_tile=8	512	1	1	1	1	5	0	-1	-1	-1	-1	1.23419e-05	# 26.55 Gflop/s, 33.19 GB/s, tuning took 0.012766 seconds at Mon Jul 11 18:33:03 2022
         2x4x2x2	N4quda9GhostPackIfsL16QudaFieldOrder_s2ELi2ELi32EEE	GPU-offline,vol=32,parity=1,precision=4,order=2,Ns=2,Nc=32,TwistFlavor=1,halo_prec=2,comm=0011,topo=1148,order=0123,dest=00001111,nFace=1,spins_per_thread=2,colors_per_thread=2,shmem=0	32	16	1	2	1	1	4096	-1	-1	-1	-1	4.74935e-06	# 0.00 Gflop/s, 10.35 GB/s, tuning took 0.009819 seconds at Mon Jul 11 18:33:03 2022
         2x4x2x2	N4quda9GhostPackIfsL16QudaFieldOrder_s2ELi2ELi32EEE	GPU-offline,vol=32,parity=1,precision=4,order=2,Ns=2,Nc=32,TwistFlavor=1,halo_prec=2,comm=0011,topo=1148,order=0123,dest=00002222,nFace=1,spins_per_thread=2,colors_per_thread=2,shmem=0	32	16	1	2	1	1	4096	-1	-1	-1	-1	7.13238e-06	# 0.00 Gflop/s, 6.89 GB/s, tuning took 0.010408 seconds at Mon Jul 11 18:33:03 2022
         3145728	N4quda15TransformReduceINS_7maximumIfEENS_7complexIsEEjNS_8abs_max_IfsEENS_8identityEEE	GPU-offline,batch_size=2	512	1	1	216	1	2	0	-1	-1	-1	-1	2.0057e-05	# 0.00 Gflop/s, 1254.71 GB/s, tuning took 0.124844 seconds at Mon Jul 11 18:32:46 2022
     32x64x16x16	N4quda11TwistCloverIfLi3EEE	GPU-offline,vol=524288,parity=1,precision=4,order=4,Ns=4,Nc=3,TwistFlavor=1,inverse	128	1	1	4096	1	1	0	-1	-1	-1	-1	0.000174592	# 3171.10 Gflop/s, 1249.22 GB/s, tuning took 0.177210 seconds at Mon Jul 11 18:26:52 2022
     32x64x16x16	N4quda11TwistCloverIsLi3EEE	GPU-offline,vol=524288,parity=1,precision=2,order=8,Ns=4,Nc=3,TwistFlavor=1,inverse	32	1	1	16384	1	1	0	-1	-1	-1	-1	0.000124416	# 4449.98 Gflop/s, 910.22 GB/s, tuning took 0.137682 seconds at Mon Jul 11 18:27:47 2022
     32x64x16x16	N4quda13TwistedCloverINS_15WilsonCloverArgIdLi3ELi4EL21QudaReconstructType_s18ELb1EEEEE	policy,commDim=0011,xpay,dagger,parity=1,topo=1148,order=0123,p2p=7,gdr=1,nvshmem=0,pol=111111111111110000	32	1	1	1	1	1	0	3	1	0	-1	0.00104789	# 960.63 Gflop/s, 1633.06 GB/s, tuning took 0.146366 seconds at Mon Jul 11 18:26:05 2022
     32x64x16x16	N4quda13TwistedCloverINS_15WilsonCloverArgIdLi3ELi4EL21QudaReconstructType_s18ELb1EEEEE	policy,commDim=0011,xpay,parity=1,topo=1148,order=0123,p2p=7,gdr=1,nvshmem=0,pol=111111111111110000	32	1	1	1	1	1	0	11	1	0	-1	0.00104619	# 962.19 Gflop/s, 1635.73 GB/s, tuning took 0.146038 seconds at Mon Jul 11 18:26:36 2022
     32x64x16x16	N4quda13TwistedCloverINS_15WilsonCloverArgIdLi3ELi4EL21QudaReconstructType_s18ELb1EEEEE	policy_kernel=exterior_all,commDim=0011,xpay,dagger,parity=1	96	1	1	1366	1	1	12840	-1	-1	-1	-1	6.6176e-05	# 404.05 Gflop/s, 1235.93 GB/s, tuning took 0.094613 seconds at Mon Jul 11 18:25:51 2022
     32x64x16x16	N4quda13TwistedCloverINS_15WilsonCloverArgIdLi3ELi4EL21QudaReconstructType_s18ELb1EEEEE	policy_kernel=exterior_all,commDim=0011,xpay,dagger,parity=1,zero_copy,p2p=1	32	1	1	4096	1	1	15174	-1	-1	-1	-1	0.000268288	# 99.66 Gflop/s, 304.85 GB/s, tuning took 0.323060 seconds at Mon Jul 11 18:25:52 2022
     32x64x16x16	N4quda13TwistedCloverINS_15WilsonCloverArgIdLi3ELi4EL21QudaReconstructType_s18ELb1EEEEE	policy_kernel=exterior_all,commDim=0011,xpay,parity=1	64	1	1	2048	1	1	5756	-1	-1	-1	-1	6.496e-05	# 411.62 Gflop/s, 1259.07 GB/s, tuning took 0.093319 seconds at Mon Jul 11 18:26:22 2022
     32x64x16x16	N4quda13TwistedCloverINS_15WilsonCloverArgIdLi3ELi4EL21QudaReconstructType_s18ELb1EEEEE	policy_kernel=exterior_all,commDim=0011,xpay,parity=1,zero_copy,p2p=1	64	1	1	2048	1	1	27819	-1	-1	-1	-1	0.000267264	# 100.05 Gflop/s, 306.02 GB/s, tuning took 0.321482 seconds at Mon Jul 11 18:26:23 2022
     32x64x16x16	N4quda13TwistedCloverINS_15WilsonCloverArgIdLi3ELi4EL21QudaReconstructType_s18ELb1EEEEE	policy_kernel=exterior_t,commDim=0011,xpay,dagger,parity=1	160	1	1	410	1	1	16692	-1	-1	-1	-1	1.57661e-05	# 847.98 Gflop/s, 2593.83 GB/s, tuning took 0.040128 seconds at Mon Jul 11 18:25:51 2022
     32x64x16x16	N4quda13TwistedCloverINS_15WilsonCloverArgIdLi3ELi4EL21QudaReconstructType_s18ELb1EEEEE	policy_kernel=exterior_t,commDim=0011,xpay,dagger,parity=1,zero_copy,p2p=1	16	1	1	4096	1	1	41729	-1	-1	-1	-1	0.000248832	# 53.73 Gflop/s, 164.35 GB/s, tuning took 0.318276 seconds at Mon Jul 11 18:25:51 2022
     32x64x16x16	N4quda13TwistedCloverINS_15WilsonCloverArgIdLi3ELi4EL21QudaReconstructType_s18ELb1EEEEE	policy_kernel=exterior_t,commDim=0011,xpay,parity=1	160	1	1	410	1	1	33383	-1	-1	-1	-1	2.08584e-05	# 640.96 Gflop/s, 1960.57 GB/s, tuning took 0.047071 seconds at Mon Jul 11 18:26:22 2022
     32x64x16x16	N4quda13TwistedCloverINS_15WilsonCloverArgIdLi3ELi4EL21QudaReconstructType_s18ELb1EEEEE	policy_kernel=exterior_t,commDim=0011,xpay,parity=1,zero_copy,p2p=1	16	1	1	4096	1	1	41729	-1	-1	-1	-1	0.000249856	# 53.51 Gflop/s, 163.67 GB/s, tuning took 0.316287 seconds at Mon Jul 11 18:26:22 2022
     32x64x16x16	N4quda13TwistedCloverINS_15WilsonCloverArgIdLi3ELi4EL21QudaReconstructType_s18ELb1EEEEE	policy_kernel=exterior_z,commDim=0011,xpay,dagger,parity=1	112	1	1	586	1	1	11923	-1	-1	-1	-1	1.62251e-05	# 823.99 Gflop/s, 2520.44 GB/s, tuning took 0.038549 seconds at Mon Jul 11 18:25:51 2022
     32x64x16x16	N4quda13TwistedCloverINS_15WilsonCloverArgIdLi3ELi4EL21QudaReconstructType_s18ELb1EEEEE	policy_kernel=exterior_z,commDim=0011,xpay,dagger,parity=1,zero_copy,p2p=1	112	1	1	586	1	1	10433	-1	-1	-1	-1	1.62781e-05	# 821.31 Gflop/s, 2512.24 GB/s, tuning took 0.038548 seconds at Mon Jul 11 18:25:51 2022
     32x64x16x16	N4quda13TwistedCloverINS_15WilsonCloverArgIdLi3ELi4EL21QudaReconstructType_s18ELb1EEEEE	policy_kernel=exterior_z,commDim=0011,xpay,parity=1	96	1	1	683	1	1	27819	-1	-1	-1	-1	1.56672e-05	# 853.33 Gflop/s, 2610.20 GB/s, tuning took 0.038043 seconds at Mon Jul 11 18:26:22 2022
     32x64x16x16	N4quda13TwistedCloverINS_15WilsonCloverArgIdLi3ELi4EL21QudaReconstructType_s18ELb1EEEEE	policy_kernel=exterior_z,commDim=0011,xpay,parity=1,zero_copy,p2p=1	128	1	1	512	1	1	16692	-1	-1	-1	-1	1.56672e-05	# 853.33 Gflop/s, 2610.20 GB/s, tuning took 0.037984 seconds at Mon Jul 11 18:26:22 2022
     32x64x16x16	N4quda13TwistedCloverINS_15WilsonCloverArgIdLi3ELi4EL21QudaReconstructType_s18ELb1EEEEE	policy_kernel=interior,comm=0011,commDim=0011,xpay,dagger,parity=1	352	1	1	1490	1	1	55638	-1	-1	-1	-1	0.000925696	# 1065.35 Gflop/s, 1760.28 GB/s, tuning took 1.023697 seconds at Mon Jul 11 18:25:51 2022
     32x64x16x16	N4quda13TwistedCloverINS_15WilsonCloverArgIdLi3ELi4EL21QudaReconstructType_s18ELb1EEEEE	policy_kernel=interior,comm=0011,commDim=0011,xpay,dagger,parity=1,host-device	32	1	1	16384	1	1	16692	5	-1	-1	-1	0.000951296	# 1038.33 Gflop/s, 1752.59 GB/s, tuning took 6.746242 seconds at Mon Jul 11 18:25:58 2022
     32x64x16x16	N4quda13TwistedCloverINS_15WilsonCloverArgIdLi3ELi4EL21QudaReconstructType_s18ELb1EEEEE	policy_kernel=interior,comm=0011,commDim=0011,xpay,dagger,parity=1,host-remote	32	1	1	16384	1	1	16692	5	-1	-1	-1	0.000946517	# 1043.57 Gflop/s, 1761.44 GB/s, tuning took 6.722180 seconds at Mon Jul 11 18:26:05 2022
     32x64x16x16	N4quda13TwistedCloverINS_15WilsonCloverArgIdLi3ELi4EL21QudaReconstructType_s18ELb1EEEEE	policy_kernel=interior,comm=0011,commDim=0011,xpay,parity=1	384	1	1	1366	1	1	33383	-1	-1	-1	-1	0.000927403	# 1063.38 Gflop/s, 1757.04 GB/s, tuning took 1.028341 seconds at Mon Jul 11 18:26:22 2022
     32x64x16x16	N4quda13TwistedCloverINS_15WilsonCloverArgIdLi3ELi4EL21QudaReconstructType_s18ELb1EEEEE	policy_kernel=interior,comm=0011,commDim=0011,xpay,parity=1,host-device	32	1	1	16384	1	1	16692	5	-1	-1	-1	0.000955392	# 1033.88 Gflop/s, 1745.08 GB/s, tuning took 6.771509 seconds at Mon Jul 11 18:26:30 2022
     32x64x16x16	N4quda13TwistedCloverINS_15WilsonCloverArgIdLi3ELi4EL21QudaReconstructType_s18ELb1EEEEE	policy_kernel=interior,comm=0011,commDim=0011,xpay,parity=1,host-remote	32	1	1	16384	1	1	16692	5	-1	-1	-1	0.000950613	# 1039.08 Gflop/s, 1753.85 GB/s, tuning took 6.747667 seconds at Mon Jul 11 18:26:36 2022
     32x64x16x16	N4quda13TwistedCloverINS_15WilsonCloverArgIfLi3ELi4EL21QudaReconstructType_s18ELb1EEEEE	policy,commDim=0011,xpay,parity=1,topo=1148,order=0123,p2p=7,gdr=1,nvshmem=0,pol=111111111111110000	32	1	1	1	1	1	0	5	1	0	-1	0.000518485	# 1941.49 Gflop/s, 1650.26 GB/s, tuning took 0.081299 seconds at Mon Jul 11 18:33:21 2022
     32x64x16x16	N4quda13TwistedCloverINS_15WilsonCloverArgIfLi3ELi4EL21QudaReconstructType_s18ELb1EEEEE	policy_kernel=exterior_all,commDim=0011,xpay,parity=1	160	1	1	820	1	1	33383	-1	-1	-1	-1	1.78524e-05	# 1497.77 Gflop/s, 2290.70 GB/s, tuning took 0.046048 seconds at Mon Jul 11 18:33:13 2022
     32x64x16x16	N4quda13TwistedCloverINS_15WilsonCloverArgIfLi3ELi4EL21QudaReconstructType_s18ELb1EEEEE	policy_kernel=exterior_all,commDim=0011,xpay,parity=1,zero_copy,p2p=1	176	1	1	745	1	1	15174	-1	-1	-1	-1	0.00012992	# 205.81 Gflop/s, 314.77 GB/s, tuning took 0.191305 seconds at Mon Jul 11 18:33:13 2022
     32x64x16x16	N4quda13TwistedCloverINS_15WilsonCloverArgIfLi3ELi4EL21QudaReconstructType_s18ELb1EEEEE	policy_kernel=exterior_t,commDim=0011,xpay,parity=1	16	1	1	4096	1	1	6677	-1	-1	-1	-1	1.03846e-05	# 1287.42 Gflop/s, 1969.00 GB/s, tuning took 0.033163 seconds at Mon Jul 11 18:33:12 2022
     32x64x16x16	N4quda13TwistedCloverINS_15WilsonCloverArgIfLi3ELi4EL21QudaReconstructType_s18ELb1EEEEE	policy_kernel=exterior_t,commDim=0011,xpay,parity=1,zero_copy,p2p=1	32	1	1	2048	1	1	83457	-1	-1	-1	-1	0.000128384	# 104.14 Gflop/s, 159.27 GB/s, tuning took 0.192563 seconds at Mon Jul 11 18:33:13 2022
     32x64x16x16	N4quda13TwistedCloverINS_15WilsonCloverArgIfLi3ELi4EL21QudaReconstructType_s18ELb1EEEEE	policy_kernel=exterior_z,commDim=0011,xpay,parity=1	16	1	1	4096	1	1	6677	-1	-1	-1	-1	1.0228e-05	# 1307.14 Gflop/s, 1999.15 GB/s, tuning took 0.032802 seconds at Mon Jul 11 18:33:12 2022
     32x64x16x16	N4quda13TwistedCloverINS_15WilsonCloverArgIfLi3ELi4EL21QudaReconstructType_s18ELb1EEEEE	policy_kernel=exterior_z,commDim=0011,xpay,parity=1,zero_copy,p2p=1	16	1	1	4096	1	1	6677	-1	-1	-1	-1	1.02039e-05	# 1310.22 Gflop/s, 2003.87 GB/s, tuning took 0.032478 seconds at Mon Jul 11 18:33:13 2022
     32x64x16x16	N4quda13TwistedCloverINS_15WilsonCloverArgIfLi3ELi4EL21QudaReconstructType_s18ELb1EEEEE	policy_kernel=interior,comm=0011,commDim=0011,xpay,parity=1	224	1	1	2341	1	1	23845	-1	-1	-1	-1	0.000451584	# 2183.84 Gflop/s, 1804.19 GB/s, tuning took 0.570480 seconds at Mon Jul 11 18:33:12 2022
     32x64x16x16	N4quda13TwistedCloverINS_15WilsonCloverArgIfLi3ELi4EL21QudaReconstructType_s18ELb1EEEEE	policy_kernel=interior,comm=0011,commDim=0011,xpay,parity=1,host-device	64	1	1	8192	1	1	23845	3	-1	-1	-1	0.000461824	# 2138.82 Gflop/s, 1805.06 GB/s, tuning took 3.936138 seconds at Mon Jul 11 18:33:17 2022
     32x64x16x16	N4quda13TwistedCloverINS_15WilsonCloverArgIfLi3ELi4EL21QudaReconstructType_s18ELb1EEEEE	policy_kernel=interior,comm=0011,commDim=0011,xpay,parity=1,host-remote	64	1	1	8192	1	1	23845	3	-1	-1	-1	0.000458411	# 2154.75 Gflop/s, 1818.50 GB/s, tuning took 3.912972 seconds at Mon Jul 11 18:33:21 2022
     32x64x16x16	N4quda13TwistedCloverINS_15WilsonCloverArgIsLi3ELi4EL21QudaReconstructType_s18ELb1EEEEE	policy,commDim=0011,xpay,dagger,parity=1,topo=1148,order=0123,p2p=7,gdr=1,nvshmem=0,pol=111111111111110000	32	1	1	1	1	1	0	4	1	0	-1	0.000296192	# 3398.58 Gflop/s, 1515.20 GB/s, tuning took 0.049062 seconds at Mon Jul 11 18:25:18 2022
     32x64x16x16	N4quda13TwistedCloverINS_15WilsonCloverArgIsLi3ELi4EL21QudaReconstructType_s18ELb1EEEEE	policy,commDim=0011,xpay,parity=1,topo=1148,order=0123,p2p=7,gdr=1,nvshmem=0,pol=111111111111110000	32	1	1	1	1	1	0	5	1	0	-1	0.000292864	# 3437.20 Gflop/s, 1532.42 GB/s, tuning took 0.048818 seconds at Mon Jul 11 18:25:33 2022
     32x64x16x16	N4quda13TwistedCloverINS_15WilsonCloverArgIsLi3ELi4EL21QudaReconstructType_s18ELb1EEEEE	policy_kernel=exterior_all,commDim=0011,xpay,dagger,parity=1	64	1	1	2048	1	1	5385	-1	-1	-1	-1	1.29317e-05	# 2067.69 Gflop/s, 1682.53 GB/s, tuning took 0.040344 seconds at Mon Jul 11 18:25:12 2022
     32x64x16x16	N4quda13TwistedCloverINS_15WilsonCloverArgIsLi3ELi4EL21QudaReconstructType_s18ELb1EEEEE	policy_kernel=exterior_all,commDim=0011,xpay,dagger,parity=1,zero_copy,p2p=1	128	1	1	1024	1	1	27819	-1	-1	-1	-1	7.99508e-05	# 334.44 Gflop/s, 272.14 GB/s, tuning took 0.127026 seconds at Mon Jul 11 18:25:12 2022
     32x64x16x16	N4quda13TwistedCloverINS_15WilsonCloverArgIsLi3ELi4EL21QudaReconstructType_s18ELb1EEEEE	policy_kernel=exterior_all,commDim=0011,xpay,parity=1	64	1	1	2048	1	1	9273	-1	-1	-1	-1	1.29463e-05	# 2065.36 Gflop/s, 1680.63 GB/s, tuning took 0.040394 seconds at Mon Jul 11 18:25:27 2022
     32x64x16x16	N4quda13TwistedCloverINS_15WilsonCloverArgIsLi3ELi4EL21QudaReconstructType_s18ELb1EEEEE	policy_kernel=exterior_all,commDim=0011,xpay,parity=1,zero_copy,p2p=1	32	1	1	4096	1	1	6420	-1	-1	-1	-1	7.99508e-05	# 334.44 Gflop/s, 272.14 GB/s, tuning took 0.127066 seconds at Mon Jul 11 18:25:27 2022
     32x64x16x16	N4quda13TwistedCloverINS_15WilsonCloverArgIsLi3ELi4EL21QudaReconstructType_s18ELb1EEEEE	policy_kernel=exterior_t,commDim=0011,xpay,dagger,parity=1	64	1	1	1024	1	1	18546	-1	-1	-1	-1	8.83984e-06	# 1512.40 Gflop/s, 1230.68 GB/s, tuning took 0.031859 seconds at Mon Jul 11 18:25:12 2022
     32x64x16x16	N4quda13TwistedCloverINS_15WilsonCloverArgIsLi3ELi4EL21QudaReconstructType_s18ELb1EEEEE	policy_kernel=exterior_t,commDim=0011,xpay,dagger,parity=1,zero_copy,p2p=1	64	1	1	1024	1	1	83457	-1	-1	-1	-1	7.87692e-05	# 169.73 Gflop/s, 138.11 GB/s, tuning took 0.126442 seconds at Mon Jul 11 18:25:12 2022
     32x64x16x16	N4quda13TwistedCloverINS_15WilsonCloverArgIsLi3ELi4EL21QudaReconstructType_s18ELb1EEEEE	policy_kernel=exterior_t,commDim=0011,xpay,parity=1	32	1	1	2048	1	1	8346	-1	-1	-1	-1	9.11151e-06	# 1467.30 Gflop/s, 1193.98 GB/s, tuning took 0.031866 seconds at Mon Jul 11 18:25:27 2022
     32x64x16x16	N4quda13TwistedCloverINS_15WilsonCloverArgIsLi3ELi4EL21QudaReconstructType_s18ELb1EEEEE	policy_kernel=exterior_t,commDim=0011,xpay,parity=1,zero_copy,p2p=1	96	1	1	683	1	1	83457	-1	-1	-1	-1	7.8848e-05	# 169.56 Gflop/s, 137.97 GB/s, tuning took 0.126432 seconds at Mon Jul 11 18:25:27 2022
     32x64x16x16	N4quda13TwistedCloverINS_15WilsonCloverArgIsLi3ELi4EL21QudaReconstructType_s18ELb1EEEEE	policy_kernel=exterior_z,commDim=0011,xpay,dagger,parity=1	32	1	1	2048	1	1	9273	-1	-1	-1	-1	8.63086e-06	# 1549.02 Gflop/s, 1260.47 GB/s, tuning took 0.031149 seconds at Mon Jul 11 18:25:12 2022
     32x64x16x16	N4quda13TwistedCloverINS_15WilsonCloverArgIsLi3ELi4EL21QudaReconstructType_s18ELb1EEEEE	policy_kernel=exterior_z,commDim=0011,xpay,dagger,parity=1,zero_copy,p2p=1	32	1	1	2048	1	1	5756	-1	-1	-1	-1	8.85029e-06	# 1510.61 Gflop/s, 1229.22 GB/s, tuning took 0.030832 seconds at Mon Jul 11 18:25:12 2022
     32x64x16x16	N4quda13TwistedCloverINS_15WilsonCloverArgIsLi3ELi4EL21QudaReconstructType_s18ELb1EEEEE	policy_kernel=exterior_z,commDim=0011,xpay,parity=1	128	1	1	512	1	1	33383	-1	-1	-1	-1	8.63938e-06	# 1547.49 Gflop/s, 1259.23 GB/s, tuning took 0.031641 seconds at Mon Jul 11 18:25:27 2022
     32x64x16x16	N4quda13TwistedCloverINS_15WilsonCloverArgIsLi3ELi4EL21QudaReconstructType_s18ELb1EEEEE	policy_kernel=exterior_z,commDim=0011,xpay,parity=1,zero_copy,p2p=1	32	1	1	2048	1	1	9273	-1	-1	-1	-1	8.60996e-06	# 1552.78 Gflop/s, 1263.53 GB/s, tuning took 0.030792 seconds at Mon Jul 11 18:25:27 2022
     32x64x16x16	N4quda13TwistedCloverINS_15WilsonCloverArgIsLi3ELi4EL21QudaReconstructType_s18ELb1EEEEE	policy_kernel=interior,comm=0011,commDim=0011,xpay,dagger,parity=1	128	1	1	4096	1	1	11128	-1	-1	-1	-1	0.000244531	# 4032.96 Gflop/s, 1746.33 GB/s, tuning took 0.380269 seconds at Mon Jul 11 18:25:12 2022
     32x64x16x16	N4quda13TwistedCloverINS_15WilsonCloverArgIsLi3ELi4EL21QudaReconstructType_s18ELb1EEEEE	policy_kernel=interior,comm=0011,commDim=0011,xpay,dagger,parity=1,host-device	128	1	1	4096	1	1	13910	3	-1	-1	-1	0.000250368	# 3945.23 Gflop/s, 1743.31 GB/s, tuning took 2.890682 seconds at Mon Jul 11 18:25:15 2022
     32x64x16x16	N4quda13TwistedCloverINS_15WilsonCloverArgIsLi3ELi4EL21QudaReconstructType_s18ELb1EEEEE	policy_kernel=interior,comm=0011,commDim=0011,xpay,dagger,parity=1,host-remote	128	1	1	4096	1	1	0	3	-1	-1	-1	0.000249242	# 3963.06 Gflop/s, 1751.19 GB/s, tuning took 2.884199 seconds at Mon Jul 11 18:25:18 2022
     32x64x16x16	N4quda13TwistedCloverINS_15WilsonCloverArgIsLi3ELi4EL21QudaReconstructType_s18ELb1EEEEE	policy_kernel=interior,comm=0011,commDim=0011,xpay,parity=1	128	1	1	4096	1	1	12840	-1	-1	-1	-1	0.000244941	# 4026.22 Gflop/s, 1743.41 GB/s, tuning took 0.380657 seconds at Mon Jul 11 18:25:27 2022
     32x64x16x16	N4quda13TwistedCloverINS_15WilsonCloverArgIsLi3ELi4EL21QudaReconstructType_s18ELb1EEEEE	policy_kernel=interior,comm=0011,commDim=0011,xpay,parity=1,host-device	128	1	1	4096	1	1	10433	3	-1	-1	-1	0.000250624	# 3941.20 Gflop/s, 1741.53 GB/s, tuning took 2.898201 seconds at Mon Jul 11 18:25:30 2022
     32x64x16x16	N4quda13TwistedCloverINS_15WilsonCloverArgIsLi3ELi4EL21QudaReconstructType_s18ELb1EEEEE	policy_kernel=interior,comm=0011,commDim=0011,xpay,parity=1,host-remote	128	1	1	4096	1	1	15174	3	-1	-1	-1	0.000249037	# 3966.32 Gflop/s, 1752.63 GB/s, tuning took 2.892079 seconds at Mon Jul 11 18:25:33 2022
     32x64x16x16	N4quda15CopyColorSpinorILi4ELi3ENS_11colorspinor11FloatNOrderIdLi4ELi3ELi2ELb0ELb0EEENS1_21SpaceSpinorColorOrderIdLi4ELi3EEESt5tupleIJRNS_16ColorSpinorFieldERKS7_19QudaFieldLocation_sPdPKdEEEE	GPU-offline,vol=524288,parity=1,precision=8,order=9,Ns=4,Nc=3,TwistFlavor=1vol=524288,parity=1,precision=8,order=2,Ns=4,Nc=3,TwistFlavor=1,NonRelBasis	768	1	1	683	1	1	0	-1	-1	-1	-1	0.000156379	# 0.00 Gflop/s, 1287.42 GB/s, tuning took 0.028460 seconds at Mon Jul 11 18:25:02 2022
     32x64x16x16	N4quda15CopyColorSpinorILi4ELi3ENS_11colorspinor11FloatNOrderIdLi4ELi3ELi2ELb0ELb0EEES3_St5tupleIJRNS_16ColorSpinorFieldERKS5_19QudaFieldLocation_sPdPKdEEEE	GPU-offline,vol=524288,parity=1,precision=8,order=2,Ns=4,Nc=3,TwistFlavor=1vol=524288,parity=1,precision=8,order=2,Ns=4,Nc=3,TwistFlavor=1,PreserveBasis	32	1	1	16384	1	1	0	-1	-1	-1	-1	0.000153015	# 0.00 Gflop/s, 1315.73 GB/s, tuning took 0.027885 seconds at Mon Jul 11 18:25:03 2022
     32x64x16x16	N4quda15CopyColorSpinorILi4ELi3ENS_11colorspinor11FloatNOrderIfLi4ELi3ELi2ELb0ELb0EEENS2_IfLi4ELi3ELi4ELb0ELb0EEESt5tupleIJRNS_16ColorSpinorFieldERKS6_19QudaFieldLocation_sPfPKfEEEE	GPU-offline,vol=524288,parity=1,precision=4,order=4,Ns=4,Nc=3,TwistFlavor=1vol=524288,parity=1,precision=4,order=2,Ns=4,Nc=3,TwistFlavor=1,RelBasis	32	1	1	16384	1	1	0	-1	-1	-1	-1	7.87692e-05	# 0.00 Gflop/s, 1277.95 GB/s, tuning took 0.019925 seconds at Mon Jul 11 18:32:50 2022
     32x64x16x16	N4quda15CopyColorSpinorILi4ELi3ENS_11colorspinor11FloatNOrderIfLi4ELi3ELi4ELb0ELb0EEENS2_IdLi4ELi3ELi2ELb0ELb0EEESt5tupleIJRNS_16ColorSpinorFieldERKS6_19QudaFieldLocation_sPfPKdEEEE	GPU-offline,vol=524288,parity=1,precision=8,order=2,Ns=4,Nc=3,TwistFlavor=1vol=524288,parity=1,precision=4,order=4,Ns=4,Nc=3,TwistFlavor=1,PreserveBasis	32	1	1	16384	1	1	0	-1	-1	-1	-1	0.000114233	# 0.00 Gflop/s, 1321.82 GB/s, tuning took 0.023463 seconds at Mon Jul 11 18:32:50 2022
     32x64x16x16	N4quda15CopyColorSpinorILi4ELi3ENS_11colorspinor11FloatNOrderIfLi4ELi3ELi4ELb0ELb0EEENS2_IfLi4ELi3ELi2ELb0ELb0EEESt5tupleIJRNS_16ColorSpinorFieldERKS6_19QudaFieldLocation_sPfPKfEEEE	GPU-offline,vol=524288,parity=1,precision=4,order=2,Ns=4,Nc=3,TwistFlavor=1vol=524288,parity=1,precision=4,order=4,Ns=4,Nc=3,TwistFlavor=1,NonRelBasis	32	1	1	16384	1	1	0	-1	-1	-1	-1	7.97932e-05	# 0.00 Gflop/s, 1261.55 GB/s, tuning took 0.020277 seconds at Mon Jul 11 18:33:05 2022
     32x64x16x16	N4quda15CopyColorSpinorILi4ELi3ENS_11colorspinor11FloatNOrderIfLi4ELi3ELi4ELb0ELb0EEES3_St5tupleIJRNS_16ColorSpinorFieldERKS5_19QudaFieldLocation_sPfPKfEEEE	GPU-offline,vol=524288,parity=1,precision=4,order=4,Ns=4,Nc=3,TwistFlavor=1vol=524288,parity=1,precision=4,order=4,Ns=4,Nc=3,TwistFlavor=1,PreserveBasis	32	1	1	16384	1	1	0	-1	-1	-1	-1	7.90843e-05	# 0.00 Gflop/s, 1272.86 GB/s, tuning took 0.019632 seconds at Mon Jul 11 18:27:40 2022
     32x64x16x16	N4quda15CopyColorSpinorILi4ELi3ENS_11colorspinor11FloatNOrderIsLi4ELi3ELi8ELb0ELb0EEENS2_IdLi4ELi3ELi2ELb0ELb0EEESt5tupleIJRNS_16ColorSpinorFieldERKS6_19QudaFieldLocation_sPsPKdEEEE	GPU-offline,vol=524288,parity=1,precision=8,order=2,Ns=4,Nc=3,TwistFlavor=1vol=524288,parity=1,precision=2,order=8,Ns=4,Nc=3,TwistFlavor=1,PreserveBasis	32	1	1	16384	1	1	0	-1	-1	-1	-1	9.60698e-05	# 0.00 Gflop/s, 1331.60 GB/s, tuning took 0.021962 seconds at Mon Jul 11 18:25:03 2022
     32x64x16x16	N4quda15CopyColorSpinorILi4ELi3ENS_11colorspinor11FloatNOrderIsLi4ELi3ELi8ELb0ELb0EEENS2_IfLi4ELi3ELi4ELb0ELb0EEESt5tupleIJRNS_16ColorSpinorFieldERKS6_19QudaFieldLocation_sPsPKfEEEE	GPU-offline,vol=524288,parity=1,precision=4,order=4,Ns=4,Nc=3,TwistFlavor=1vol=524288,parity=1,precision=2,order=8,Ns=4,Nc=3,TwistFlavor=1,PreserveBasis	256	1	1	2048	1	1	0	-1	-1	-1	-1	6.15002e-05	# 0.00 Gflop/s, 1261.70 GB/s, tuning took 0.017884 seconds at Mon Jul 11 18:27:40 2022
     32x64x16x16	N4quda15CopyColorSpinorILi4ELi3ENS_11colorspinor11FloatNOrderIsLi4ELi3ELi8ELb0ELb0EEES3_St5tupleIJRNS_16ColorSpinorFieldERKS5_19QudaFieldLocation_sPsPKsEEEE	GPU-offline,vol=524288,parity=1,precision=2,order=8,Ns=4,Nc=3,TwistFlavor=1vol=524288,parity=1,precision=2,order=8,Ns=4,Nc=3,TwistFlavor=1,PreserveBasis	384	1	1	1366	1	1	0	-1	-1	-1	-1	4.49224e-05	# 0.00 Gflop/s, 1213.78 GB/s, tuning took 0.015873 seconds at Mon Jul 11 18:25:03 2022
     32x64x16x16	N4quda15CopyColorSpinorILi4ELi3ENS_11colorspinor21SpaceSpinorColorOrderIdLi4ELi3EEENS1_11FloatNOrderIdLi4ELi3ELi2ELb0ELb0EEESt5tupleIJRNS_16ColorSpinorFieldERKS7_19QudaFieldLocation_sPdPKdEEEE	GPU-offline,vol=524288,parity=1,precision=8,order=2,Ns=4,Nc=3,TwistFlavor=1vol=524288,parity=1,precision=8,order=9,Ns=4,Nc=3,TwistFlavor=1,RelBasis	608	1	1	863	1	1	0	-1	-1	-1	-1	0.000153015	# 0.00 Gflop/s, 1315.73 GB/s, tuning took 0.024227 seconds at Mon Jul 11 18:26:40 2022
     32x64x16x16	N4quda27TwistedCloverPreconditionedINS_16TwistedCloverArgIdLi3ELi4EL21QudaReconstructType_s18EEEEE	policy,commDim=0011,dagger,parity=1,topo=1148,order=0123,p2p=7,gdr=1,nvshmem=0,pol=111111111111110000	32	1	1	1	1	1	0	3	1	0	-1	0.00102434	# 958.14 Gflop/s, 1670.61 GB/s, tuning took 0.154809 seconds at Mon Jul 11 18:25:49 2022
     32x64x16x16	N4quda27TwistedCloverPreconditionedINS_16TwistedCloverArgIdLi3ELi4EL21QudaReconstructType_s18EEEEE	policy,commDim=0011,parity=1,topo=1148,order=0123,p2p=7,gdr=1,nvshmem=0,pol=111111111111110000	32	1	1	1	1	1	0	5	1	0	-1	0.00101513	# 966.84 Gflop/s, 1685.78 GB/s, tuning took 0.152847 seconds at Mon Jul 11 18:26:21 2022
     32x64x16x16	N4quda27TwistedCloverPreconditionedINS_16TwistedCloverArgIdLi3ELi4EL21QudaReconstructType_s18EEEEE	policy_kernel=exterior_all,commDim=0011,dagger,parity=1	64	1	1	2048	1	1	11923	-1	-1	-1	-1	0.000130432	# 735.59 Gflop/s, 1205.89 GB/s, tuning took 0.154162 seconds at Mon Jul 11 18:25:36 2022
     32x64x16x16	N4quda27TwistedCloverPreconditionedINS_16TwistedCloverArgIdLi3ELi4EL21QudaReconstructType_s18EEEEE	policy_kernel=exterior_all,commDim=0011,dagger,parity=1,zero_copy,p2p=1	96	1	1	1366	1	1	12840	-1	-1	-1	-1	0.000312064	# 307.45 Gflop/s, 504.02 GB/s, tuning took 0.307504 seconds at Mon Jul 11 18:25:37 2022
     32x64x16x16	N4quda27TwistedCloverPreconditionedINS_16TwistedCloverArgIdLi3ELi4EL21QudaReconstructType_s18EEEEE	policy_kernel=exterior_all,commDim=0011,parity=1	32	1	1	4096	1	1	7587	-1	-1	-1	-1	0.000127744	# 751.07 Gflop/s, 1231.26 GB/s, tuning took 0.153702 seconds at Mon Jul 11 18:26:07 2022
     32x64x16x16	N4quda27TwistedCloverPreconditionedINS_16TwistedCloverArgIdLi3ELi4EL21QudaReconstructType_s18EEEEE	policy_kernel=exterior_all,commDim=0011,parity=1,zero_copy,p2p=1	32	1	1	4096	1	1	20865	-1	-1	-1	-1	0.000312832	# 306.70 Gflop/s, 502.78 GB/s, tuning took 0.307242 seconds at Mon Jul 11 18:26:08 2022
     32x64x16x16	N4quda27TwistedCloverPreconditionedINS_16TwistedCloverArgIdLi3ELi4EL21QudaReconstructType_s18EEEEE	policy_kernel=exterior_t,commDim=0011,dagger,parity=1	32	1	1	2048	1	1	8785	-1	-1	-1	-1	6.3808e-05	# 751.82 Gflop/s, 1232.50 GB/s, tuning took 0.084124 seconds at Mon Jul 11 18:25:36 2022
     32x64x16x16	N4quda27TwistedCloverPreconditionedINS_16TwistedCloverArgIdLi3ELi4EL21QudaReconstructType_s18EEEEE	policy_kernel=exterior_t,commDim=0011,dagger,parity=1,zero_copy,p2p=1	32	1	1	2048	1	1	83457	-1	-1	-1	-1	0.000250112	# 191.80 Gflop/s, 314.43 GB/s, tuning took 0.248360 seconds at Mon Jul 11 18:25:37 2022
     32x64x16x16	N4quda27TwistedCloverPreconditionedINS_16TwistedCloverArgIdLi3ELi4EL21QudaReconstructType_s18EEEEE	policy_kernel=exterior_t,commDim=0011,parity=1	32	1	1	2048	1	1	9819	-1	-1	-1	-1	6.3552e-05	# 754.85 Gflop/s, 1237.46 GB/s, tuning took 0.083981 seconds at Mon Jul 11 18:26:07 2022
     32x64x16x16	N4quda27TwistedCloverPreconditionedINS_16TwistedCloverArgIdLi3ELi4EL21QudaReconstructType_s18EEEEE	policy_kernel=exterior_t,commDim=0011,parity=1,zero_copy,p2p=1	32	1	1	2048	1	1	83457	-1	-1	-1	-1	0.000250624	# 191.41 Gflop/s, 313.79 GB/s, tuning took 0.248362 seconds at Mon Jul 11 18:26:08 2022
     32x64x16x16	N4quda27TwistedCloverPreconditionedINS_16TwistedCloverArgIdLi3ELi4EL21QudaReconstructType_s18EEEEE	policy_kernel=exterior_z,commDim=0011,dagger,parity=1	32	1	1	2048	1	1	10433	-1	-1	-1	-1	6.92224e-05	# 693.02 Gflop/s, 1136.09 GB/s, tuning took 0.091263 seconds at Mon Jul 11 18:25:36 2022
     32x64x16x16	N4quda27TwistedCloverPreconditionedINS_16TwistedCloverArgIdLi3ELi4EL21QudaReconstructType_s18EEEEE	policy_kernel=exterior_z,commDim=0011,dagger,parity=1,zero_copy,p2p=1	32	1	1	2048	1	1	6955	-1	-1	-1	-1	6.92224e-05	# 693.02 Gflop/s, 1136.09 GB/s, tuning took 0.091248 seconds at Mon Jul 11 18:25:37 2022
     32x64x16x16	N4quda27TwistedCloverPreconditionedINS_16TwistedCloverArgIdLi3ELi4EL21QudaReconstructType_s18EEEEE	policy_kernel=exterior_z,commDim=0011,parity=1	32	1	1	2048	1	1	7587	-1	-1	-1	-1	6.92224e-05	# 693.02 Gflop/s, 1136.09 GB/s, tuning took 0.091278 seconds at Mon Jul 11 18:26:07 2022
     32x64x16x16	N4quda27TwistedCloverPreconditionedINS_16TwistedCloverArgIdLi3ELi4EL21QudaReconstructType_s18EEEEE	policy_kernel=exterior_z,commDim=0011,parity=1,zero_copy,p2p=1	32	1	1	2048	1	1	13910	-1	-1	-1	-1	6.91541e-05	# 693.70 Gflop/s, 1137.22 GB/s, tuning took 0.091264 seconds at Mon Jul 11 18:26:08 2022
     32x64x16x16	N4quda27TwistedCloverPreconditionedINS_16TwistedCloverArgIdLi3ELi4EL21QudaReconstructType_s18EEEEE	policy_kernel=interior,comm=0011,commDim=0011,dagger,parity=1	32	1	1	16384	1	1	6955	-1	-1	-1	-1	0.000815104	# 1090.25 Gflop/s, 1906.49 GB/s, tuning took 0.818320 seconds at Mon Jul 11 18:25:36 2022
     32x64x16x16	N4quda27TwistedCloverPreconditionedINS_16TwistedCloverArgIdLi3ELi4EL21QudaReconstructType_s18EEEEE	policy_kernel=interior,comm=0011,commDim=0011,dagger,parity=1,host-device	32	1	1	16384	1	1	16692	3	-1	-1	-1	0.000832171	# 1069.78 Gflop/s, 1912.75 GB/s, tuning took 5.317686 seconds at Mon Jul 11 18:25:42 2022
     32x64x16x16	N4quda27TwistedCloverPreconditionedINS_16TwistedCloverArgIdLi3ELi4EL21QudaReconstructType_s18EEEEE	policy_kernel=interior,comm=0011,commDim=0011,dagger,parity=1,host-remote	32	1	1	16384	1	1	18546	3	-1	-1	-1	0.000827392	# 1075.96 Gflop/s, 1923.80 GB/s, tuning took 5.305700 seconds at Mon Jul 11 18:25:49 2022
     32x64x16x16	N4quda27TwistedCloverPreconditionedINS_16TwistedCloverArgIdLi3ELi4EL21QudaReconstructType_s18EEEEE	policy_kernel=interior,comm=0011,commDim=0011,parity=1	32	1	1	16384	1	1	6955	-1	-1	-1	-1	0.000815787	# 1089.34 Gflop/s, 1904.90 GB/s, tuning took 0.819792 seconds at Mon Jul 11 18:26:07 2022
     32x64x16x16	N4quda27TwistedCloverPreconditionedINS_16TwistedCloverArgIdLi3ELi4EL21QudaReconstructType_s18EEEEE	policy_kernel=interior,comm=0011,commDim=0011,parity=1,host-device	32	1	1	16384	1	1	7949	3	-1	-1	-1	0.000833195	# 1068.47 Gflop/s, 1910.40 GB/s, tuning took 5.341564 seconds at Mon Jul 11 18:26:14 2022
     32x64x16x16	N4quda27TwistedCloverPreconditionedINS_16TwistedCloverArgIdLi3ELi4EL21QudaReconstructType_s18EEEEE	policy_kernel=interior,comm=0011,commDim=0011,parity=1,host-remote	32	1	1	16384	1	1	0	3	-1	-1	-1	0.000828416	# 1074.63 Gflop/s, 1921.42 GB/s, tuning took 5.309603 seconds at Mon Jul 11 18:26:21 2022
     32x64x16x16	N4quda27TwistedCloverPreconditionedINS_16TwistedCloverArgIfLi3ELi4EL21QudaReconstructType_s18EEEEE	policy,commDim=0011,dagger,parity=1,topo=1148,order=0123,p2p=7,gdr=1,nvshmem=0,pol=111111111111110000	32	1	1	1	1	1	0	4	1	0	-1	0.000546816	# 1794.88 Gflop/s, 1564.76 GB/s, tuning took 0.090446 seconds at Mon Jul 11 18:27:30 2022
     32x64x16x16	N4quda27TwistedCloverPreconditionedINS_16TwistedCloverArgIfLi3ELi4EL21QudaReconstructType_s18EEEEE	policy,commDim=0011,parity=1,topo=1148,order=0123,p2p=7,gdr=1,nvshmem=0,pol=111111111111110000	32	1	1	1	1	1	0	4	1	0	-1	0.000545451	# 1799.37 Gflop/s, 1568.68 GB/s, tuning took 0.090139 seconds at Mon Jul 11 18:27:11 2022
     32x64x16x16	N4quda27TwistedCloverPreconditionedINS_16TwistedCloverArgIfLi3ELi4EL21QudaReconstructType_s18EEEEE	policy,commDim=0011,xpay,parity=1,topo=1148,order=0123,p2p=7,gdr=1,nvshmem=0,pol=111111111111110000	32	1	1	1	1	1	0	5	1	0	-1	0.000540672	# 1861.82 Gflop/s, 1582.55 GB/s, tuning took 0.089238 seconds at Mon Jul 11 18:27:20 2022
     32x64x16x16	N4quda27TwistedCloverPreconditionedINS_16TwistedCloverArgIfLi3ELi4EL21QudaReconstructType_s18EEEEE	policy_kernel=exterior_all,commDim=0011,dagger,parity=1	32	1	1	4096	1	1	8346	-1	-1	-1	-1	7.59954e-05	# 1262.51 Gflop/s, 1034.84 GB/s, tuning took 0.114603 seconds at Mon Jul 11 18:27:21 2022
     32x64x16x16	N4quda27TwistedCloverPreconditionedINS_16TwistedCloverArgIfLi3ELi4EL21QudaReconstructType_s18EEEEE	policy_kernel=exterior_all,commDim=0011,dagger,parity=1,zero_copy,p2p=1	64	1	1	2048	1	1	5217	-1	-1	-1	-1	0.00016501	# 581.45 Gflop/s, 476.60 GB/s, tuning took 0.198623 seconds at Mon Jul 11 18:27:22 2022
     32x64x16x16	N4quda27TwistedCloverPreconditionedINS_16TwistedCloverArgIfLi3ELi4EL21QudaReconstructType_s18EEEEE	policy_kernel=exterior_all,commDim=0011,parity=1	128	1	1	1024	1	1	12840	-1	-1	-1	-1	7.61417e-05	# 1260.08 Gflop/s, 1032.85 GB/s, tuning took 0.114538 seconds at Mon Jul 11 18:27:04 2022
     32x64x16x16	N4quda27TwistedCloverPreconditionedINS_16TwistedCloverArgIfLi3ELi4EL21QudaReconstructType_s18EEEEE	policy_kernel=exterior_all,commDim=0011,parity=1,zero_copy,p2p=1	32	1	1	4096	1	1	15174	-1	-1	-1	-1	0.00016384	# 585.60 Gflop/s, 480.00 GB/s, tuning took 0.198822 seconds at Mon Jul 11 18:27:04 2022
     32x64x16x16	N4quda27TwistedCloverPreconditionedINS_16TwistedCloverArgIfLi3ELi4EL21QudaReconstructType_s18EEEEE	policy_kernel=exterior_all,commDim=0011,xpay,parity=1	32	1	1	4096	1	1	6677	-1	-1	-1	-1	7.40206e-05	# 1338.69 Gflop/s, 1062.45 GB/s, tuning took 0.110421 seconds at Mon Jul 11 18:27:12 2022
     32x64x16x16	N4quda27TwistedCloverPreconditionedINS_16TwistedCloverArgIfLi3ELi4EL21QudaReconstructType_s18EEEEE	policy_kernel=exterior_all,commDim=0011,xpay,parity=1,zero_copy,p2p=1	64	1	1	2048	1	1	20865	-1	-1	-1	-1	0.000163547	# 605.88 Gflop/s, 480.86 GB/s, tuning took 0.195364 seconds at Mon Jul 11 18:27:13 2022
     32x64x16x16	N4quda27TwistedCloverPreconditionedINS_16TwistedCloverArgIfLi3ELi4EL21QudaReconstructType_s18EEEEE	policy_kernel=exterior_t,commDim=0011,dagger,parity=1	128	1	1	512	1	1	18546	-1	-1	-1	-1	2.98822e-05	# 1605.38 Gflop/s, 1315.89 GB/s, tuning took 0.057814 seconds at Mon Jul 11 18:27:21 2022
     32x64x16x16	N4quda27TwistedCloverPreconditionedINS_16TwistedCloverArgIfLi3ELi4EL21QudaReconstructType_s18EEEEE	policy_kernel=exterior_t,commDim=0011,dagger,parity=1,zero_copy,p2p=1	48	1	1	1366	1	1	83457	-1	-1	-1	-1	0.000131072	# 366.00 Gflop/s, 300.00 GB/s, tuning took 0.161407 seconds at Mon Jul 11 18:27:21 2022
     32x64x16x16	N4quda27TwistedCloverPreconditionedINS_16TwistedCloverArgIfLi3ELi4EL21QudaReconstructType_s18EEEEE	policy_kernel=exterior_t,commDim=0011,parity=1	128	1	1	512	1	1	11923	-1	-1	-1	-1	2.99753e-05	# 1600.40 Gflop/s, 1311.80 GB/s, tuning took 0.057564 seconds at Mon Jul 11 18:27:04 2022
     32x64x16x16	N4quda27TwistedCloverPreconditionedINS_16TwistedCloverArgIfLi3ELi4EL21QudaReconstructType_s18EEEEE	policy_kernel=exterior_t,commDim=0011,parity=1,zero_copy,p2p=1	48	1	1	1366	1	1	83457	-1	-1	-1	-1	0.000131072	# 366.00 Gflop/s, 300.00 GB/s, tuning took 0.161451 seconds at Mon Jul 11 18:27:04 2022
     32x64x16x16	N4quda27TwistedCloverPreconditionedINS_16TwistedCloverArgIfLi3ELi4EL21QudaReconstructType_s18EEEEE	policy_kernel=exterior_t,commDim=0011,xpay,parity=1	64	1	1	1024	1	1	6182	-1	-1	-1	-1	3.0688e-05	# 1614.48 Gflop/s, 1281.33 GB/s, tuning took 0.058939 seconds at Mon Jul 11 18:27:12 2022
     32x64x16x16	N4quda27TwistedCloverPreconditionedINS_16TwistedCloverArgIfLi3ELi4EL21QudaReconstructType_s18EEEEE	policy_kernel=exterior_t,commDim=0011,xpay,parity=1,zero_copy,p2p=1	32	1	1	2048	1	1	55638	-1	-1	-1	-1	0.0001312	# 377.63 Gflop/s, 299.71 GB/s, tuning took 0.161132 seconds at Mon Jul 11 18:27:12 2022
     32x64x16x16	N4quda27TwistedCloverPreconditionedINS_16TwistedCloverArgIfLi3ELi4EL21QudaReconstructType_s18EEEEE	policy_kernel=exterior_z,commDim=0011,dagger,parity=1	128	1	1	512	1	1	11128	-1	-1	-1	-1	2.96029e-05	# 1620.53 Gflop/s, 1328.30 GB/s, tuning took 0.058887 seconds at Mon Jul 11 18:27:21 2022
     32x64x16x16	N4quda27TwistedCloverPreconditionedINS_16TwistedCloverArgIfLi3ELi4EL21QudaReconstructType_s18EEEEE	policy_kernel=exterior_z,commDim=0011,dagger,parity=1,zero_copy,p2p=1	128	1	1	512	1	1	23845	-1	-1	-1	-1	2.94478e-05	# 1629.07 Gflop/s, 1335.30 GB/s, tuning took 0.058713 seconds at Mon Jul 11 18:27:21 2022
     32x64x16x16	N4quda27TwistedCloverPreconditionedINS_16TwistedCloverArgIfLi3ELi4EL21QudaReconstructType_s18EEEEE	policy_kernel=exterior_z,commDim=0011,parity=1	128	1	1	512	1	1	23845	-1	-1	-1	-1	2.95098e-05	# 1625.64 Gflop/s, 1332.49 GB/s, tuning took 0.058745 seconds at Mon Jul 11 18:27:04 2022
     32x64x16x16	N4quda27TwistedCloverPreconditionedINS_16TwistedCloverArgIfLi3ELi4EL21QudaReconstructType_s18EEEEE	policy_kernel=exterior_z,commDim=0011,parity=1,zero_copy,p2p=1	128	1	1	512	1	1	0	-1	-1	-1	-1	2.96029e-05	# 1620.53 Gflop/s, 1328.30 GB/s, tuning took 0.058812 seconds at Mon Jul 11 18:27:04 2022
     32x64x16x16	N4quda27TwistedCloverPreconditionedINS_16TwistedCloverArgIfLi3ELi4EL21QudaReconstructType_s18EEEEE	policy_kernel=exterior_z,commDim=0011,xpay,parity=1	128	1	1	512	1	1	23845	-1	-1	-1	-1	3.32117e-05	# 1491.80 Gflop/s, 1183.97 GB/s, tuning took 0.062954 seconds at Mon Jul 11 18:27:12 2022
     32x64x16x16	N4quda27TwistedCloverPreconditionedINS_16TwistedCloverArgIfLi3ELi4EL21QudaReconstructType_s18EEEEE	policy_kernel=exterior_z,commDim=0011,xpay,parity=1,zero_copy,p2p=1	128	1	1	512	1	1	0	-1	-1	-1	-1	3.32117e-05	# 1491.80 Gflop/s, 1183.97 GB/s, tuning took 0.062831 seconds at Mon Jul 11 18:27:12 2022
     32x64x16x16	N4quda27TwistedCloverPreconditionedINS_16TwistedCloverArgIfLi3ELi4EL21QudaReconstructType_s18EEEEE	policy_kernel=interior,comm=0011,commDim=0011,dagger,parity=1	128	1	1	4096	1	1	13910	-1	-1	-1	-1	0.000402091	# 2210.12 Gflop/s, 1932.39 GB/s, tuning took 0.506007 seconds at Mon Jul 11 18:27:21 2022
     32x64x16x16	N4quda27TwistedCloverPreconditionedINS_16TwistedCloverArgIfLi3ELi4EL21QudaReconstructType_s18EEEEE	policy_kernel=interior,comm=0011,commDim=0011,dagger,parity=1,host-device	128	1	1	4096	1	1	23845	2	-1	-1	-1	0.000411307	# 2164.42 Gflop/s, 1934.98 GB/s, tuning took 3.452239 seconds at Mon Jul 11 18:27:25 2022
     32x64x16x16	N4quda27TwistedCloverPreconditionedINS_16TwistedCloverArgIfLi3ELi4EL21QudaReconstructType_s18EEEEE	policy_kernel=interior,comm=0011,commDim=0011,dagger,parity=1,host-remote	128	1	1	4096	1	1	11923	3	-1	-1	-1	0.000409941	# 2171.63 Gflop/s, 1941.42 GB/s, tuning took 3.443519 seconds at Mon Jul 11 18:27:30 2022
     32x64x16x16	N4quda27TwistedCloverPreconditionedINS_16TwistedCloverArgIfLi3ELi4EL21QudaReconstructType_s18EEEEE	policy_kernel=interior,comm=0011,commDim=0011,parity=1	128	1	1	4096	1	1	20865	-1	-1	-1	-1	0.000401067	# 2215.76 Gflop/s, 1937.32 GB/s, tuning took 0.504768 seconds at Mon Jul 11 18:27:04 2022
     32x64x16x16	N4quda27TwistedCloverPreconditionedINS_16TwistedCloverArgIfLi3ELi4EL21QudaReconstructType_s18EEEEE	policy_kernel=interior,comm=0011,commDim=0011,parity=1,host-device	128	1	1	4096	1	1	23845	2	-1	-1	-1	0.000410624	# 2168.02 Gflop/s, 1938.19 GB/s, tuning took 3.444234 seconds at Mon Jul 11 18:27:08 2022
     32x64x16x16	N4quda27TwistedCloverPreconditionedINS_16TwistedCloverArgIfLi3ELi4EL21QudaReconstructType_s18EEEEE	policy_kernel=interior,comm=0011,commDim=0011,parity=1,host-remote	128	1	1	4096	1	1	11923	2	-1	-1	-1	0.000408576	# 2178.89 Gflop/s, 1947.91 GB/s, tuning took 3.435696 seconds at Mon Jul 11 18:27:11 2022
     32x64x16x16	N4quda27TwistedCloverPreconditionedINS_16TwistedCloverArgIfLi3ELi4EL21QudaReconstructType_s18EEEEE	policy_kernel=interior,comm=0011,commDim=0011,xpay,parity=1	128	1	1	4096	1	1	33383	-1	-1	-1	-1	0.000427349	# 2138.38 Gflop/s, 1818.17 GB/s, tuning took 0.531194 seconds at Mon Jul 11 18:27:12 2022
     32x64x16x16	N4quda27TwistedCloverPreconditionedINS_16TwistedCloverArgIfLi3ELi4EL21QudaReconstructType_s18EEEEE	policy_kernel=interior,comm=0011,commDim=0011,xpay,parity=1,host-device	128	1	1	4096	1	1	23845	2	-1	-1	-1	0.000437589	# 2091.93 Gflop/s, 1818.76 GB/s, tuning took 3.584484 seconds at Mon Jul 11 18:27:16 2022
     32x64x16x16	N4quda27TwistedCloverPreconditionedINS_16TwistedCloverArgIfLi3ELi4EL21QudaReconstructType_s18EEEEE	policy_kernel=interior,comm=0011,commDim=0011,xpay,parity=1,host-remote	128	1	1	4096	1	1	23845	2	-1	-1	-1	0.000435541	# 2101.77 Gflop/s, 1827.31 GB/s, tuning took 3.575426 seconds at Mon Jul 11 18:27:20 2022
     32x64x16x16	N4quda27TwistedCloverPreconditionedINS_16TwistedCloverArgIsLi3ELi4EL21QudaReconstructType_s18EEEEE	policy,commDim=0011,dagger,parity=1,topo=1148,order=0123,p2p=7,gdr=1,nvshmem=0,pol=111111111111110000	32	1	1	1	1	1	0	3	1	0	-1	0.000382976	# 2562.74 Gflop/s, 1171.85 GB/s, tuning took 0.057760 seconds at Mon Jul 11 18:25:12 2022
     32x64x16x16	N4quda27TwistedCloverPreconditionedINS_16TwistedCloverArgIsLi3ELi4EL21QudaReconstructType_s18EEEEE	policy,commDim=0011,parity=1,topo=1148,order=0123,p2p=7,gdr=1,nvshmem=0,pol=111111111111110000	32	1	1	1	1	1	0	3	1	0	-1	0.000379563	# 2585.78 Gflop/s, 1182.39 GB/s, tuning took 0.054986 seconds at Mon Jul 11 18:25:27 2022
     32x64x16x16	N4quda27TwistedCloverPreconditionedINS_16TwistedCloverArgIsLi3ELi4EL21QudaReconstructType_s18EEEEE	policy,commDim=0011,xpay,parity=1,topo=1148,order=0123,p2p=7,gdr=1,nvshmem=0,pol=111111111111110000	32	1	1	1	1	1	0	5	1	0	-1	0.000372395	# 2703.13 Gflop/s, 1205.15 GB/s, tuning took 0.052516 seconds at Mon Jul 11 18:27:47 2022
     32x64x16x16	N4quda27TwistedCloverPreconditionedINS_16TwistedCloverArgIsLi3ELi4EL21QudaReconstructType_s18EEEEE	policy_kernel=exterior_all,commDim=0011,dagger,parity=1	128	1	1	1024	1	1	15174	-1	-1	-1	-1	4.55215e-05	# 2107.68 Gflop/s, 915.63 GB/s, tuning took 0.089491 seconds at Mon Jul 11 18:25:04 2022
     32x64x16x16	N4quda27TwistedCloverPreconditionedINS_16TwistedCloverArgIsLi3ELi4EL21QudaReconstructType_s18EEEEE	policy_kernel=exterior_all,commDim=0011,dagger,parity=1,zero_copy,p2p=1	96	1	1	1366	1	1	10433	-1	-1	-1	-1	0.000102502	# 936.02 Gflop/s, 406.63 GB/s, tuning took 0.143937 seconds at Mon Jul 11 18:25:05 2022
     32x64x16x16	N4quda27TwistedCloverPreconditionedINS_16TwistedCloverArgIsLi3ELi4EL21QudaReconstructType_s18EEEEE	policy_kernel=exterior_all,commDim=0011,parity=1	128	1	1	1024	1	1	16692	-1	-1	-1	-1	4.51491e-05	# 2125.06 Gflop/s, 923.18 GB/s, tuning took 0.088612 seconds at Mon Jul 11 18:25:19 2022
     32x64x16x16	N4quda27TwistedCloverPreconditionedINS_16TwistedCloverArgIsLi3ELi4EL21QudaReconstructType_s18EEEEE	policy_kernel=exterior_all,commDim=0011,parity=1,zero_copy,p2p=1	96	1	1	1366	1	1	18546	-1	-1	-1	-1	0.00010199	# 940.72 Gflop/s, 408.67 GB/s, tuning took 0.143125 seconds at Mon Jul 11 18:25:20 2022
     32x64x16x16	N4quda27TwistedCloverPreconditionedINS_16TwistedCloverArgIsLi3ELi4EL21QudaReconstructType_s18EEEEE	policy_kernel=exterior_all,commDim=0011,xpay,parity=1	128	1	1	1024	1	1	10433	-1	-1	-1	-1	4.68247e-05	# 2116.20 Gflop/s, 890.15 GB/s, tuning took 0.089996 seconds at Mon Jul 11 18:27:40 2022
     32x64x16x16	N4quda27TwistedCloverPreconditionedINS_16TwistedCloverArgIsLi3ELi4EL21QudaReconstructType_s18EEEEE	policy_kernel=exterior_all,commDim=0011,xpay,parity=1,zero_copy,p2p=1	128	1	1	1024	1	1	41729	-1	-1	-1	-1	0.000102195	# 969.62 Gflop/s, 407.86 GB/s, tuning took 0.142875 seconds at Mon Jul 11 18:27:41 2022
     32x64x16x16	N4quda27TwistedCloverPreconditionedINS_16TwistedCloverArgIsLi3ELi4EL21QudaReconstructType_s18EEEEE	policy_kernel=exterior_t,commDim=0011,dagger,parity=1	128	1	1	512	1	1	12840	-1	-1	-1	-1	2.31024e-05	# 2076.51 Gflop/s, 902.09 GB/s, tuning took 0.051210 seconds at Mon Jul 11 18:25:04 2022
     32x64x16x16	N4quda27TwistedCloverPreconditionedINS_16TwistedCloverArgIsLi3ELi4EL21QudaReconstructType_s18EEEEE	policy_kernel=exterior_t,commDim=0011,dagger,parity=1,zero_copy,p2p=1	64	1	1	1024	1	1	83457	-1	-1	-1	-1	8.04234e-05	# 596.50 Gflop/s, 259.13 GB/s, tuning took 0.119283 seconds at Mon Jul 11 18:25:05 2022
     32x64x16x16	N4quda27TwistedCloverPreconditionedINS_16TwistedCloverArgIsLi3ELi4EL21QudaReconstructType_s18EEEEE	policy_kernel=exterior_t,commDim=0011,parity=1	32	1	1	2048	1	1	5564	-1	-1	-1	-1	2.32273e-05	# 2065.34 Gflop/s, 897.24 GB/s, tuning took 0.051219 seconds at Mon Jul 11 18:25:19 2022
     32x64x16x16	N4quda27TwistedCloverPreconditionedINS_16TwistedCloverArgIsLi3ELi4EL21QudaReconstructType_s18EEEEE	policy_kernel=exterior_t,commDim=0011,parity=1,zero_copy,p2p=1	64	1	1	1024	1	1	83457	-1	-1	-1	-1	8.01871e-05	# 598.26 Gflop/s, 259.90 GB/s, tuning took 0.118613 seconds at Mon Jul 11 18:25:20 2022
     32x64x16x16	N4quda27TwistedCloverPreconditionedINS_16TwistedCloverArgIsLi3ELi4EL21QudaReconstructType_s18EEEEE	policy_kernel=exterior_t,commDim=0011,xpay,parity=1	128	1	1	512	1	1	20865	-1	-1	-1	-1	2.30156e-05	# 2152.68 Gflop/s, 905.49 GB/s, tuning took 0.051764 seconds at Mon Jul 11 18:27:40 2022
     32x64x16x16	N4quda27TwistedCloverPreconditionedINS_16TwistedCloverArgIsLi3ELi4EL21QudaReconstructType_s18EEEEE	policy_kernel=exterior_t,commDim=0011,xpay,parity=1,zero_copy,p2p=1	32	1	1	2048	1	1	41729	-1	-1	-1	-1	8.04234e-05	# 616.05 Gflop/s, 259.13 GB/s, tuning took 0.117733 seconds at Mon Jul 11 18:27:40 2022
     32x64x16x16	N4quda27TwistedCloverPreconditionedINS_16TwistedCloverArgIsLi3ELi4EL21QudaReconstructType_s18EEEEE	policy_kernel=exterior_z,commDim=0011,dagger,parity=1	128	1	1	512	1	1	11128	-1	-1	-1	-1	2.368e-05	# 2025.86 Gflop/s, 880.09 GB/s, tuning took 0.053236 seconds at Mon Jul 11 18:25:04 2022
     32x64x16x16	N4quda27TwistedCloverPreconditionedINS_16TwistedCloverArgIsLi3ELi4EL21QudaReconstructType_s18EEEEE	policy_kernel=exterior_z,commDim=0011,dagger,parity=1,zero_copy,p2p=1	32	1	1	2048	1	1	6677	-1	-1	-1	-1	2.37568e-05	# 2019.31 Gflop/s, 877.24 GB/s, tuning took 0.052984 seconds at Mon Jul 11 18:25:05 2022
     32x64x16x16	N4quda27TwistedCloverPreconditionedINS_16TwistedCloverArgIsLi3ELi4EL21QudaReconstructType_s18EEEEE	policy_kernel=exterior_z,commDim=0011,parity=1	128	1	1	512	1	1	0	-1	-1	-1	-1	2.368e-05	# 2025.86 Gflop/s, 880.09 GB/s, tuning took 0.053157 seconds at Mon Jul 11 18:25:19 2022
     32x64x16x16	N4quda27TwistedCloverPreconditionedINS_16TwistedCloverArgIsLi3ELi4EL21QudaReconstructType_s18EEEEE	policy_kernel=exterior_z,commDim=0011,parity=1,zero_copy,p2p=1	32	1	1	2048	1	1	5756	-1	-1	-1	-1	2.37824e-05	# 2017.14 Gflop/s, 876.30 GB/s, tuning took 0.053122 seconds at Mon Jul 11 18:25:20 2022
     32x64x16x16	N4quda27TwistedCloverPreconditionedINS_16TwistedCloverArgIsLi3ELi4EL21QudaReconstructType_s18EEEEE	policy_kernel=exterior_z,commDim=0011,xpay,parity=1	64	1	1	1024	1	1	13910	-1	-1	-1	-1	2.42688e-05	# 2041.52 Gflop/s, 858.73 GB/s, tuning took 0.054318 seconds at Mon Jul 11 18:27:40 2022
     32x64x16x16	N4quda27TwistedCloverPreconditionedINS_16TwistedCloverArgIsLi3ELi4EL21QudaReconstructType_s18EEEEE	policy_kernel=exterior_z,commDim=0011,xpay,parity=1,zero_copy,p2p=1	32	1	1	2048	1	1	5962	-1	-1	-1	-1	2.43456e-05	# 2035.08 Gflop/s, 856.03 GB/s, tuning took 0.053877 seconds at Mon Jul 11 18:27:40 2022
     32x64x16x16	N4quda27TwistedCloverPreconditionedINS_16TwistedCloverArgIsLi3ELi4EL21QudaReconstructType_s18EEEEE	policy_kernel=interior,comm=0011,commDim=0011,dagger,parity=1	128	1	1	4096	1	1	0	-1	-1	-1	-1	0.000247194	# 3595.03 Gflop/s, 1646.93 GB/s, tuning took 0.404543 seconds at Mon Jul 11 18:25:04 2022
     32x64x16x16	N4quda27TwistedCloverPreconditionedINS_16TwistedCloverArgIsLi3ELi4EL21QudaReconstructType_s18EEEEE	policy_kernel=interior,comm=0011,commDim=0011,dagger,parity=1,host-device	128	1	1	4096	1	1	11128	2	-1	-1	-1	0.000252672	# 3523.31 Gflop/s, 1648.57 GB/s, tuning took 2.886304 seconds at Mon Jul 11 18:25:08 2022
     32x64x16x16	N4quda27TwistedCloverPreconditionedINS_16TwistedCloverArgIsLi3ELi4EL21QudaReconstructType_s18EEEEE	policy_kernel=interior,comm=0011,commDim=0011,dagger,parity=1,host-remote	128	1	1	4096	1	1	15174	2	-1	-1	-1	0.000252416	# 3526.88 Gflop/s, 1650.24 GB/s, tuning took 2.878716 seconds at Mon Jul 11 18:25:12 2022
     32x64x16x16	N4quda27TwistedCloverPreconditionedINS_16TwistedCloverArgIsLi3ELi4EL21QudaReconstructType_s18EEEEE	policy_kernel=interior,comm=0011,commDim=0011,parity=1	128	1	1	4096	1	1	33383	-1	-1	-1	-1	0.000248218	# 3580.20 Gflop/s, 1640.13 GB/s, tuning took 0.405525 seconds at Mon Jul 11 18:25:19 2022
     32x64x16x16	N4quda27TwistedCloverPreconditionedINS_16TwistedCloverArgIsLi3ELi4EL21QudaReconstructType_s18EEEEE	policy_kernel=interior,comm=0011,commDim=0011,parity=1,host-device	128	1	1	4096	1	1	10433	3	-1	-1	-1	0.000253184	# 3516.18 Gflop/s, 1645.23 GB/s, tuning took 2.889715 seconds at Mon Jul 11 18:25:23 2022
     32x64x16x16	N4quda27TwistedCloverPreconditionedINS_16TwistedCloverArgIsLi3ELi4EL21QudaReconstructType_s18EEEEE	policy_kernel=interior,comm=0011,commDim=0011,parity=1,host-remote	128	1	1	4096	1	1	10433	3	-1	-1	-1	0.00025344	# 3512.63 Gflop/s, 1643.57 GB/s, tuning took 2.886351 seconds at Mon Jul 11 18:25:26 2022
     32x64x16x16	N4quda27TwistedCloverPreconditionedINS_16TwistedCloverArgIsLi3ELi4EL21QudaReconstructType_s18EEEEE	policy_kernel=interior,comm=0011,commDim=0011,xpay,parity=1	128	1	1	4096	1	1	15174	-1	-1	-1	-1	0.00025472	# 3587.60 Gflop/s, 1598.26 GB/s, tuning took 0.408634 seconds at Mon Jul 11 18:27:40 2022
     32x64x16x16	N4quda27TwistedCloverPreconditionedINS_16TwistedCloverArgIsLi3ELi4EL21QudaReconstructType_s18EEEEE	policy_kernel=interior,comm=0011,commDim=0011,xpay,parity=1,host-device	128	1	1	4096	1	1	15174	2	-1	-1	-1	0.000260608	# 3512.58 Gflop/s, 1598.37 GB/s, tuning took 2.934406 seconds at Mon Jul 11 18:27:44 2022
     32x64x16x16	N4quda27TwistedCloverPreconditionedINS_16TwistedCloverArgIsLi3ELi4EL21QudaReconstructType_s18EEEEE	policy_kernel=interior,comm=0011,commDim=0011,xpay,parity=1,host-remote	128	1	1	4096	1	1	11923	2	-1	-1	-1	0.000259584	# 3526.44 Gflop/s, 1604.67 GB/s, tuning took 2.929057 seconds at Mon Jul 11 18:27:47 2022
     32x64x16x16	N4quda4PackIdLi3ELb1EEE	policy_kernel,vol=524288,parity=1,precision=8,order=2,Ns=4,Nc=3,TwistFlavor=1,comm=0011,topo=1148,order=0123,dagger,nFace=1,device-device	320	1	1	205	1	1	0	-1	-1	-1	-1	1.3824e-05	# 113.78 Gflop/s, 2730.67 GB/s, tuning took 0.888599 seconds at Mon Jul 11 18:25:35 2022
     32x64x16x16	N4quda4PackIdLi3ELb1EEE	policy_kernel,vol=524288,parity=1,precision=8,order=2,Ns=4,Nc=3,TwistFlavor=1,comm=0011,topo=1148,order=0123,dagger,nFace=1,device-remote	256	1	1	64	1	1	0	-1	-1	-1	-1	4.48233e-05	# 35.09 Gflop/s, 842.17 GB/s, tuning took 1.403999 seconds at Mon Jul 11 18:25:44 2022
     32x64x16x16	N4quda4PackIdLi3ELb1EEE	policy_kernel,vol=524288,parity=1,precision=8,order=2,Ns=4,Nc=3,TwistFlavor=1,comm=0011,topo=1148,order=0123,dagger,nFace=1,host-device	224	1	1	4	1	1	0	-1	-1	-1	-1	0.00024535	# 6.41 Gflop/s, 153.86 GB/s, tuning took 0.181544 seconds at Mon Jul 11 18:25:36 2022
     32x64x16x16	N4quda4PackIdLi3ELb1EEE	policy_kernel,vol=524288,parity=1,precision=8,order=2,Ns=4,Nc=3,TwistFlavor=1,comm=0011,topo=1148,order=0123,dagger,nFace=1,host-remote	224	1	1	4	1	1	0	-1	-1	-1	-1	0.000245146	# 6.42 Gflop/s, 153.98 GB/s, tuning took 0.177278 seconds at Mon Jul 11 18:25:44 2022
     32x64x16x16	N4quda4PackIdLi3ELb1EEE	policy_kernel,vol=524288,parity=1,precision=8,order=2,Ns=4,Nc=3,TwistFlavor=1,comm=0011,topo=1148,order=0123,nFace=1,device-device	224	1	1	205	1	1	0	-1	-1	-1	-1	1.33421e-05	# 117.89 Gflop/s, 2829.29 GB/s, tuning took 0.884742 seconds at Mon Jul 11 18:26:06 2022
     32x64x16x16	N4quda4PackIdLi3ELb1EEE	policy_kernel,vol=524288,parity=1,precision=8,order=2,Ns=4,Nc=3,TwistFlavor=1,comm=0011,topo=1148,order=0123,nFace=1,device-remote	512	1	1	64	1	1	0	-1	-1	-1	-1	4.51025e-05	# 34.87 Gflop/s, 836.95 GB/s, tuning took 1.405819 seconds at Mon Jul 11 18:26:15 2022
     32x64x16x16	N4quda4PackIdLi3ELb1EEE	policy_kernel,vol=524288,parity=1,precision=8,order=2,Ns=4,Nc=3,TwistFlavor=1,comm=0011,topo=1148,order=0123,nFace=1,host-device	320	1	1	4	1	1	0	-1	-1	-1	-1	0.00024535	# 6.41 Gflop/s, 153.86 GB/s, tuning took 0.181716 seconds at Mon Jul 11 18:26:08 2022
     32x64x16x16	N4quda4PackIdLi3ELb1EEE	policy_kernel,vol=524288,parity=1,precision=8,order=2,Ns=4,Nc=3,TwistFlavor=1,comm=0011,topo=1148,order=0123,nFace=1,host-remote	224	1	1	4	1	1	0	-1	-1	-1	-1	0.00024535	# 6.41 Gflop/s, 153.86 GB/s, tuning took 0.177821 seconds at Mon Jul 11 18:26:15 2022
     32x64x16x16	N4quda4PackIfLi3ELb1EEE	policy_kernel,vol=524288,parity=1,precision=4,order=4,Ns=4,Nc=3,TwistFlavor=1,comm=0011,topo=1148,order=0123,dagger,nFace=1,device-device	608	1	1	108	1	1	0	-1	-1	-1	-1	8.87118e-06	# 177.30 Gflop/s, 2127.60 GB/s, tuning took 0.524926 seconds at Mon Jul 11 18:27:20 2022
     32x64x16x16	N4quda4PackIfLi3ELb1EEE	policy_kernel,vol=524288,parity=1,precision=4,order=4,Ns=4,Nc=3,TwistFlavor=1,comm=0011,topo=1148,order=0123,dagger,nFace=1,device-remote	768	1	1	16	1	1	0	-1	-1	-1	-1	2.52227e-05	# 62.36 Gflop/s, 748.31 GB/s, tuning took 0.855411 seconds at Mon Jul 11 18:27:26 2022
     32x64x16x16	N4quda4PackIfLi3ELb1EEE	policy_kernel,vol=524288,parity=1,precision=4,order=4,Ns=4,Nc=3,TwistFlavor=1,comm=0011,topo=1148,order=0123,dagger,nFace=1,host-device	320	1	1	4	1	1	0	-1	-1	-1	-1	0.000125696	# 12.51 Gflop/s, 150.16 GB/s, tuning took 0.100707 seconds at Mon Jul 11 18:27:21 2022
     32x64x16x16	N4quda4PackIfLi3ELb1EEE	policy_kernel,vol=524288,parity=1,precision=4,order=4,Ns=4,Nc=3,TwistFlavor=1,comm=0011,topo=1148,order=0123,dagger,nFace=1,host-remote	224	1	1	4	1	1	0	-1	-1	-1	-1	0.000125696	# 12.51 Gflop/s, 150.16 GB/s, tuning took 0.100978 seconds at Mon Jul 11 18:27:26 2022
     32x64x16x16	N4quda4PackIfLi3ELb1EEE	policy_kernel,vol=524288,parity=1,precision=4,order=4,Ns=4,Nc=3,TwistFlavor=1,comm=0011,topo=1148,order=0123,nFace=1,device-device	640	1	1	108	1	1	0	-1	-1	-1	-1	8.94433e-06	# 175.85 Gflop/s, 2110.21 GB/s, tuning took 0.522306 seconds at Mon Jul 11 18:26:52 2022
     32x64x16x16	N4quda4PackIfLi3ELb1EEE	policy_kernel,vol=524288,parity=1,precision=4,order=4,Ns=4,Nc=3,TwistFlavor=1,comm=0011,topo=1148,order=0123,nFace=1,device-remote	768	1	1	16	1	1	0	-1	-1	-1	-1	2.52497e-05	# 62.29 Gflop/s, 747.51 GB/s, tuning took 0.851848 seconds at Mon Jul 11 18:26:58 2022
     32x64x16x16	N4quda4PackIfLi3ELb1EEE	policy_kernel,vol=524288,parity=1,precision=4,order=4,Ns=4,Nc=3,TwistFlavor=1,comm=0011,topo=1148,order=0123,nFace=1,host-device	352	1	1	4	1	1	0	-1	-1	-1	-1	0.000125696	# 12.51 Gflop/s, 150.16 GB/s, tuning took 0.098975 seconds at Mon Jul 11 18:26:53 2022
     32x64x16x16	N4quda4PackIfLi3ELb1EEE	policy_kernel,vol=524288,parity=1,precision=4,order=4,Ns=4,Nc=3,TwistFlavor=1,comm=0011,topo=1148,order=0123,nFace=1,host-remote	224	1	1	4	1	1	0	-1	-1	-1	-1	0.000125568	# 12.53 Gflop/s, 150.31 GB/s, tuning took 0.099541 seconds at Mon Jul 11 18:26:58 2022
     32x64x16x16	N4quda4PackIsLi3ELb1EEE	policy_kernel,vol=524288,parity=1,precision=2,order=8,Ns=4,Nc=3,TwistFlavor=1,comm=0011,topo=1148,order=0123,dagger,nFace=1,device-device	896	1	1	200	1	1	0	-1	-1	-1	-1	7.95714e-06	# 197.67 Gflop/s, 1317.78 GB/s, tuning took 0.544265 seconds at Mon Jul 11 18:25:04 2022
     32x64x16x16	N4quda4PackIsLi3ELb1EEE	policy_kernel,vol=524288,parity=1,precision=2,order=8,Ns=4,Nc=3,TwistFlavor=1,comm=0011,topo=1148,order=0123,dagger,nFace=1,device-remote	800	1	1	55	1	1	0	-1	-1	-1	-1	1.88135e-05	# 83.60 Gflop/s, 557.35 GB/s, tuning took 0.757568 seconds at Mon Jul 11 18:25:09 2022
     32x64x16x16	N4quda4PackIsLi3ELb1EEE	policy_kernel,vol=524288,parity=1,precision=2,order=8,Ns=4,Nc=3,TwistFlavor=1,comm=0011,topo=1148,order=0123,dagger,nFace=1,host-device	736	1	1	4	1	1	0	-1	-1	-1	-1	7.64849e-05	# 20.56 Gflop/s, 137.10 GB/s, tuning took 0.091158 seconds at Mon Jul 11 18:25:05 2022
     32x64x16x16	N4quda4PackIsLi3ELb1EEE	policy_kernel,vol=524288,parity=1,precision=2,order=8,Ns=4,Nc=3,TwistFlavor=1,comm=0011,topo=1148,order=0123,dagger,nFace=1,host-remote	768	1	1	4	1	1	0	-1	-1	-1	-1	7.64062e-05	# 20.59 Gflop/s, 137.24 GB/s, tuning took 0.091566 seconds at Mon Jul 11 18:25:09 2022
     32x64x16x16	N4quda4PackIsLi3ELb1EEE	policy_kernel,vol=524288,parity=1,precision=2,order=8,Ns=4,Nc=3,TwistFlavor=1,comm=0011,topo=1148,order=0123,nFace=1,device-device	960	1	1	193	1	1	0	-1	-1	-1	-1	7.87259e-06	# 199.79 Gflop/s, 1331.93 GB/s, tuning took 0.543853 seconds at Mon Jul 11 18:25:19 2022
     32x64x16x16	N4quda4PackIsLi3ELb1EEE	policy_kernel,vol=524288,parity=1,precision=2,order=8,Ns=4,Nc=3,TwistFlavor=1,comm=0011,topo=1148,order=0123,nFace=1,device-remote	192	1	1	55	1	1	0	-1	-1	-1	-1	1.87934e-05	# 83.69 Gflop/s, 557.95 GB/s, tuning took 0.757989 seconds at Mon Jul 11 18:25:23 2022
     32x64x16x16	N4quda4PackIsLi3ELb1EEE	policy_kernel,vol=524288,parity=1,precision=2,order=8,Ns=4,Nc=3,TwistFlavor=1,comm=0011,topo=1148,order=0123,nFace=1,host-device	768	1	1	4	1	1	0	-1	-1	-1	-1	7.65637e-05	# 20.54 Gflop/s, 136.95 GB/s, tuning took 0.091325 seconds at Mon Jul 11 18:25:19 2022
     32x64x16x16	N4quda4PackIsLi3ELb1EEE	policy_kernel,vol=524288,parity=1,precision=2,order=8,Ns=4,Nc=3,TwistFlavor=1,comm=0011,topo=1148,order=0123,nFace=1,host-remote	896	1	1	4	1	1	0	-1	-1	-1	-1	7.66425e-05	# 20.52 Gflop/s, 136.81 GB/s, tuning took 0.091652 seconds at Mon Jul 11 18:25:24 2022
     32x64x16x16	N4quda4blas10CdotNormABIdfEE	GPU-offline,nParity=1,vol=524288,parity=1,precision=4,order=4,Ns=4,Nc=3,TwistFlavor=1	736	1	1	96	1	1	0	-1	-1	-1	-1	8.45982e-05	# 1189.90 Gflop/s, 1189.90 GB/s, tuning took 0.714886 seconds at Mon Jul 11 18:33:22 2022
     32x64x16x16	N4quda4blas11axpbyzNorm2IddEE	GPU-offline,nParity=1,vol=524288,parity=1,precision=8,order=2,Ns=4,Nc=3,TwistFlavor=1	480	1	1	192	1	1	0	-1	-1	-1	-1	0.000233882	# 215.20 Gflop/s, 1291.21 GB/s, tuning took 1.513042 seconds at Mon Jul 11 18:26:38 2022
     32x64x16x16	N4quda4blas11axpbyzNorm2IdfEE	GPU-offline,nParity=1,vol=524288,parity=1,precision=2,order=8,Ns=4,Nc=3,TwistFlavor=1	608	1	1	192	1	1	0	-1	-1	-1	-1	7.41669e-05	# 678.63 Gflop/s, 1102.77 GB/s, tuning took 0.481221 seconds at Mon Jul 11 18:26:39 2022
     32x64x16x16	N4quda4blas11axpbyzNorm2IdfEE	GPU-offline,nParity=1,vol=524288,parity=1,precision=4,order=4,Ns=4,Nc=3,TwistFlavor=1	1024	1	1	96	1	1	0	-1	-1	-1	-1	0.000123904	# 406.21 Gflop/s, 1218.64 GB/s, tuning took 0.825579 seconds at Mon Jul 11 18:27:40 2022
     32x64x16x16	N4quda4blas11multicaxpy_IdEE	GPU-offline,vol=524288,parity=1,precision=2,order=8,Ns=4,Nc=3,TwistFlavor=1,vol=524288,parity=1,precision=8,order=2,Ns=4,Nc=3,TwistFlavor=1,Nxz=1,Nyw=1	672	1	1	216	1	1	0	1	0	0	0	0.000178176	# 282.48 Gflop/s, 1282.94 GB/s, tuning took 0.026646 seconds at Mon Jul 11 18:25:34 2022
     32x64x16x16	N4quda4blas11multicaxpy_IdEE	GPU-offline,vol=524288,parity=1,precision=4,order=4,Ns=4,Nc=3,TwistFlavor=1,vol=524288,parity=1,precision=8,order=2,Ns=4,Nc=3,TwistFlavor=1,Nxz=2,Nyw=1	288	1	1	216	1	1	0	1	0	0	0	0.000230195	# 437.30 Gflop/s, 1311.89 GB/s, tuning took 0.029428 seconds at Mon Jul 11 18:35:46 2022
     32x64x16x16	N4quda4blas11multicaxpy_IdEE	GPU-offline,vol=524288,parity=1,precision=4,order=4,Ns=4,Nc=3,TwistFlavor=1,vol=524288,parity=1,precision=8,order=2,Ns=4,Nc=3,TwistFlavor=1,Nxz=3,Nyw=1	512	1	1	216	1	1	0	1	0	0	0	0.000264704	# 570.43 Gflop/s, 1331.00 GB/s, tuning took 0.027412 seconds at Mon Jul 11 18:33:54 2022
     32x64x16x16	N4quda4blas11multicaxpy_IdEE	GPU-offline,vol=524288,parity=1,precision=4,order=4,Ns=4,Nc=3,TwistFlavor=1,vol=524288,parity=1,precision=8,order=2,Ns=4,Nc=3,TwistFlavor=1,Nxz=4,Nyw=1	256	1	1	216	1	1	0	1	0	0	0	0.00030336	# 663.66 Gflop/s, 1327.31 GB/s, tuning took 0.032071 seconds at Mon Jul 11 18:33:54 2022
     32x64x16x16	N4quda4blas11multicaxpy_IdEE	GPU-offline,vol=524288,parity=1,precision=4,order=4,Ns=4,Nc=3,TwistFlavor=1,vol=524288,parity=1,precision=8,order=2,Ns=4,Nc=3,TwistFlavor=1,Nxz=8,Nyw=1	192	1	1	216	1	1	0	1	0	0	0	0.000452949	# 888.96 Gflop/s, 1333.44 GB/s, tuning took 0.036864 seconds at Mon Jul 11 18:33:54 2022
     32x64x16x16	N4quda4blas11multicaxpy_IfEE	GPU-offline,vol=524288,parity=1,precision=2,order=8,Ns=4,Nc=3,TwistFlavor=1,vol=524288,parity=1,precision=4,order=4,Ns=4,Nc=3,TwistFlavor=1,Nxz=1,Nyw=1	896	1	1	216	1	1	0	1	0	0	0	0.000104141	# 483.30 Gflop/s, 1228.40 GB/s, tuning took 0.022652 seconds at Mon Jul 11 18:27:53 2022
     32x64x16x16	N4quda4blas11multicaxpy_IfEE	GPU-offline,vol=524288,parity=1,precision=2,order=8,Ns=4,Nc=3,TwistFlavor=1,vol=524288,parity=1,precision=4,order=4,Ns=4,Nc=3,TwistFlavor=1,Nxz=4,Nyw=1	992	1	1	216	1	1	0	1	0	0	0	0.00016384	# 1228.80 Gflop/s, 1280.00 GB/s, tuning took 0.031188 seconds at Mon Jul 11 18:33:12 2022
     32x64x16x16	N4quda4blas11multicaxpy_IfEE	GPU-offline,vol=524288,parity=1,precision=4,order=4,Ns=4,Nc=3,TwistFlavor=1,Nxz=1,Nyw=1	416	1	1	216	1	1	0	1	0	0	0	0.000120263	# 418.51 Gflop/s, 1255.54 GB/s, tuning took 0.025499 seconds at Mon Jul 11 18:33:23 2022
     32x64x16x16	N4quda4blas11multicaxpy_IfEE	GPU-offline,vol=524288,parity=1,precision=4,order=4,Ns=4,Nc=3,TwistFlavor=1,Nxz=16,Nyw=1	992	1	1	216	1	1	0	1	0	0	0	0.000680277	# 1183.79 Gflop/s, 1331.77 GB/s, tuning took 0.111191 seconds at Mon Jul 11 18:34:04 2022
     32x64x16x16	N4quda4blas11multicaxpy_IfEE	GPU-offline,vol=524288,parity=1,precision=4,order=4,Ns=4,Nc=3,TwistFlavor=1,Nxz=2,Nyw=1	416	1	1	216	1	1	0	1	0	0	0	0.000154917	# 649.79 Gflop/s, 1299.58 GB/s, tuning took 0.029121 seconds at Mon Jul 11 18:33:24 2022
     32x64x16x16	N4quda4blas11multicaxpy_IfEE	GPU-offline,vol=524288,parity=1,precision=4,order=4,Ns=4,Nc=3,TwistFlavor=1,Nxz=3,Nyw=1	768	1	1	216	1	1	0	1	0	0	0	0.000189269	# 797.78 Gflop/s, 1329.63 GB/s, tuning took 0.034451 seconds at Mon Jul 11 18:33:26 2022
     32x64x16x16	N4quda4blas11multicaxpy_IfEE	GPU-offline,vol=524288,parity=1,precision=4,order=4,Ns=4,Nc=3,TwistFlavor=1,Nxz=4,Nyw=1	1024	1	1	216	1	1	0	1	0	0	0	0.000225894	# 891.24 Gflop/s, 1336.86 GB/s, tuning took 0.040765 seconds at Mon Jul 11 18:33:27 2022
     32x64x16x16	N4quda4blas11multicaxpy_IfEE	GPU-offline,vol=524288,parity=1,precision=4,order=4,Ns=4,Nc=3,TwistFlavor=1,Nxz=8,Nyw=1	768	1	1	216	1	1	0	1	0	0	0	0.000379904	# 1059.88 Gflop/s, 1324.85 GB/s, tuning took 0.062015 seconds at Mon Jul 11 18:33:36 2022
     32x64x16x16	N4quda4blas12TileSizeTuneINS0_9multiCdotES2_St7complexIdEEE	nested_policy,vol=524288,parity=1,precision=2,order=8,Ns=4,Nc=3,TwistFlavor=1,vol=524288,parity=1,precision=2,order=8,Ns=4,Nc=3,TwistFlavor=1,n=4,m=5,multi-blas-n=4,max_nyw_tile=8	32	1	1	1	1	1	0	4	5	0	0	0.000308224	# 0.00 Gflop/s, 0.00 GB/s, tuning took 0.017715 seconds at Mon Jul 11 18:33:10 2022
     32x64x16x16	N4quda4blas12TileSizeTuneINS0_9multiCdotES2_St7complexIdEEE	nested_policy,vol=524288,parity=1,precision=2,order=8,Ns=4,Nc=3,TwistFlavor=1,vol=524288,parity=1,precision=2,order=8,Ns=4,Nc=3,TwistFlavor=1,n=5,m=4,multi-blas-n=4,max_nyw_tile=8	32	1	1	1	1	1	0	4	4	0	0	0.000368299	# 0.00 Gflop/s, 0.00 GB/s, tuning took 0.013509 seconds at Mon Jul 11 18:33:12 2022
     32x64x16x16	N4quda4blas13TransposeTuneINS0_9multiCdotES2_St7complexIdEEE	policy,vol=524288,parity=1,precision=2,order=8,Ns=4,Nc=3,TwistFlavor=1,vol=524288,parity=1,precision=2,order=8,Ns=4,Nc=3,TwistFlavor=1,n=4,m=5,multi-blas-n=4,max_nyw_tile=8	32	1	1	1	1	1	0	0	0	0	0	0.000308224	# 0.00 Gflop/s, 0.00 GB/s, tuning took 0.005494 seconds at Mon Jul 11 18:33:12 2022
     32x64x16x16	N4quda4blas13cabxpyzaxnormIdfEE	GPU-offline,nParity=1,vol=524288,parity=1,precision=4,order=4,Ns=4,Nc=3,TwistFlavor=1	608	1	1	90	1	1	0	-1	-1	-1	-1	0.000162231	# 775.62 Gflop/s, 1240.99 GB/s, tuning took 0.954653 seconds at Mon Jul 11 18:33:23 2022
     32x64x16x16	N4quda4blas15tripleCGUpdate_IdEE	GPU-offline,vol=524288,parity=1,precision=2,order=8,Ns=4,Nc=3,TwistFlavor=1,vol=524288,parity=1,precision=8,order=2,Ns=4,Nc=3,TwistFlavor=1	128	1	1	216	1	1	0	-1	-1	-1	-1	0.000264448	# 285.49 Gflop/s, 1276.78 GB/s, tuning took 0.018051 seconds at Mon Jul 11 18:25:34 2022
     32x64x16x16	N4quda4blas15tripleCGUpdate_IfEE	GPU-offline,vol=524288,parity=1,precision=2,order=8,Ns=4,Nc=3,TwistFlavor=1,vol=524288,parity=1,precision=4,order=4,Ns=4,Nc=3,TwistFlavor=1	256	1	1	216	1	1	0	-1	-1	-1	-1	0.000181419	# 416.15 Gflop/s, 1306.25 GB/s, tuning took 0.022513 seconds at Mon Jul 11 18:27:53 2022
     32x64x16x16	N4quda4blas18tripleCGReduction_IdfEE	GPU-offline,nParity=1,vol=524288,parity=1,precision=2,order=8,Ns=4,Nc=3,TwistFlavor=1	320	1	1	192	1	1	0	-1	-1	-1	-1	7.23383e-05	# 1043.67 Gflop/s, 1130.65 GB/s, tuning took 0.627878 seconds at Mon Jul 11 18:25:34 2022
     32x64x16x16	N4quda4blas23HeavyQuarkResidualNorm_IddEE	GPU-offline,nParity=1,vol=524288,parity=1,precision=8,order=2,Ns=4,Nc=3,TwistFlavor=1	768	1	1	192	1	1	0	-1	-1	-1	-1	0.00014965	# 336.33 Gflop/s, 1345.31 GB/s, tuning took 0.947797 seconds at Mon Jul 11 18:26:40 2022
     32x64x16x16	N4quda4blas23HeavyQuarkResidualNorm_IdfEE	GPU-offline,nParity=1,vol=524288,parity=1,precision=4,order=4,Ns=4,Nc=3,TwistFlavor=1	608	1	1	192	1	1	0	-1	-1	-1	-1	8.25501e-05	# 609.71 Gflop/s, 1219.42 GB/s, tuning took 0.562869 seconds at Mon Jul 11 18:27:55 2022
     32x64x16x16	N4quda4blas4CdotIdfEE	GPU-offline,nParity=1,vol=524288,parity=1,precision=2,order=8,Ns=4,Nc=3,TwistFlavor=1	320	1	1	192	1	1	0	-1	-1	-1	-1	5.30863e-05	# 948.11 Gflop/s, 1027.12 GB/s, tuning took 0.433094 seconds at Mon Jul 11 18:26:38 2022
     32x64x16x16	N4quda4blas5Norm2IddEE	GPU-offline,nParity=1,vol=524288,parity=1,precision=8,order=2,Ns=4,Nc=3,TwistFlavor=1	576	1	1	192	1	1	0	-1	-1	-1	-1	8.2944e-05	# 303.41 Gflop/s, 1213.63 GB/s, tuning took 0.983152 seconds at Mon Jul 11 18:25:03 2022
     32x64x16x16	N4quda4blas5Norm2IdfEE	GPU-offline,nParity=1,vol=524288,parity=1,precision=4,order=4,Ns=4,Nc=3,TwistFlavor=1	608	1	1	192	1	1	0	-1	-1	-1	-1	4.73367e-05	# 531.63 Gflop/s, 1063.27 GB/s, tuning took 0.558265 seconds at Mon Jul 11 18:27:03 2022
     32x64x16x16	N4quda4blas6caxpy_IfEE	GPU-offline,vol=524288,parity=1,precision=2,order=8,Ns=4,Nc=3,TwistFlavor=1	608	1	1	216	1	1	0	-1	-1	-1	-1	6.4896e-05	# 775.57 Gflop/s, 1260.31 GB/s, tuning took 0.018172 seconds at Mon Jul 11 18:26:38 2022
     32x64x16x16	N4quda4blas7axpbyz_IdEE	GPU-offline,vol=524288,parity=1,precision=8,order=2,Ns=4,Nc=3,TwistFlavor=1	352	1	1	216	1	1	0	-1	-1	-1	-1	0.000226304	# 166.81 Gflop/s, 1334.44 GB/s, tuning took 0.037972 seconds at Mon Jul 11 18:25:34 2022
     32x64x16x16	N4quda4blas7axpbyz_IfEE	GPU-offline,vol=524288,parity=1,precision=2,order=8,Ns=4,Nc=3,TwistFlavor=1	704	1	1	216	1	1	0	-1	-1	-1	-1	6.3872e-05	# 591.01 Gflop/s, 1280.51 GB/s, tuning took 0.018136 seconds at Mon Jul 11 18:26:39 2022
     32x64x16x16	N4quda4blas7axpbyz_IfEE	GPU-offline,vol=524288,parity=1,precision=4,order=4,Ns=4,Nc=3,TwistFlavor=1	384	1	1	216	1	1	0	-1	-1	-1	-1	0.000115598	# 326.55 Gflop/s, 1306.20 GB/s, tuning took 0.024389 seconds at Mon Jul 11 18:27:53 2022
     32x64x16x16	N4quda4blas9axpyZpbx_IdEE	GPU-offline,vol=524288,parity=1,precision=2,order=8,Ns=4,Nc=3,TwistFlavor=1,vol=524288,parity=1,precision=8,order=2,Ns=4,Nc=3,TwistFlavor=1	384	1	1	216	1	1	0	-1	-1	-1	-1	0.000219136	# 229.68 Gflop/s, 1291.96 GB/s, tuning took 0.021999 seconds at Mon Jul 11 18:26:39 2022
     32x64x16x16	N4quda4blas9axpyZpbx_IfEE	GPU-offline,vol=524288,parity=1,precision=2,order=8,Ns=4,Nc=3,TwistFlavor=1,vol=524288,parity=1,precision=4,order=4,Ns=4,Nc=3,TwistFlavor=1	256	1	1	216	1	1	0	-1	-1	-1	-1	0.000141696	# 355.21 Gflop/s, 1287.63 GB/s, tuning took 0.022385 seconds at Mon Jul 11 18:27:53 2022
     32x64x16x16	N4quda4blas9multiCdotIdfEE	policy_kernel,GPU-offline,nParity=1,vol=524288,parity=1,precision=2,order=8,Ns=4,Nc=3,TwistFlavor=1,Nxz=1,Nyw=1,max_nyw_tile=8	256	1	1	216	1	1	0	-1	-1	-1	-1	5.4272e-05	# 927.40 Gflop/s, 1004.68 GB/s, tuning took 0.140303 seconds at Mon Jul 11 18:33:05 2022
     32x64x16x16	N4quda4blas9multiCdotIdfEE	policy_kernel,GPU-offline,nParity=1,vol=524288,parity=1,precision=2,order=8,Ns=4,Nc=3,TwistFlavor=1,Nxz=1,Nyw=1,max_nyw_tile=8,norm	256	1	1	216	1	1	0	-1	-1	-1	-1	3.68261e-05	# 1366.74 Gflop/s, 1480.63 GB/s, tuning took 0.104551 seconds at Mon Jul 11 18:33:05 2022
     32x64x16x16	N4quda4blas9multiCdotIdfEE	policy_kernel,GPU-offline,nParity=1,vol=524288,parity=1,precision=2,order=8,Ns=4,Nc=3,TwistFlavor=1,Nxz=1,Nyw=2,max_nyw_tile=8	256	1	2	204	1	1	0	-1	-1	-1	-1	7.72389e-05	# 1303.27 Gflop/s, 1411.88 GB/s, tuning took 0.283664 seconds at Mon Jul 11 18:33:10 2022
     32x64x16x16	N4quda4blas9multiCdotIdfEE	policy_kernel,GPU-offline,nParity=1,vol=524288,parity=1,precision=2,order=8,Ns=4,Nc=3,TwistFlavor=1,Nxz=2,Nyw=1,max_nyw_tile=8	512	1	1	192	1	1	0	-1	-1	-1	-1	7.54103e-05	# 1334.87 Gflop/s, 1084.59 GB/s, tuning took 0.187421 seconds at Mon Jul 11 18:33:06 2022
     32x64x16x16	N4quda4blas9multiCdotIdfEE	policy_kernel,GPU-offline,nParity=1,vol=524288,parity=1,precision=2,order=8,Ns=4,Nc=3,TwistFlavor=1,Nxz=2,Nyw=2,max_nyw_tile=8	256	1	2	216	1	1	0	-1	-1	-1	-1	9.94304e-05	# 2024.80 Gflop/s, 1645.15 GB/s, tuning took 0.382288 seconds at Mon Jul 11 18:33:06 2022
     32x64x16x16	N4quda4blas9multiCdotIdfEE	policy_kernel,GPU-offline,nParity=1,vol=524288,parity=1,precision=2,order=8,Ns=4,Nc=3,TwistFlavor=1,Nxz=2,Nyw=2,max_nyw_tile=8,norm	256	1	2	216	1	1	0	-1	-1	-1	-1	8.832e-05	# 2279.51 Gflop/s, 1852.10 GB/s, tuning took 0.359808 seconds at Mon Jul 11 18:33:06 2022
     32x64x16x16	N4quda4blas9multiCdotIdfEE	policy_kernel,GPU-offline,nParity=1,vol=524288,parity=1,precision=2,order=8,Ns=4,Nc=3,TwistFlavor=1,Nxz=2,Nyw=4,max_nyw_tile=8	512	1	2	54	1	2	0	-1	-1	-1	-1	0.000151845	# 2651.75 Gflop/s, 2154.54 GB/s, tuning took 0.820057 seconds at Mon Jul 11 18:33:11 2022
     32x64x16x16	N4quda4blas9multiCdotIdfEE	policy_kernel,GPU-offline,nParity=1,vol=524288,parity=1,precision=2,order=8,Ns=4,Nc=3,TwistFlavor=1,Nxz=3,Nyw=4,max_nyw_tile=8	256	1	2	54	1	2	0	-1	-1	-1	-1	0.00021545	# 2803.35 Gflop/s, 2024.64 GB/s, tuning took 1.029136 seconds at Mon Jul 11 18:33:12 2022
     32x64x16x16	N4quda4blas9multiCdotIdfEE	policy_kernel,GPU-offline,nParity=1,vol=524288,parity=1,precision=2,order=8,Ns=4,Nc=3,TwistFlavor=1,Nxz=4,Nyw=2,max_nyw_tile=8	512	1	1	54	1	2	0	-1	-1	-1	-1	0.000148919	# 2703.84 Gflop/s, 1830.73 GB/s, tuning took 0.610466 seconds at Mon Jul 11 18:33:07 2022
     32x64x16x16	N4quda4blas9multiCdotIdfEE	policy_kernel,GPU-offline,nParity=1,vol=524288,parity=1,precision=2,order=8,Ns=4,Nc=3,TwistFlavor=1,Nxz=4,Nyw=3,max_nyw_tile=8	256	1	3	108	1	1	0	-1	-1	-1	-1	0.000196608	# 3072.00 Gflop/s, 2080.00 GB/s, tuning took 0.909605 seconds at Mon Jul 11 18:33:08 2022
     32x64x16x16	N4quda4blas9multiCdotIdfEE	policy_kernel,GPU-offline,nParity=1,vol=524288,parity=1,precision=2,order=8,Ns=4,Nc=3,TwistFlavor=1,Nxz=4,Nyw=5,max_nyw_tile=8	128	1	5	108	1	1	0	-1	-1	-1	-1	0.000308992	# 3257.80 Gflop/s, 2205.80 GB/s, tuning took 1.670596 seconds at Mon Jul 11 18:33:10 2022
     32x64x16x16	N4quda4blas9multiCdotIdfEE	policy_kernel,GPU-offline,nParity=1,vol=524288,parity=1,precision=4,order=4,Ns=4,Nc=3,TwistFlavor=1,Nxz=1,Nyw=1,max_nyw_tile=8	1024	1	1	96	1	1	0	-1	-1	-1	-1	8.55893e-05	# 588.06 Gflop/s, 1176.12 GB/s, tuning took 0.279229 seconds at Mon Jul 11 18:33:23 2022
     32x64x16x16	N4quda4blas9multiCdotIdfEE	policy_kernel,GPU-offline,nParity=1,vol=524288,parity=1,precision=4,order=4,Ns=4,Nc=3,TwistFlavor=1,Nxz=1,Nyw=10,max_nyw_tile=8	128	1	6	108	1	2	0	-1	-1	-1	-1	0.000413696	# 1216.63 Gflop/s, 2433.27 GB/s, tuning took 2.679624 seconds at Mon Jul 11 18:33:41 2022
     32x64x16x16	N4quda4blas9multiCdotIdfEE	policy_kernel,GPU-offline,nParity=1,vol=524288,parity=1,precision=4,order=4,Ns=4,Nc=3,TwistFlavor=1,Nxz=1,Nyw=11,max_nyw_tile=8	128	1	6	108	1	2	0	-1	-1	-1	-1	0.000457045	# 1211.36 Gflop/s, 2422.73 GB/s, tuning took 2.794645 seconds at Mon Jul 11 18:33:44 2022
     32x64x16x16	N4quda4blas9multiCdotIdfEE	policy_kernel,GPU-offline,nParity=1,vol=524288,parity=1,precision=4,order=4,Ns=4,Nc=3,TwistFlavor=1,Nxz=1,Nyw=12,max_nyw_tile=8	256	1	4	36	1	3	0	-1	-1	-1	-1	0.000490155	# 1232.22 Gflop/s, 2464.45 GB/s, tuning took 2.894860 seconds at Mon Jul 11 18:33:47 2022
     32x64x16x16	N4quda4blas9multiCdotIdfEE	policy_kernel,GPU-offline,nParity=1,vol=524288,parity=1,precision=4,order=4,Ns=4,Nc=3,TwistFlavor=1,Nxz=1,Nyw=13,max_nyw_tile=8	64	1	7	162	1	2	0	-1	-1	-1	-1	0.000534869	# 1223.31 Gflop/s, 2446.62 GB/s, tuning took 3.046112 seconds at Mon Jul 11 18:33:51 2022
     32x64x16x16	N4quda4blas9multiCdotIdfEE	policy_kernel,GPU-offline,nParity=1,vol=524288,parity=1,precision=4,order=4,Ns=4,Nc=3,TwistFlavor=1,Nxz=1,Nyw=14,max_nyw_tile=8	64	1	8	162	1	2	0	-1	-1	-1	-1	0.000567979	# 1240.62 Gflop/s, 2481.23 GB/s, tuning took 3.147394 seconds at Mon Jul 11 18:33:54 2022
     32x64x16x16	N4quda4blas9multiCdotIdfEE	policy_kernel,GPU-offline,nParity=1,vol=524288,parity=1,precision=4,order=4,Ns=4,Nc=3,TwistFlavor=1,Nxz=1,Nyw=15,max_nyw_tile=8	64	1	8	162	1	2	0	-1	-1	-1	-1	0.000606891	# 1244.00 Gflop/s, 2488.01 GB/s, tuning took 3.276585 seconds at Mon Jul 11 18:34:01 2022
     32x64x16x16	N4quda4blas9multiCdotIdfEE	policy_kernel,GPU-offline,nParity=1,vol=524288,parity=1,precision=4,order=4,Ns=4,Nc=3,TwistFlavor=1,Nxz=1,Nyw=16,max_nyw_tile=8	64	1	8	162	1	2	0	-1	-1	-1	-1	0.000639317	# 1259.63 Gflop/s, 2519.27 GB/s, tuning took 3.394615 seconds at Mon Jul 11 18:34:04 2022
     32x64x16x16	N4quda4blas9multiCdotIdfEE	policy_kernel,GPU-offline,nParity=1,vol=524288,parity=1,precision=4,order=4,Ns=4,Nc=3,TwistFlavor=1,Nxz=1,Nyw=17,max_nyw_tile=8	1024	1	1	6	1	17	0	-1	-1	-1	-1	0.000683349	# 1252.12 Gflop/s, 2504.25 GB/s, tuning took 3.537618 seconds at Mon Jul 11 18:34:08 2022
     32x64x16x16	N4quda4blas9multiCdotIdfEE	policy_kernel,GPU-offline,nParity=1,vol=524288,parity=1,precision=4,order=4,Ns=4,Nc=3,TwistFlavor=1,Nxz=1,Nyw=18,max_nyw_tile=8	1024	1	1	6	1	18	0	-1	-1	-1	-1	0.000707243	# 1280.99 Gflop/s, 2561.98 GB/s, tuning took 3.640828 seconds at Mon Jul 11 18:34:12 2022
     32x64x16x16	N4quda4blas9multiCdotIdfEE	policy_kernel,GPU-offline,nParity=1,vol=524288,parity=1,precision=4,order=4,Ns=4,Nc=3,TwistFlavor=1,Nxz=1,Nyw=19,max_nyw_tile=8	64	1	6	108	1	4	0	-1	-1	-1	-1	0.000751957	# 1271.75 Gflop/s, 2543.50 GB/s, tuning took 3.794155 seconds at Mon Jul 11 18:34:16 2022
     32x64x16x16	N4quda4blas9multiCdotIdfEE	policy_kernel,GPU-offline,nParity=1,vol=524288,parity=1,precision=4,order=4,Ns=4,Nc=3,TwistFlavor=1,Nxz=1,Nyw=2,max_nyw_tile=8	512	1	2	96	1	1	0	-1	-1	-1	-1	0.000120604	# 834.66 Gflop/s, 1669.31 GB/s, tuning took 0.551493 seconds at Mon Jul 11 18:33:24 2022
     32x64x16x16	N4quda4blas9multiCdotIdfEE	policy_kernel,GPU-offline,nParity=1,vol=524288,parity=1,precision=4,order=4,Ns=4,Nc=3,TwistFlavor=1,Nxz=1,Nyw=20,max_nyw_tile=8	128	1	5	54	1	4	0	-1	-1	-1	-1	0.00078336	# 1285.02 Gflop/s, 2570.04 GB/s, tuning took 3.902021 seconds at Mon Jul 11 18:34:20 2022
     32x64x16x16	N4quda4blas9multiCdotIdfEE	policy_kernel,GPU-offline,nParity=1,vol=524288,parity=1,precision=4,order=4,Ns=4,Nc=3,TwistFlavor=1,Nxz=1,Nyw=21,max_nyw_tile=8	64	1	6	108	1	4	0	-1	-1	-1	-1	0.000834219	# 1267.01 Gflop/s, 2534.02 GB/s, tuning took 4.056433 seconds at Mon Jul 11 18:34:24 2022
     32x64x16x16	N4quda4blas9multiCdotIdfEE	policy_kernel,GPU-offline,nParity=1,vol=524288,parity=1,precision=4,order=4,Ns=4,Nc=3,TwistFlavor=1,Nxz=1,Nyw=22,max_nyw_tile=8	64	1	6	108	1	4	0	-1	-1	-1	-1	0.000863573	# 1282.23 Gflop/s, 2564.45 GB/s, tuning took 4.195297 seconds at Mon Jul 11 18:34:28 2022
     32x64x16x16	N4quda4blas9multiCdotIdfEE	policy_kernel,GPU-offline,nParity=1,vol=524288,parity=1,precision=4,order=4,Ns=4,Nc=3,TwistFlavor=1,Nxz=1,Nyw=23,max_nyw_tile=8	128	1	6	54	1	4	0	-1	-1	-1	-1	0.000899072	# 1287.58 Gflop/s, 2575.16 GB/s, tuning took 4.319520 seconds at Mon Jul 11 18:34:33 2022
     32x64x16x16	N4quda4blas9multiCdotIdfEE	policy_kernel,GPU-offline,nParity=1,vol=524288,parity=1,precision=4,order=4,Ns=4,Nc=3,TwistFlavor=1,Nxz=1,Nyw=3,max_nyw_tile=8	1024	1	1	36	1	3	0	-1	-1	-1	-1	0.000156526	# 964.67 Gflop/s, 1929.33 GB/s, tuning took 0.829981 seconds at Mon Jul 11 18:33:25 2022
     32x64x16x16	N4quda4blas9multiCdotIdfEE	policy_kernel,GPU-offline,nParity=1,vol=524288,parity=1,precision=4,order=4,Ns=4,Nc=3,TwistFlavor=1,Nxz=1,Nyw=4,max_nyw_tile=8	256	1	3	108	1	2	0	-1	-1	-1	-1	0.000191147	# 1053.26 Gflop/s, 2106.51 GB/s, tuning took 1.132345 seconds at Mon Jul 11 18:33:27 2022
     32x64x16x16	N4quda4blas9multiCdotIdfEE	policy_kernel,GPU-offline,nParity=1,vol=524288,parity=1,precision=4,order=4,Ns=4,Nc=3,TwistFlavor=1,Nxz=1,Nyw=5,max_nyw_tile=8	128	1	5	204	1	1	0	-1	-1	-1	-1	0.000228352	# 1102.06 Gflop/s, 2204.13 GB/s, tuning took 1.441459 seconds at Mon Jul 11 18:33:29 2022
     32x64x16x16	N4quda4blas9multiCdotIdfEE	policy_kernel,GPU-offline,nParity=1,vol=524288,parity=1,precision=4,order=4,Ns=4,Nc=3,TwistFlavor=1,Nxz=1,Nyw=6,max_nyw_tile=8	1024	1	1	18	1	6	0	-1	-1	-1	-1	0.000264704	# 1140.86 Gflop/s, 2281.72 GB/s, tuning took 1.757254 seconds at Mon Jul 11 18:33:31 2022
     32x64x16x16	N4quda4blas9multiCdotIdfEE	policy_kernel,GPU-offline,nParity=1,vol=524288,parity=1,precision=4,order=4,Ns=4,Nc=3,TwistFlavor=1,Nxz=1,Nyw=7,max_nyw_tile=8	128	1	4	108	1	2	0	-1	-1	-1	-1	0.000305664	# 1152.64 Gflop/s, 2305.29 GB/s, tuning took 2.106065 seconds at Mon Jul 11 18:33:33 2022
     32x64x16x16	N4quda4blas9multiCdotIdfEE	policy_kernel,GPU-offline,nParity=1,vol=524288,parity=1,precision=4,order=4,Ns=4,Nc=3,TwistFlavor=1,Nxz=1,Nyw=8,max_nyw_tile=8	128	1	6	108	1	2	0	-1	-1	-1	-1	0.000337237	# 1193.98 Gflop/s, 2387.95 GB/s, tuning took 2.461910 seconds at Mon Jul 11 18:33:36 2022
     32x64x16x16	N4quda4blas9multiCdotIdfEE	policy_kernel,GPU-offline,nParity=1,vol=524288,parity=1,precision=4,order=4,Ns=4,Nc=3,TwistFlavor=1,Nxz=1,Nyw=9,max_nyw_tile=8	128	1	6	108	1	2	0	-1	-1	-1	-1	0.000368299	# 1229.94 Gflop/s, 2459.88 GB/s, tuning took 2.577496 seconds at Mon Jul 11 18:33:39 2022
     32x64x16x16	N4quda6WilsonINS_9WilsonArgIfLi3ELi4EL21QudaReconstructType_s18EEEEE	policy,commDim=0011,xpay,dagger,parity=1,topo=1148,order=0123,p2p=7,gdr=1,nvshmem=0,pol=111111111111110000	32	1	1	1	1	1	0	5	1	0	-1	0.000431104	# 1663.70 Gflop/s, 1634.51 GB/s, tuning took 0.077169 seconds at Mon Jul 11 18:27:39 2022
     32x64x16x16	N4quda6WilsonINS_9WilsonArgIfLi3ELi4EL21QudaReconstructType_s18EEEEE	policy,commDim=0011,xpay,parity=1,topo=1148,order=0123,p2p=7,gdr=1,nvshmem=0,pol=111111111111110000	32	1	1	1	1	1	0	4	1	0	-1	0.000430763	# 1665.01 Gflop/s, 1635.80 GB/s, tuning took 0.077048 seconds at Mon Jul 11 18:27:02 2022
     32x64x16x16	N4quda6WilsonINS_9WilsonArgIfLi3ELi4EL21QudaReconstructType_s18EEEEE	policy_kernel=exterior_all,commDim=0011,xpay,dagger,parity=1	192	1	1	683	1	1	20865	-1	-1	-1	-1	1.69143e-05	# 1580.83 Gflop/s, 2417.75 GB/s, tuning took 0.045226 seconds at Mon Jul 11 18:27:30 2022
     32x64x16x16	N4quda6WilsonINS_9WilsonArgIfLi3ELi4EL21QudaReconstructType_s18EEEEE	policy_kernel=exterior_all,commDim=0011,xpay,dagger,parity=1,zero_copy,p2p=1	160	1	1	820	1	1	33383	-1	-1	-1	-1	0.000129792	# 206.01 Gflop/s, 315.08 GB/s, tuning took 0.190873 seconds at Mon Jul 11 18:27:31 2022
     32x64x16x16	N4quda6WilsonINS_9WilsonArgIfLi3ELi4EL21QudaReconstructType_s18EEEEE	policy_kernel=exterior_all,commDim=0011,xpay,parity=1	192	1	1	683	1	1	20865	-1	-1	-1	-1	1.68411e-05	# 1587.70 Gflop/s, 2428.25 GB/s, tuning took 0.045007 seconds at Mon Jul 11 18:26:53 2022
     32x64x16x16	N4quda6WilsonINS_9WilsonArgIfLi3ELi4EL21QudaReconstructType_s18EEEEE	policy_kernel=exterior_all,commDim=0011,xpay,parity=1,zero_copy,p2p=1	160	1	1	820	1	1	33383	-1	-1	-1	-1	0.000129792	# 206.01 Gflop/s, 315.08 GB/s, tuning took 0.190825 seconds at Mon Jul 11 18:26:53 2022
     32x64x16x16	N4quda6WilsonINS_9WilsonArgIfLi3ELi4EL21QudaReconstructType_s18EEEEE	policy_kernel=exterior_t,commDim=0011,xpay,dagger,parity=1	368	1	1	179	1	1	41729	-1	-1	-1	-1	9.96387e-06	# 1341.78 Gflop/s, 2052.14 GB/s, tuning took 0.032320 seconds at Mon Jul 11 18:27:30 2022
     32x64x16x16	N4quda6WilsonINS_9WilsonArgIfLi3ELi4EL21QudaReconstructType_s18EEEEE	policy_kernel=exterior_t,commDim=0011,xpay,dagger,parity=1,zero_copy,p2p=1	32	1	1	2048	1	1	55638	-1	-1	-1	-1	0.000128384	# 104.14 Gflop/s, 159.27 GB/s, tuning took 0.192252 seconds at Mon Jul 11 18:27:31 2022
     32x64x16x16	N4quda6WilsonINS_9WilsonArgIfLi3ELi4EL21QudaReconstructType_s18EEEEE	policy_kernel=exterior_t,commDim=0011,xpay,parity=1	32	1	1	2048	1	1	9273	-1	-1	-1	-1	9.81429e-06	# 1362.23 Gflop/s, 2083.41 GB/s, tuning took 0.032255 seconds at Mon Jul 11 18:26:53 2022
     32x64x16x16	N4quda6WilsonINS_9WilsonArgIfLi3ELi4EL21QudaReconstructType_s18EEEEE	policy_kernel=exterior_t,commDim=0011,xpay,parity=1,zero_copy,p2p=1	32	1	1	2048	1	1	55638	-1	-1	-1	-1	0.000128384	# 104.14 Gflop/s, 159.27 GB/s, tuning took 0.192166 seconds at Mon Jul 11 18:26:53 2022
     32x64x16x16	N4quda6WilsonINS_9WilsonArgIfLi3ELi4EL21QudaReconstructType_s18EEEEE	policy_kernel=exterior_z,commDim=0011,xpay,dagger,parity=1	16	1	1	4096	1	1	6677	-1	-1	-1	-1	9.77978e-06	# 1367.04 Gflop/s, 2090.77 GB/s, tuning took 0.031989 seconds at Mon Jul 11 18:27:30 2022
     32x64x16x16	N4quda6WilsonINS_9WilsonArgIfLi3ELi4EL21QudaReconstructType_s18EEEEE	policy_kernel=exterior_z,commDim=0011,xpay,dagger,parity=1,zero_copy,p2p=1	16	1	1	4096	1	1	6677	-1	-1	-1	-1	9.75676e-06	# 1370.26 Gflop/s, 2095.70 GB/s, tuning took 0.031837 seconds at Mon Jul 11 18:27:31 2022
     32x64x16x16	N4quda6WilsonINS_9WilsonArgIfLi3ELi4EL21QudaReconstructType_s18EEEEE	policy_kernel=exterior_z,commDim=0011,xpay,parity=1	16	1	1	4096	1	1	6677	-1	-1	-1	-1	9.74526e-06	# 1371.88 Gflop/s, 2098.17 GB/s, tuning took 0.031946 seconds at Mon Jul 11 18:26:53 2022
     32x64x16x16	N4quda6WilsonINS_9WilsonArgIfLi3ELi4EL21QudaReconstructType_s18EEEEE	policy_kernel=exterior_z,commDim=0011,xpay,parity=1,zero_copy,p2p=1	16	1	1	4096	1	1	6677	-1	-1	-1	-1	9.75676e-06	# 1370.26 Gflop/s, 2095.70 GB/s, tuning took 0.031750 seconds at Mon Jul 11 18:26:53 2022
     32x64x16x16	N4quda6WilsonINS_9WilsonArgIfLi3ELi4EL21QudaReconstructType_s18EEEEE	policy_kernel=interior,comm=0011,commDim=0011,xpay,dagger,parity=1	608	1	1	863	1	1	83457	-1	-1	-1	-1	0.000363179	# 1918.56 Gflop/s, 1827.61 GB/s, tuning took 0.558272 seconds at Mon Jul 11 18:27:30 2022
     32x64x16x16	N4quda6WilsonINS_9WilsonArgIfLi3ELi4EL21QudaReconstructType_s18EEEEE	policy_kernel=interior,comm=0011,commDim=0011,xpay,dagger,parity=1,host-device	64	1	1	8192	1	1	16692	4	-1	-1	-1	0.000376491	# 1854.90 Gflop/s, 1813.12 GB/s, tuning took 3.955245 seconds at Mon Jul 11 18:27:35 2022
     32x64x16x16	N4quda6WilsonINS_9WilsonArgIfLi3ELi4EL21QudaReconstructType_s18EEEEE	policy_kernel=interior,comm=0011,commDim=0011,xpay,dagger,parity=1,host-remote	320	1	1	1639	1	1	41729	1	-1	-1	-1	0.000374443	# 1865.04 Gflop/s, 1823.04 GB/s, tuning took 3.941094 seconds at Mon Jul 11 18:27:39 2022
     32x64x16x16	N4quda6WilsonINS_9WilsonArgIfLi3ELi4EL21QudaReconstructType_s18EEEEE	policy_kernel=interior,comm=0011,commDim=0011,xpay,parity=1	608	1	1	863	1	1	55638	-1	-1	-1	-1	0.000362155	# 1923.98 Gflop/s, 1832.78 GB/s, tuning took 0.559387 seconds at Mon Jul 11 18:26:53 2022
     32x64x16x16	N4quda6WilsonINS_9WilsonArgIfLi3ELi4EL21QudaReconstructType_s18EEEEE	policy_kernel=interior,comm=0011,commDim=0011,xpay,parity=1,host-device	320	1	1	1639	1	1	33383	1	-1	-1	-1	0.000375808	# 1858.27 Gflop/s, 1816.41 GB/s, tuning took 3.961345 seconds at Mon Jul 11 18:26:57 2022
     32x64x16x16	N4quda6WilsonINS_9WilsonArgIfLi3ELi4EL21QudaReconstructType_s18EEEEE	policy_kernel=interior,comm=0011,commDim=0011,xpay,parity=1,host-remote	320	1	1	1639	1	1	27819	1	-1	-1	-1	0.000373419	# 1870.16 Gflop/s, 1828.04 GB/s, tuning took 3.947323 seconds at Mon Jul 11 18:27:02 2022
     32x64x16x16	N4quda6WilsonINS_9WilsonArgIsLi3ELi4EL21QudaReconstructType_s18EEEEE	policy,commDim=0011,xpay,dagger,parity=1,topo=1148,order=0123,p2p=7,gdr=1,nvshmem=0,pol=111111111111110000	32	1	1	1	1	1	0	2	1	0	-1	0.000248627	# 2884.74 Gflop/s, 1484.55 GB/s, tuning took 0.047796 seconds at Mon Jul 11 18:27:53 2022
     32x64x16x16	N4quda6WilsonINS_9WilsonArgIsLi3ELi4EL21QudaReconstructType_s18EEEEE	policy_kernel=exterior_all,commDim=0011,xpay,dagger,parity=1	64	1	1	2048	1	1	6420	-1	-1	-1	-1	1.30194e-05	# 2053.75 Gflop/s, 1671.19 GB/s, tuning took 0.040553 seconds at Mon Jul 11 18:27:47 2022
     32x64x16x16	N4quda6WilsonINS_9WilsonArgIsLi3ELi4EL21QudaReconstructType_s18EEEEE	policy_kernel=exterior_all,commDim=0011,xpay,dagger,parity=1,zero_copy,p2p=1	32	1	1	4096	1	1	6420	-1	-1	-1	-1	7.9872e-05	# 334.77 Gflop/s, 272.41 GB/s, tuning took 0.127157 seconds at Mon Jul 11 18:27:48 2022
     32x64x16x16	N4quda6WilsonINS_9WilsonArgIsLi3ELi4EL21QudaReconstructType_s18EEEEE	policy_kernel=exterior_t,commDim=0011,xpay,dagger,parity=1	32	1	1	2048	1	1	9273	-1	-1	-1	-1	8.91298e-06	# 1499.99 Gflop/s, 1220.58 GB/s, tuning took 0.031930 seconds at Mon Jul 11 18:27:47 2022
     32x64x16x16	N4quda6WilsonINS_9WilsonArgIsLi3ELi4EL21QudaReconstructType_s18EEEEE	policy_kernel=exterior_t,commDim=0011,xpay,dagger,parity=1,zero_copy,p2p=1	64	1	1	1024	1	1	83457	-1	-1	-1	-1	7.87692e-05	# 169.73 Gflop/s, 138.11 GB/s, tuning took 0.126492 seconds at Mon Jul 11 18:27:47 2022
     32x64x16x16	N4quda6WilsonINS_9WilsonArgIsLi3ELi4EL21QudaReconstructType_s18EEEEE	policy_kernel=exterior_z,commDim=0011,xpay,dagger,parity=1	32	1	1	2048	1	1	8346	-1	-1	-1	-1	8.78759e-06	# 1521.39 Gflop/s, 1237.99 GB/s, tuning took 0.031278 seconds at Mon Jul 11 18:27:47 2022
     32x64x16x16	N4quda6WilsonINS_9WilsonArgIsLi3ELi4EL21QudaReconstructType_s18EEEEE	policy_kernel=exterior_z,commDim=0011,xpay,dagger,parity=1,zero_copy,p2p=1	32	1	1	2048	1	1	8346	-1	-1	-1	-1	8.77714e-06	# 1523.20 Gflop/s, 1239.47 GB/s, tuning took 0.030897 seconds at Mon Jul 11 18:27:47 2022
     32x64x16x16	N4quda6WilsonINS_9WilsonArgIsLi3ELi4EL21QudaReconstructType_s18EEEEE	policy_kernel=interior,comm=0011,commDim=0011,xpay,dagger,parity=1	128	1	1	4096	1	1	27819	-1	-1	-1	-1	0.000199168	# 3498.45 Gflop/s, 1743.96 GB/s, tuning took 0.350852 seconds at Mon Jul 11 18:27:47 2022
     32x64x16x16	N4quda6WilsonINS_9WilsonArgIsLi3ELi4EL21QudaReconstructType_s18EEEEE	policy_kernel=interior,comm=0011,commDim=0011,xpay,dagger,parity=1,host-device	128	1	1	4096	1	1	27819	3	-1	-1	-1	0.00020439	# 3416.75 Gflop/s, 1745.57 GB/s, tuning took 2.869478 seconds at Mon Jul 11 18:27:50 2022
     32x64x16x16	N4quda6WilsonINS_9WilsonArgIsLi3ELi4EL21QudaReconstructType_s18EEEEE	policy_kernel=interior,comm=0011,commDim=0011,xpay,dagger,parity=1,host-remote	128	1	1	4096	1	1	27819	3	-1	-1	-1	0.000203162	# 3437.42 Gflop/s, 1756.13 GB/s, tuning took 2.853758 seconds at Mon Jul 11 18:27:53 2022
32x64x16x16,16x16x4x4	N4quda14RestrictLaunchIfsLi4ELi3ELi2ELi24EEE	GPU-offline,vol=524288,parity=1,precision=4,order=2,Ns=4,Nc=3,TwistFlavor=1,vol=4096,parity=2,precision=4,order=2,Ns=2,Nc=24,TwistFlavor=1	128	1	6	4096	1	1	0	4	-1	-1	-1	0.000954027	# 1266.17 Gflop/s, 691.89 GB/s, tuning took 12.704220 seconds at Mon Jul 11 18:33:03 2022
   32x64x16x16x2	N4quda15CopyColorSpinorILi4ELi3ENS_11colorspinor11FloatNOrderIdLi4ELi3ELi2ELb0ELb0EEENS1_21SpaceSpinorColorOrderIdLi4ELi3EEESt5tupleIJRNS_16ColorSpinorFieldERKS7_19QudaFieldLocation_sPdPKdEEEE	GPU-offline,vol=1048576,parity=1,precision=8,order=9,Ns=4,Nc=3,TwistFlavor=2vol=1048576,parity=1,precision=8,order=2,Ns=4,Nc=3,TwistFlavor=2,NonRelBasis	544	1	1	1928	1	1	0	-1	-1	-1	-1	0.000303616	# 0.00 Gflop/s, 1326.19 GB/s, tuning took 0.045417 seconds at Mon Jul 11 18:22:57 2022
   32x64x16x16x2	N4quda15CopyColorSpinorILi4ELi3ENS_11colorspinor11FloatNOrderIdLi4ELi3ELi2ELb0ELb0EEES3_St5tupleIJRNS_16ColorSpinorFieldERKS5_19QudaFieldLocation_sPdPKdEEEE	GPU-offline,vol=1048576,parity=1,precision=8,order=2,Ns=4,Nc=3,TwistFlavor=2vol=1048576,parity=1,precision=8,order=2,Ns=4,Nc=3,TwistFlavor=2,PreserveBasis	32	1	1	32768	1	1	0	-1	-1	-1	-1	0.000299264	# 0.00 Gflop/s, 1345.48 GB/s, tuning took 0.044783 seconds at Mon Jul 11 18:22:59 2022
   32x64x16x16x2	N4quda15CopyColorSpinorILi4ELi3ENS_11colorspinor11FloatNOrderIfLi4ELi3ELi4ELb0ELb0EEENS2_IdLi4ELi3ELi2ELb0ELb0EEESt5tupleIJRNS_16ColorSpinorFieldERKS6_19QudaFieldLocation_sPfPKdEEEE	GPU-offline,vol=1048576,parity=1,precision=8,order=2,Ns=4,Nc=3,TwistFlavor=2vol=1048576,parity=1,precision=4,order=4,Ns=4,Nc=3,TwistFlavor=2,PreserveBasis	32	1	1	32768	1	1	0	-1	-1	-1	-1	0.000222618	# 0.00 Gflop/s, 1356.54 GB/s, tuning took 0.035768 seconds at Mon Jul 11 18:22:59 2022
   32x64x16x16x2	N4quda15CopyColorSpinorILi4ELi3ENS_11colorspinor11FloatNOrderIfLi4ELi3ELi4ELb0ELb0EEES3_St5tupleIJRNS_16ColorSpinorFieldERKS5_19QudaFieldLocation_sPfPKfEEEE	GPU-offline,vol=1048576,parity=1,precision=4,order=4,Ns=4,Nc=3,TwistFlavor=2vol=1048576,parity=1,precision=4,order=4,Ns=4,Nc=3,TwistFlavor=2,PreserveBasis	32	1	1	32768	1	1	0	-1	-1	-1	-1	0.00015243	# 0.00 Gflop/s, 1320.78 GB/s, tuning took 0.027786 seconds at Mon Jul 11 18:22:59 2022
   32x64x16x16x2	N4quda15CopyColorSpinorILi4ELi3ENS_11colorspinor11FloatNOrderIsLi4ELi3ELi8ELb0ELb0EEENS2_IdLi4ELi3ELi2ELb0ELb0EEESt5tupleIJRNS_16ColorSpinorFieldERKS6_19QudaFieldLocation_sPsPKdEEEE	GPU-offline,vol=1048576,parity=1,precision=8,order=2,Ns=4,Nc=3,TwistFlavor=2vol=1048576,parity=1,precision=2,order=8,Ns=4,Nc=3,TwistFlavor=2,PreserveBasis	160	1	1	6554	1	1	0	-1	-1	-1	-1	0.000187563	# 0.00 Gflop/s, 1364.09 GB/s, tuning took 0.032280 seconds at Mon Jul 11 18:24:24 2022
   32x64x16x16x2	N4quda15CopyColorSpinorILi4ELi3ENS_11colorspinor11FloatNOrderIsLi4ELi3ELi8ELb0ELb0EEENS2_IfLi4ELi3ELi4ELb0ELb0EEESt5tupleIJRNS_16ColorSpinorFieldERKS6_19QudaFieldLocation_sPsPKfEEEE	GPU-offline,vol=1048576,parity=1,precision=4,order=4,Ns=4,Nc=3,TwistFlavor=2vol=1048576,parity=1,precision=2,order=8,Ns=4,Nc=3,TwistFlavor=2,PreserveBasis	288	1	1	3641	1	1	0	-1	-1	-1	-1	0.00011685	# 0.00 Gflop/s, 1328.11 GB/s, tuning took 0.023703 seconds at Mon Jul 11 18:24:24 2022
   32x64x16x16x2	N4quda15CopyColorSpinorILi4ELi3ENS_11colorspinor11FloatNOrderIsLi4ELi3ELi8ELb0ELb0EEES3_St5tupleIJRNS_16ColorSpinorFieldERKS5_19QudaFieldLocation_sPsPKsEEEE	GPU-offline,vol=1048576,parity=1,precision=2,order=8,Ns=4,Nc=3,TwistFlavor=2vol=1048576,parity=1,precision=2,order=8,Ns=4,Nc=3,TwistFlavor=2,PreserveBasis	352	1	1	2979	1	1	0	-1	-1	-1	-1	8.4992e-05	# 0.00 Gflop/s, 1283.08 GB/s, tuning took 0.020001 seconds at Mon Jul 11 18:24:56 2022
   32x64x16x16x2	N4quda15CopyColorSpinorILi4ELi3ENS_11colorspinor21SpaceSpinorColorOrderIdLi4ELi3EEENS1_11FloatNOrderIdLi4ELi3ELi2ELb0ELb0EEESt5tupleIJRNS_16ColorSpinorFieldERKS7_19QudaFieldLocation_sPdPKdEEEE	GPU-offline,vol=1048576,parity=1,precision=8,order=2,Ns=4,Nc=3,TwistFlavor=2vol=1048576,parity=1,precision=8,order=9,Ns=4,Nc=3,TwistFlavor=2,RelBasis	128	1	1	8192	1	1	0	-1	-1	-1	-1	0.000295424	# 0.00 Gflop/s, 1362.97 GB/s, tuning took 0.037722 seconds at Mon Jul 11 18:24:56 2022
   32x64x16x16x2	N4quda17NdegTwistedCloverINS_20NdegTwistedCloverArgIdLi3ELi4EL21QudaReconstructType_s18EEEEE	policy,commDim=0011,xpay,dagger,parity=1,topo=1148,order=0123,p2p=7,gdr=1,nvshmem=0,pol=111111111111110000	32	1	1	1	1	1	0	5	1	0	-1	0.00152405	# 1354.02 Gflop/s, 2245.69 GB/s, tuning took 0.241722 seconds at Mon Jul 11 18:23:58 2022
   32x64x16x16x2	N4quda17NdegTwistedCloverINS_20NdegTwistedCloverArgIdLi3ELi4EL21QudaReconstructType_s18EEEEE	policy,commDim=0011,xpay,parity=1,topo=1148,order=0123,p2p=7,gdr=1,nvshmem=0,pol=111111111111110000	32	1	1	1	1	1	0	3	1	0	-1	0.00151825	# 1359.19 Gflop/s, 2254.27 GB/s, tuning took 0.237879 seconds at Mon Jul 11 18:24:20 2022
   32x64x16x16x2	N4quda17NdegTwistedCloverINS_20NdegTwistedCloverArgIdLi3ELi4EL21QudaReconstructType_s18EEEEE	policy_kernel=exterior_all,commDim=0011,xpay,dagger,parity=1	32	2	1	4096	1	1	12840	-1	-1	-1	-1	0.000112754	# 474.28 Gflop/s, 1450.75 GB/s, tuning took 0.042480 seconds at Mon Jul 11 18:23:53 2022
   32x64x16x16x2	N4quda17NdegTwistedCloverINS_20NdegTwistedCloverArgIdLi3ELi4EL21QudaReconstructType_s18EEEEE	policy_kernel=exterior_all,commDim=0011,xpay,dagger,parity=1,zero_copy,p2p=1	16	2	1	8192	1	1	12840	-1	-1	-1	-1	0.000530432	# 100.82 Gflop/s, 308.39 GB/s, tuning took 0.157980 seconds at Mon Jul 11 18:23:53 2022
   32x64x16x16x2	N4quda17NdegTwistedCloverINS_20NdegTwistedCloverArgIdLi3ELi4EL21QudaReconstructType_s18EEEEE	policy_kernel=exterior_all,commDim=0011,xpay,parity=1	32	2	1	4096	1	1	13910	-1	-1	-1	-1	0.000112412	# 475.72 Gflop/s, 1455.16 GB/s, tuning took 0.042536 seconds at Mon Jul 11 18:24:14 2022
   32x64x16x16x2	N4quda17NdegTwistedCloverINS_20NdegTwistedCloverArgIdLi3ELi4EL21QudaReconstructType_s18EEEEE	policy_kernel=exterior_all,commDim=0011,xpay,parity=1,zero_copy,p2p=1	16	2	1	8192	1	1	11128	-1	-1	-1	-1	0.000530091	# 100.88 Gflop/s, 308.58 GB/s, tuning took 0.157969 seconds at Mon Jul 11 18:24:15 2022
   32x64x16x16x2	N4quda17NdegTwistedCloverINS_20NdegTwistedCloverArgIdLi3ELi4EL21QudaReconstructType_s18EEEEE	policy_kernel=exterior_t,commDim=0011,xpay,dagger,parity=1	32	2	1	2048	1	1	16692	-1	-1	-1	-1	5.60924e-05	# 476.69 Gflop/s, 1458.11 GB/s, tuning took 0.027557 seconds at Mon Jul 11 18:23:52 2022
   32x64x16x16x2	N4quda17NdegTwistedCloverINS_20NdegTwistedCloverArgIdLi3ELi4EL21QudaReconstructType_s18EEEEE	policy_kernel=exterior_t,commDim=0011,xpay,dagger,parity=1,zero_copy,p2p=1	16	2	1	4096	1	1	83457	-1	-1	-1	-1	0.000489131	# 54.67 Gflop/s, 167.21 GB/s, tuning took 0.144913 seconds at Mon Jul 11 18:23:53 2022
   32x64x16x16x2	N4quda17NdegTwistedCloverINS_20NdegTwistedCloverArgIdLi3ELi4EL21QudaReconstructType_s18EEEEE	policy_kernel=exterior_t,commDim=0011,xpay,parity=1	32	2	1	2048	1	1	16692	-1	-1	-1	-1	5.64907e-05	# 473.33 Gflop/s, 1447.83 GB/s, tuning took 0.027734 seconds at Mon Jul 11 18:24:14 2022
   32x64x16x16x2	N4quda17NdegTwistedCloverINS_20NdegTwistedCloverArgIdLi3ELi4EL21QudaReconstructType_s18EEEEE	policy_kernel=exterior_t,commDim=0011,xpay,parity=1,zero_copy,p2p=1	16	2	1	4096	1	1	83457	-1	-1	-1	-1	0.000489131	# 54.67 Gflop/s, 167.21 GB/s, tuning took 0.144928 seconds at Mon Jul 11 18:24:14 2022
   32x64x16x16x2	N4quda17NdegTwistedCloverINS_20NdegTwistedCloverArgIdLi3ELi4EL21QudaReconstructType_s18EEEEE	policy_kernel=exterior_z,commDim=0011,xpay,dagger,parity=1	64	2	1	1024	1	1	33383	-1	-1	-1	-1	5.76853e-05	# 463.53 Gflop/s, 1417.85 GB/s, tuning took 0.027901 seconds at Mon Jul 11 18:23:53 2022
   32x64x16x16x2	N4quda17NdegTwistedCloverINS_20NdegTwistedCloverArgIdLi3ELi4EL21QudaReconstructType_s18EEEEE	policy_kernel=exterior_z,commDim=0011,xpay,dagger,parity=1,zero_copy,p2p=1	64	2	1	1024	1	1	33383	-1	-1	-1	-1	5.79698e-05	# 461.25 Gflop/s, 1410.89 GB/s, tuning took 0.027873 seconds at Mon Jul 11 18:23:53 2022
   32x64x16x16x2	N4quda17NdegTwistedCloverINS_20NdegTwistedCloverArgIdLi3ELi4EL21QudaReconstructType_s18EEEEE	policy_kernel=exterior_z,commDim=0011,xpay,parity=1	32	2	1	2048	1	1	15174	-1	-1	-1	-1	5.82542e-05	# 459.00 Gflop/s, 1404.00 GB/s, tuning took 0.027941 seconds at Mon Jul 11 18:24:14 2022
   32x64x16x16x2	N4quda17NdegTwistedCloverINS_20NdegTwistedCloverArgIdLi3ELi4EL21QudaReconstructType_s18EEEEE	policy_kernel=exterior_z,commDim=0011,xpay,parity=1,zero_copy,p2p=1	32	2	1	2048	1	1	12288	-1	-1	-1	-1	5.82542e-05	# 459.00 Gflop/s, 1404.00 GB/s, tuning took 0.027966 seconds at Mon Jul 11 18:24:15 2022
   32x64x16x16x2	N4quda17NdegTwistedCloverINS_20NdegTwistedCloverArgIdLi3ELi4EL21QudaReconstructType_s18EEEEE	policy_kernel=interior,comm=0011,commDim=0011,xpay,dagger,parity=1	32	2	1	16384	1	1	33383	-1	-1	-1	-1	0.00132676	# 1524.54 Gflop/s, 2456.34 GB/s, tuning took 0.371235 seconds at Mon Jul 11 18:23:52 2022
   32x64x16x16x2	N4quda17NdegTwistedCloverINS_20NdegTwistedCloverArgIdLi3ELi4EL21QudaReconstructType_s18EEEEE	policy_kernel=interior,comm=0011,commDim=0011,xpay,dagger,parity=1,host-device	32	2	1	16384	1	1	13910	2	-1	-1	-1	0.0013626	# 1486.75 Gflop/s, 2447.13 GB/s, tuning took 2.239602 seconds at Mon Jul 11 18:23:55 2022
   32x64x16x16x2	N4quda17NdegTwistedCloverINS_20NdegTwistedCloverArgIdLi3ELi4EL21QudaReconstructType_s18EEEEE	policy_kernel=interior,comm=0011,commDim=0011,xpay,dagger,parity=1,host-remote	32	2	1	16384	1	1	12288	2	-1	-1	-1	0.00135373	# 1496.50 Gflop/s, 2463.18 GB/s, tuning took 2.228236 seconds at Mon Jul 11 18:23:58 2022
   32x64x16x16x2	N4quda17NdegTwistedCloverINS_20NdegTwistedCloverArgIdLi3ELi4EL21QudaReconstructType_s18EEEEE	policy_kernel=interior,comm=0011,commDim=0011,xpay,parity=1	32	2	1	16384	1	1	23845	-1	-1	-1	-1	0.00132301	# 1528.87 Gflop/s, 2463.31 GB/s, tuning took 0.370498 seconds at Mon Jul 11 18:24:14 2022
   32x64x16x16x2	N4quda17NdegTwistedCloverINS_20NdegTwistedCloverArgIdLi3ELi4EL21QudaReconstructType_s18EEEEE	policy_kernel=interior,comm=0011,commDim=0011,xpay,parity=1,host-device	32	2	1	16384	1	1	20865	2	-1	-1	-1	0.00135953	# 1490.11 Gflop/s, 2452.66 GB/s, tuning took 2.237531 seconds at Mon Jul 11 18:24:17 2022
   32x64x16x16x2	N4quda17NdegTwistedCloverINS_20NdegTwistedCloverArgIdLi3ELi4EL21QudaReconstructType_s18EEEEE	policy_kernel=interior,comm=0011,commDim=0011,xpay,parity=1,host-remote	32	2	1	16384	1	1	20865	2	-1	-1	-1	0.001351	# 1499.52 Gflop/s, 2468.16 GB/s, tuning took 2.231967 seconds at Mon Jul 11 18:24:19 2022
   32x64x16x16x2	N4quda17NdegTwistedCloverINS_20NdegTwistedCloverArgIfLi3ELi4EL21QudaReconstructType_s18EEEEE	policy,commDim=0011,xpay,dagger,parity=1,topo=1148,order=0123,p2p=7,gdr=1,nvshmem=0,pol=111111111111110000	32	1	1	1	1	1	0	2	1	0	-1	0.000749909	# 2751.80 Gflop/s, 2281.98 GB/s, tuning took 0.123057 seconds at Mon Jul 11 18:23:16 2022
   32x64x16x16x2	N4quda17NdegTwistedCloverINS_20NdegTwistedCloverArgIfLi3ELi4EL21QudaReconstructType_s18EEEEE	policy,commDim=0011,xpay,parity=1,topo=1148,order=0123,p2p=7,gdr=1,nvshmem=0,pol=111111111111110000	32	1	1	1	1	1	0	3	1	0	-1	0.000753323	# 2739.33 Gflop/s, 2271.64 GB/s, tuning took 0.124871 seconds at Mon Jul 11 18:23:33 2022
   32x64x16x16x2	N4quda17NdegTwistedCloverINS_20NdegTwistedCloverArgIfLi3ELi4EL21QudaReconstructType_s18EEEEE	policy_kernel=exterior_all,commDim=0011,xpay,dagger,parity=1	96	2	1	1366	1	1	18432	-1	-1	-1	-1	5.25474e-05	# 1017.70 Gflop/s, 1556.48 GB/s, tuning took 0.044633 seconds at Mon Jul 11 18:23:10 2022
   32x64x16x16x2	N4quda17NdegTwistedCloverINS_20NdegTwistedCloverArgIfLi3ELi4EL21QudaReconstructType_s18EEEEE	policy_kernel=exterior_all,commDim=0011,xpay,dagger,parity=1,zero_copy,p2p=1	64	2	1	2048	1	1	13910	-1	-1	-1	-1	0.00026112	# 204.80 Gflop/s, 313.22 GB/s, tuning took 0.158921 seconds at Mon Jul 11 18:23:11 2022
   32x64x16x16x2	N4quda17NdegTwistedCloverINS_20NdegTwistedCloverArgIfLi3ELi4EL21QudaReconstructType_s18EEEEE	policy_kernel=exterior_all,commDim=0011,xpay,parity=1	64	2	1	2048	1	1	12288	-1	-1	-1	-1	5.38947e-05	# 992.26 Gflop/s, 1517.57 GB/s, tuning took 0.045290 seconds at Mon Jul 11 18:23:27 2022
   32x64x16x16x2	N4quda17NdegTwistedCloverINS_20NdegTwistedCloverArgIfLi3ELi4EL21QudaReconstructType_s18EEEEE	policy_kernel=exterior_all,commDim=0011,xpay,parity=1,zero_copy,p2p=1	64	2	1	2048	1	1	13910	-1	-1	-1	-1	0.000261888	# 204.20 Gflop/s, 312.30 GB/s, tuning took 0.159283 seconds at Mon Jul 11 18:23:28 2022
   32x64x16x16x2	N4quda17NdegTwistedCloverINS_20NdegTwistedCloverArgIfLi3ELi4EL21QudaReconstructType_s18EEEEE	policy_kernel=exterior_t,commDim=0011,xpay,dagger,parity=1	96	2	1	683	1	1	20865	-1	-1	-1	-1	1.53088e-05	# 1746.62 Gflop/s, 2671.30 GB/s, tuning took 0.022904 seconds at Mon Jul 11 18:23:10 2022
   32x64x16x16x2	N4quda17NdegTwistedCloverINS_20NdegTwistedCloverArgIfLi3ELi4EL21QudaReconstructType_s18EEEEE	policy_kernel=exterior_t,commDim=0011,xpay,dagger,parity=1,zero_copy,p2p=1	32	2	1	2048	1	1	83457	-1	-1	-1	-1	0.000248422	# 107.63 Gflop/s, 164.62 GB/s, tuning took 0.155379 seconds at Mon Jul 11 18:23:11 2022
   32x64x16x16x2	N4quda17NdegTwistedCloverINS_20NdegTwistedCloverArgIfLi3ELi4EL21QudaReconstructType_s18EEEEE	policy_kernel=exterior_t,commDim=0011,xpay,parity=1	112	2	1	586	1	1	27819	-1	-1	-1	-1	1.52939e-05	# 1748.32 Gflop/s, 2673.90 GB/s, tuning took 0.023267 seconds at Mon Jul 11 18:23:27 2022
   32x64x16x16x2	N4quda17NdegTwistedCloverINS_20NdegTwistedCloverArgIfLi3ELi4EL21QudaReconstructType_s18EEEEE	policy_kernel=exterior_t,commDim=0011,xpay,parity=1,zero_copy,p2p=1	32	2	1	2048	1	1	83457	-1	-1	-1	-1	0.000248422	# 107.63 Gflop/s, 164.62 GB/s, tuning took 0.155492 seconds at Mon Jul 11 18:23:27 2022
   32x64x16x16x2	N4quda17NdegTwistedCloverINS_20NdegTwistedCloverArgIfLi3ELi4EL21QudaReconstructType_s18EEEEE	policy_kernel=exterior_z,commDim=0011,xpay,dagger,parity=1	96	2	1	683	1	1	33383	-1	-1	-1	-1	1.41033e-05	# 1895.92 Gflop/s, 2899.64 GB/s, tuning took 0.022110 seconds at Mon Jul 11 18:23:10 2022
   32x64x16x16x2	N4quda17NdegTwistedCloverINS_20NdegTwistedCloverArgIfLi3ELi4EL21QudaReconstructType_s18EEEEE	policy_kernel=exterior_z,commDim=0011,xpay,dagger,parity=1,zero_copy,p2p=1	96	2	1	683	1	1	33383	-1	-1	-1	-1	1.41653e-05	# 1887.61 Gflop/s, 2886.94 GB/s, tuning took 0.022097 seconds at Mon Jul 11 18:23:11 2022
   32x64x16x16x2	N4quda17NdegTwistedCloverINS_20NdegTwistedCloverArgIfLi3ELi4EL21QudaReconstructType_s18EEEEE	policy_kernel=exterior_z,commDim=0011,xpay,parity=1	96	2	1	683	1	1	33383	-1	-1	-1	-1	1.4464e-05	# 1848.64 Gflop/s, 2827.33 GB/s, tuning took 0.022386 seconds at Mon Jul 11 18:23:27 2022
   32x64x16x16x2	N4quda17NdegTwistedCloverINS_20NdegTwistedCloverArgIfLi3ELi4EL21QudaReconstructType_s18EEEEE	policy_kernel=exterior_z,commDim=0011,xpay,parity=1,zero_copy,p2p=1	96	2	1	683	1	1	18546	-1	-1	-1	-1	1.4624e-05	# 1828.41 Gflop/s, 2796.39 GB/s, tuning took 0.022298 seconds at Mon Jul 11 18:23:27 2022
   32x64x16x16x2	N4quda17NdegTwistedCloverINS_20NdegTwistedCloverArgIfLi3ELi4EL21QudaReconstructType_s18EEEEE	policy_kernel=interior,comm=0011,commDim=0011,xpay,dagger,parity=1	128	2	1	4096	1	1	33383	-1	-1	-1	-1	0.000641707	# 3152.07 Gflop/s, 2539.30 GB/s, tuning took 0.357844 seconds at Mon Jul 11 18:23:10 2022
   32x64x16x16x2	N4quda17NdegTwistedCloverINS_20NdegTwistedCloverArgIfLi3ELi4EL21QudaReconstructType_s18EEEEE	policy_kernel=interior,comm=0011,commDim=0011,xpay,dagger,parity=1,host-device	128	2	1	4096	1	1	27819	1	-1	-1	-1	0.000656725	# 3084.77 Gflop/s, 2538.71 GB/s, tuning took 2.497292 seconds at Mon Jul 11 18:23:13 2022
   32x64x16x16x2	N4quda17NdegTwistedCloverINS_20NdegTwistedCloverArgIfLi3ELi4EL21QudaReconstructType_s18EEEEE	policy_kernel=interior,comm=0011,commDim=0011,xpay,dagger,parity=1,host-remote	128	2	1	4096	1	1	33383	1	-1	-1	-1	0.000653312	# 3100.89 Gflop/s, 2551.98 GB/s, tuning took 2.490771 seconds at Mon Jul 11 18:23:16 2022
   32x64x16x16x2	N4quda17NdegTwistedCloverINS_20NdegTwistedCloverArgIfLi3ELi4EL21QudaReconstructType_s18EEEEE	policy_kernel=interior,comm=0011,commDim=0011,xpay,parity=1	128	2	1	4096	1	1	33383	-1	-1	-1	-1	0.000646485	# 3128.77 Gflop/s, 2520.53 GB/s, tuning took 0.359249 seconds at Mon Jul 11 18:23:27 2022
   32x64x16x16x2	N4quda17NdegTwistedCloverINS_20NdegTwistedCloverArgIfLi3ELi4EL21QudaReconstructType_s18EEEEE	policy_kernel=interior,comm=0011,commDim=0011,xpay,parity=1,host-device	128	2	1	4096	1	1	24576	1	-1	-1	-1	0.000662187	# 3059.33 Gflop/s, 2517.77 GB/s, tuning took 2.502290 seconds at Mon Jul 11 18:23:30 2022
   32x64x16x16x2	N4quda17NdegTwistedCloverINS_20NdegTwistedCloverArgIfLi3ELi4EL21QudaReconstructType_s18EEEEE	policy_kernel=interior,comm=0011,commDim=0011,xpay,parity=1,host-remote	128	2	1	4096	1	1	55638	1	-1	-1	-1	0.000658432	# 3076.78 Gflop/s, 2532.13 GB/s, tuning took 2.496107 seconds at Mon Jul 11 18:23:33 2022
   32x64x16x16x2	N4quda17NdegTwistedCloverINS_20NdegTwistedCloverArgIsLi3ELi4EL21QudaReconstructType_s18EEEEE	policy,commDim=0011,xpay,dagger,parity=1,topo=1148,order=0123,p2p=7,gdr=1,nvshmem=0,pol=111111111111110000	32	1	1	1	1	1	0	3	1	0	-1	0.00042496	# 4855.98 Gflop/s, 2112.15 GB/s, tuning took 0.071254 seconds at Mon Jul 11 18:24:38 2022
   32x64x16x16x2	N4quda17NdegTwistedCloverINS_20NdegTwistedCloverArgIsLi3ELi4EL21QudaReconstructType_s18EEEEE	policy,commDim=0011,xpay,parity=1,topo=1148,order=0123,p2p=7,gdr=1,nvshmem=0,pol=111111111111110000	32	1	1	1	1	1	0	3	1	0	-1	0.000422912	# 4879.50 Gflop/s, 2122.38 GB/s, tuning took 0.070005 seconds at Mon Jul 11 18:24:51 2022
   32x64x16x16x2	N4quda17NdegTwistedCloverINS_20NdegTwistedCloverArgIsLi3ELi4EL21QudaReconstructType_s18EEEEE	policy_kernel=exterior_all,commDim=0011,xpay,dagger,parity=1	64	2	1	2048	1	1	15174	-1	-1	-1	-1	1.87131e-05	# 2857.75 Gflop/s, 2325.43 GB/s, tuning took 0.028327 seconds at Mon Jul 11 18:24:34 2022
   32x64x16x16x2	N4quda17NdegTwistedCloverINS_20NdegTwistedCloverArgIsLi3ELi4EL21QudaReconstructType_s18EEEEE	policy_kernel=exterior_all,commDim=0011,xpay,dagger,parity=1,zero_copy,p2p=1	32	2	1	4096	1	1	13910	-1	-1	-1	-1	0.000155209	# 344.55 Gflop/s, 280.37 GB/s, tuning took 0.101788 seconds at Mon Jul 11 18:24:34 2022
   32x64x16x16x2	N4quda17NdegTwistedCloverINS_20NdegTwistedCloverArgIsLi3ELi4EL21QudaReconstructType_s18EEEEE	policy_kernel=exterior_all,commDim=0011,xpay,parity=1	64	2	1	2048	1	1	16692	-1	-1	-1	-1	1.9038e-05	# 2808.97 Gflop/s, 2285.73 GB/s, tuning took 0.028338 seconds at Mon Jul 11 18:24:47 2022
   32x64x16x16x2	N4quda17NdegTwistedCloverINS_20NdegTwistedCloverArgIsLi3ELi4EL21QudaReconstructType_s18EEEEE	policy_kernel=exterior_all,commDim=0011,xpay,parity=1,zero_copy,p2p=1	64	2	1	2048	1	1	27819	-1	-1	-1	-1	0.000155355	# 344.23 Gflop/s, 280.11 GB/s, tuning took 0.101844 seconds at Mon Jul 11 18:24:47 2022
   32x64x16x16x2	N4quda17NdegTwistedCloverINS_20NdegTwistedCloverArgIsLi3ELi4EL21QudaReconstructType_s18EEEEE	policy_kernel=exterior_t,commDim=0011,xpay,dagger,parity=1	32	2	1	2048	1	1	8346	-1	-1	-1	-1	1.11017e-05	# 2408.53 Gflop/s, 1959.88 GB/s, tuning took 0.020549 seconds at Mon Jul 11 18:24:34 2022
   32x64x16x16x2	N4quda17NdegTwistedCloverINS_20NdegTwistedCloverArgIsLi3ELi4EL21QudaReconstructType_s18EEEEE	policy_kernel=exterior_t,commDim=0011,xpay,dagger,parity=1,zero_copy,p2p=1	32	2	1	2048	1	1	83457	-1	-1	-1	-1	0.000148626	# 179.91 Gflop/s, 146.39 GB/s, tuning took 0.098396 seconds at Mon Jul 11 18:24:34 2022
   32x64x16x16x2	N4quda17NdegTwistedCloverINS_20NdegTwistedCloverArgIsLi3ELi4EL21QudaReconstructType_s18EEEEE	policy_kernel=exterior_t,commDim=0011,xpay,parity=1	16	2	1	4096	1	1	3072	-1	-1	-1	-1	1.10018e-05	# 2430.40 Gflop/s, 1977.68 GB/s, tuning took 0.020576 seconds at Mon Jul 11 18:24:47 2022
   32x64x16x16x2	N4quda17NdegTwistedCloverINS_20NdegTwistedCloverArgIsLi3ELi4EL21QudaReconstructType_s18EEEEE	policy_kernel=exterior_t,commDim=0011,xpay,parity=1,zero_copy,p2p=1	32	2	1	2048	1	1	83457	-1	-1	-1	-1	0.000148773	# 179.73 Gflop/s, 146.25 GB/s, tuning took 0.098374 seconds at Mon Jul 11 18:24:47 2022
   32x64x16x16x2	N4quda17NdegTwistedCloverINS_20NdegTwistedCloverArgIsLi3ELi4EL21QudaReconstructType_s18EEEEE	policy_kernel=exterior_z,commDim=0011,xpay,dagger,parity=1	16	2	1	4096	1	1	5217	-1	-1	-1	-1	1.09019e-05	# 2452.67 Gflop/s, 1995.80 GB/s, tuning took 0.020195 seconds at Mon Jul 11 18:24:34 2022
   32x64x16x16x2	N4quda17NdegTwistedCloverINS_20NdegTwistedCloverArgIsLi3ELi4EL21QudaReconstructType_s18EEEEE	policy_kernel=exterior_z,commDim=0011,xpay,dagger,parity=1,zero_copy,p2p=1	16	2	1	4096	1	1	5217	-1	-1	-1	-1	1.08894e-05	# 2455.49 Gflop/s, 1998.09 GB/s, tuning took 0.020144 seconds at Mon Jul 11 18:24:34 2022
   32x64x16x16x2	N4quda17NdegTwistedCloverINS_20NdegTwistedCloverArgIsLi3ELi4EL21QudaReconstructType_s18EEEEE	policy_kernel=exterior_z,commDim=0011,xpay,parity=1	16	2	1	4096	1	1	5217	-1	-1	-1	-1	1.09019e-05	# 2452.67 Gflop/s, 1995.80 GB/s, tuning took 0.020230 seconds at Mon Jul 11 18:24:47 2022
   32x64x16x16x2	N4quda17NdegTwistedCloverINS_20NdegTwistedCloverArgIsLi3ELi4EL21QudaReconstructType_s18EEEEE	policy_kernel=exterior_z,commDim=0011,xpay,parity=1,zero_copy,p2p=1	16	2	1	4096	1	1	5217	-1	-1	-1	-1	1.08894e-05	# 2455.49 Gflop/s, 1998.09 GB/s, tuning took 0.020080 seconds at Mon Jul 11 18:24:47 2022
   32x64x16x16x2	N4quda17NdegTwistedCloverINS_20NdegTwistedCloverArgIsLi3ELi4EL21QudaReconstructType_s18EEEEE	policy_kernel=interior,comm=0011,commDim=0011,xpay,dagger,parity=1	64	2	1	8192	1	1	20865	-1	-1	-1	-1	0.000364203	# 5553.78 Gflop/s, 2345.03 GB/s, tuning took 0.251742 seconds at Mon Jul 11 18:24:34 2022
   32x64x16x16x2	N4quda17NdegTwistedCloverINS_20NdegTwistedCloverArgIsLi3ELi4EL21QudaReconstructType_s18EEEEE	policy_kernel=interior,comm=0011,commDim=0011,xpay,dagger,parity=1,host-device	64	2	1	8192	1	1	13910	3	-1	-1	-1	0.00037376	# 5420.19 Gflop/s, 2335.56 GB/s, tuning took 1.925485 seconds at Mon Jul 11 18:24:36 2022
   32x64x16x16x2	N4quda17NdegTwistedCloverINS_20NdegTwistedCloverArgIsLi3ELi4EL21QudaReconstructType_s18EEEEE	policy_kernel=interior,comm=0011,commDim=0011,xpay,dagger,parity=1,host-remote	64	2	1	8192	1	1	18546	3	-1	-1	-1	0.000372395	# 5440.06 Gflop/s, 2344.12 GB/s, tuning took 1.923649 seconds at Mon Jul 11 18:24:38 2022
   32x64x16x16x2	N4quda17NdegTwistedCloverINS_20NdegTwistedCloverArgIsLi3ELi4EL21QudaReconstructType_s18EEEEE	policy_kernel=interior,comm=0011,commDim=0011,xpay,parity=1	64	2	1	8192	1	1	13910	-1	-1	-1	-1	0.000358741	# 5638.33 Gflop/s, 2380.73 GB/s, tuning took 0.249486 seconds at Mon Jul 11 18:24:47 2022
   32x64x16x16x2	N4quda17NdegTwistedCloverINS_20NdegTwistedCloverArgIsLi3ELi4EL21QudaReconstructType_s18EEEEE	policy_kernel=interior,comm=0011,commDim=0011,xpay,parity=1,host-device	64	2	1	8192	1	1	20865	3	-1	-1	-1	0.000368981	# 5490.38 Gflop/s, 2365.81 GB/s, tuning took 1.913378 seconds at Mon Jul 11 18:24:49 2022
   32x64x16x16x2	N4quda17NdegTwistedCloverINS_20NdegTwistedCloverArgIsLi3ELi4EL21QudaReconstructType_s18EEEEE	policy_kernel=interior,comm=0011,commDim=0011,xpay,parity=1,host-remote	64	2	1	8192	1	1	27819	3	-1	-1	-1	0.000367616	# 5510.77 Gflop/s, 2374.60 GB/s, tuning took 1.909581 seconds at Mon Jul 11 18:24:51 2022
   32x64x16x16x2	N4quda31NdegTwistedCloverPreconditionedINS_34NdegTwistedCloverPreconditionedArgIdLi3ELi4EL21QudaReconstructType_s18EEEEE	policy,commDim=0011,dagger,parity=1,topo=1148,order=0123,p2p=7,gdr=1,nvshmem=0,pol=111111111111110000	32	1	1	1	1	1	0	3	1	0	-1	0.00139298	# 1445.29 Gflop/s, 2457.00 GB/s, tuning took 0.235626 seconds at Mon Jul 11 18:23:52 2022
   32x64x16x16x2	N4quda31NdegTwistedCloverPreconditionedINS_34NdegTwistedCloverPreconditionedArgIdLi3ELi4EL21QudaReconstructType_s18EEEEE	policy,commDim=0011,parity=1,topo=1148,order=0123,p2p=7,gdr=1,nvshmem=0,pol=111111111111110000	32	1	1	1	1	1	0	4	1	0	-1	0.00140698	# 1430.92 Gflop/s, 2432.56 GB/s, tuning took 0.230885 seconds at Mon Jul 11 18:24:14 2022
   32x64x16x16x2	N4quda31NdegTwistedCloverPreconditionedINS_34NdegTwistedCloverPreconditionedArgIdLi3ELi4EL21QudaReconstructType_s18EEEEE	policy_kernel=exterior_all,commDim=0011,dagger,parity=1	32	2	1	4096	1	1	6144	-1	-1	-1	-1	0.000171691	# 274.83 Gflop/s, 952.75 GB/s, tuning took 0.088927 seconds at Mon Jul 11 18:23:40 2022
   32x64x16x16x2	N4quda31NdegTwistedCloverPreconditionedINS_34NdegTwistedCloverPreconditionedArgIdLi3ELi4EL21QudaReconstructType_s18EEEEE	policy_kernel=exterior_all,commDim=0011,dagger,parity=1,zero_copy,p2p=1	16	2	1	8192	1	1	20865	-1	-1	-1	-1	0.000574123	# 82.19 Gflop/s, 284.92 GB/s, tuning took 0.241409 seconds at Mon Jul 11 18:23:41 2022
   32x64x16x16x2	N4quda31NdegTwistedCloverPreconditionedINS_34NdegTwistedCloverPreconditionedArgIdLi3ELi4EL21QudaReconstructType_s18EEEEE	policy_kernel=exterior_all,commDim=0011,parity=1	32	2	1	4096	1	1	8785	-1	-1	-1	-1	0.000169643	# 278.15 Gflop/s, 964.25 GB/s, tuning took 0.088550 seconds at Mon Jul 11 18:24:01 2022
   32x64x16x16x2	N4quda31NdegTwistedCloverPreconditionedINS_34NdegTwistedCloverPreconditionedArgIdLi3ELi4EL21QudaReconstructType_s18EEEEE	policy_kernel=exterior_all,commDim=0011,parity=1,zero_copy,p2p=1	32	2	1	4096	1	1	7258	-1	-1	-1	-1	0.000574464	# 82.14 Gflop/s, 284.75 GB/s, tuning took 0.241505 seconds at Mon Jul 11 18:24:03 2022
   32x64x16x16x2	N4quda31NdegTwistedCloverPreconditionedINS_34NdegTwistedCloverPreconditionedArgIdLi3ELi4EL21QudaReconstructType_s18EEEEE	policy_kernel=exterior_t,commDim=0011,dagger,parity=1	16	2	1	4096	1	1	5564	-1	-1	-1	-1	9.0112e-05	# 261.82 Gflop/s, 907.64 GB/s, tuning took 0.052226 seconds at Mon Jul 11 18:23:39 2022
   32x64x16x16x2	N4quda31NdegTwistedCloverPreconditionedINS_34NdegTwistedCloverPreconditionedArgIdLi3ELi4EL21QudaReconstructType_s18EEEEE	policy_kernel=exterior_t,commDim=0011,dagger,parity=1,zero_copy,p2p=1	16	2	1	4096	1	1	55638	-1	-1	-1	-1	0.000489813	# 48.17 Gflop/s, 166.98 GB/s, tuning took 0.205354 seconds at Mon Jul 11 18:23:41 2022
   32x64x16x16x2	N4quda31NdegTwistedCloverPreconditionedINS_34NdegTwistedCloverPreconditionedArgIdLi3ELi4EL21QudaReconstructType_s18EEEEE	policy_kernel=exterior_t,commDim=0011,parity=1	16	2	1	4096	1	1	7587	-1	-1	-1	-1	8.96853e-05	# 263.06 Gflop/s, 911.95 GB/s, tuning took 0.052170 seconds at Mon Jul 11 18:24:01 2022
   32x64x16x16x2	N4quda31NdegTwistedCloverPreconditionedINS_34NdegTwistedCloverPreconditionedArgIdLi3ELi4EL21QudaReconstructType_s18EEEEE	policy_kernel=exterior_t,commDim=0011,parity=1,zero_copy,p2p=1	16	2	1	4096	1	1	83457	-1	-1	-1	-1	0.000489813	# 48.17 Gflop/s, 166.98 GB/s, tuning took 0.205345 seconds at Mon Jul 11 18:24:02 2022
   32x64x16x16x2	N4quda31NdegTwistedCloverPreconditionedINS_34NdegTwistedCloverPreconditionedArgIdLi3ELi4EL21QudaReconstructType_s18EEEEE	policy_kernel=exterior_z,commDim=0011,dagger,parity=1	32	2	1	2048	1	1	9819	-1	-1	-1	-1	9.50458e-05	# 248.23 Gflop/s, 860.52 GB/s, tuning took 0.054748 seconds at Mon Jul 11 18:23:40 2022
   32x64x16x16x2	N4quda31NdegTwistedCloverPreconditionedINS_34NdegTwistedCloverPreconditionedArgIdLi3ELi4EL21QudaReconstructType_s18EEEEE	policy_kernel=exterior_z,commDim=0011,dagger,parity=1,zero_copy,p2p=1	32	2	1	2048	1	1	9273	-1	-1	-1	-1	9.49527e-05	# 248.47 Gflop/s, 861.36 GB/s, tuning took 0.054770 seconds at Mon Jul 11 18:23:41 2022
   32x64x16x16x2	N4quda31NdegTwistedCloverPreconditionedINS_34NdegTwistedCloverPreconditionedArgIdLi3ELi4EL21QudaReconstructType_s18EEEEE	policy_kernel=exterior_z,commDim=0011,parity=1	32	2	1	2048	1	1	6144	-1	-1	-1	-1	9.51389e-05	# 247.98 Gflop/s, 859.68 GB/s, tuning took 0.054786 seconds at Mon Jul 11 18:24:01 2022
   32x64x16x16x2	N4quda31NdegTwistedCloverPreconditionedINS_34NdegTwistedCloverPreconditionedArgIdLi3ELi4EL21QudaReconstructType_s18EEEEE	policy_kernel=exterior_z,commDim=0011,parity=1,zero_copy,p2p=1	32	2	1	2048	1	1	8785	-1	-1	-1	-1	9.49527e-05	# 248.47 Gflop/s, 861.36 GB/s, tuning took 0.054792 seconds at Mon Jul 11 18:24:02 2022
   32x64x16x16x2	N4quda31NdegTwistedCloverPreconditionedINS_34NdegTwistedCloverPreconditionedArgIdLi3ELi4EL21QudaReconstructType_s18EEEEE	policy_kernel=interior,comm=0011,commDim=0011,dagger,parity=1	32	2	1	16384	1	1	6144	-1	-1	-1	-1	0.00111923	# 1762.25 Gflop/s, 2911.79 GB/s, tuning took 0.504947 seconds at Mon Jul 11 18:23:39 2022
   32x64x16x16x2	N4quda31NdegTwistedCloverPreconditionedINS_34NdegTwistedCloverPreconditionedArgIdLi3ELi4EL21QudaReconstructType_s18EEEEE	policy_kernel=interior,comm=0011,commDim=0011,dagger,parity=1,host-device	32	2	1	16384	1	1	6182	2	-1	-1	-1	0.00115746	# 1706.77 Gflop/s, 2880.85 GB/s, tuning took 3.286902 seconds at Mon Jul 11 18:23:44 2022
   32x64x16x16x2	N4quda31NdegTwistedCloverPreconditionedINS_34NdegTwistedCloverPreconditionedArgIdLi3ELi4EL21QudaReconstructType_s18EEEEE	policy_kernel=interior,comm=0011,commDim=0011,dagger,parity=1,host-remote	32	2	1	16384	1	1	15174	2	-1	-1	-1	0.00115063	# 1716.89 Gflop/s, 2897.94 GB/s, tuning took 3.277918 seconds at Mon Jul 11 18:23:52 2022
   32x64x16x16x2	N4quda31NdegTwistedCloverPreconditionedINS_34NdegTwistedCloverPreconditionedArgIdLi3ELi4EL21QudaReconstructType_s18EEEEE	policy_kernel=interior,comm=0011,commDim=0011,parity=1	32	2	1	16384	1	1	7258	-1	-1	-1	-1	0.00111377	# 1770.90 Gflop/s, 2926.07 GB/s, tuning took 0.502697 seconds at Mon Jul 11 18:24:01 2022
   32x64x16x16x2	N4quda31NdegTwistedCloverPreconditionedINS_34NdegTwistedCloverPreconditionedArgIdLi3ELi4EL21QudaReconstructType_s18EEEEE	policy_kernel=interior,comm=0011,commDim=0011,parity=1,host-device	32	2	1	16384	1	1	18546	3	-1	-1	-1	0.00114961	# 1718.42 Gflop/s, 2900.52 GB/s, tuning took 3.277604 seconds at Mon Jul 11 18:24:06 2022
   32x64x16x16x2	N4quda31NdegTwistedCloverPreconditionedINS_34NdegTwistedCloverPreconditionedArgIdLi3ELi4EL21QudaReconstructType_s18EEEEE	policy_kernel=interior,comm=0011,commDim=0011,parity=1,host-remote	32	2	1	16384	1	1	15174	3	-1	-1	-1	0.00114278	# 1728.69 Gflop/s, 2917.85 GB/s, tuning took 3.271418 seconds at Mon Jul 11 18:24:13 2022
   32x64x16x16x2	N4quda31NdegTwistedCloverPreconditionedINS_34NdegTwistedCloverPreconditionedArgIfLi3ELi4EL21QudaReconstructType_s18EEEEE	policy,commDim=0011,dagger,parity=1,topo=1148,order=0123,p2p=7,gdr=1,nvshmem=0,pol=111111111111110000	32	1	1	1	1	1	0	3	1	0	-1	0.000830805	# 2423.27 Gflop/s, 2059.78 GB/s, tuning took 0.137941 seconds at Mon Jul 11 18:23:10 2022
   32x64x16x16x2	N4quda31NdegTwistedCloverPreconditionedINS_34NdegTwistedCloverPreconditionedArgIfLi3ELi4EL21QudaReconstructType_s18EEEEE	policy,commDim=0011,parity=1,topo=1148,order=0123,p2p=7,gdr=1,nvshmem=0,pol=111111111111110000	32	1	1	1	1	1	0	5	1	0	-1	0.000886101	# 2272.05 Gflop/s, 1931.24 GB/s, tuning took 0.133894 seconds at Mon Jul 11 18:23:27 2022
   32x64x16x16x2	N4quda31NdegTwistedCloverPreconditionedINS_34NdegTwistedCloverPreconditionedArgIfLi3ELi4EL21QudaReconstructType_s18EEEEE	policy_kernel=exterior_all,commDim=0011,dagger,parity=1	64	2	1	2048	1	1	18546	-1	-1	-1	-1	0.000123449	# 382.23 Gflop/s, 662.53 GB/s, tuning took 0.101058 seconds at Mon Jul 11 18:23:01 2022
   32x64x16x16x2	N4quda31NdegTwistedCloverPreconditionedINS_34NdegTwistedCloverPreconditionedArgIfLi3ELi4EL21QudaReconstructType_s18EEEEE	policy_kernel=exterior_all,commDim=0011,dagger,parity=1,zero_copy,p2p=1	16	2	1	8192	1	1	6955	-1	-1	-1	-1	0.00032256	# 146.29 Gflop/s, 253.56 GB/s, tuning took 0.201341 seconds at Mon Jul 11 18:23:02 2022
   32x64x16x16x2	N4quda31NdegTwistedCloverPreconditionedINS_34NdegTwistedCloverPreconditionedArgIfLi3ELi4EL21QudaReconstructType_s18EEEEE	policy_kernel=exterior_all,commDim=0011,parity=1	64	2	1	2048	1	1	27819	-1	-1	-1	-1	0.000122766	# 384.36 Gflop/s, 666.22 GB/s, tuning took 0.101211 seconds at Mon Jul 11 18:23:18 2022
   32x64x16x16x2	N4quda31NdegTwistedCloverPreconditionedINS_34NdegTwistedCloverPreconditionedArgIfLi3ELi4EL21QudaReconstructType_s18EEEEE	policy_kernel=exterior_all,commDim=0011,parity=1,zero_copy,p2p=1	64	2	1	2048	1	1	23845	-1	-1	-1	-1	0.00032128	# 146.87 Gflop/s, 254.57 GB/s, tuning took 0.201426 seconds at Mon Jul 11 18:23:19 2022
   32x64x16x16x2	N4quda31NdegTwistedCloverPreconditionedINS_34NdegTwistedCloverPreconditionedArgIfLi3ELi4EL21QudaReconstructType_s18EEEEE	policy_kernel=exterior_t,commDim=0011,dagger,parity=1	64	2	1	1024	1	1	27819	-1	-1	-1	-1	5.61493e-05	# 420.18 Gflop/s, 728.32 GB/s, tuning took 0.050113 seconds at Mon Jul 11 18:23:01 2022
   32x64x16x16x2	N4quda31NdegTwistedCloverPreconditionedINS_34NdegTwistedCloverPreconditionedArgIfLi3ELi4EL21QudaReconstructType_s18EEEEE	policy_kernel=exterior_t,commDim=0011,dagger,parity=1,zero_copy,p2p=1	32	2	1	2048	1	1	83457	-1	-1	-1	-1	0.000248832	# 94.81 Gflop/s, 164.35 GB/s, tuning took 0.148008 seconds at Mon Jul 11 18:23:02 2022
   32x64x16x16x2	N4quda31NdegTwistedCloverPreconditionedINS_34NdegTwistedCloverPreconditionedArgIfLi3ELi4EL21QudaReconstructType_s18EEEEE	policy_kernel=exterior_t,commDim=0011,parity=1	64	2	1	1024	1	1	41729	-1	-1	-1	-1	5.62062e-05	# 419.76 Gflop/s, 727.58 GB/s, tuning took 0.050095 seconds at Mon Jul 11 18:23:18 2022
   32x64x16x16x2	N4quda31NdegTwistedCloverPreconditionedINS_34NdegTwistedCloverPreconditionedArgIfLi3ELi4EL21QudaReconstructType_s18EEEEE	policy_kernel=exterior_t,commDim=0011,parity=1,zero_copy,p2p=1	16	2	1	4096	1	1	55638	-1	-1	-1	-1	0.000248627	# 94.89 Gflop/s, 164.48 GB/s, tuning took 0.147994 seconds at Mon Jul 11 18:23:18 2022
   32x64x16x16x2	N4quda31NdegTwistedCloverPreconditionedINS_34NdegTwistedCloverPreconditionedArgIfLi3ELi4EL21QudaReconstructType_s18EEEEE	policy_kernel=exterior_z,commDim=0011,dagger,parity=1	64	2	1	1024	1	1	18546	-1	-1	-1	-1	6.25242e-05	# 377.34 Gflop/s, 654.06 GB/s, tuning took 0.054816 seconds at Mon Jul 11 18:23:01 2022
   32x64x16x16x2	N4quda31NdegTwistedCloverPreconditionedINS_34NdegTwistedCloverPreconditionedArgIfLi3ELi4EL21QudaReconstructType_s18EEEEE	policy_kernel=exterior_z,commDim=0011,dagger,parity=1,zero_copy,p2p=1	64	2	1	1024	1	1	6144	-1	-1	-1	-1	6.27049e-05	# 376.25 Gflop/s, 652.17 GB/s, tuning took 0.054921 seconds at Mon Jul 11 18:23:02 2022
   32x64x16x16x2	N4quda31NdegTwistedCloverPreconditionedINS_34NdegTwistedCloverPreconditionedArgIfLi3ELi4EL21QudaReconstructType_s18EEEEE	policy_kernel=exterior_z,commDim=0011,parity=1	64	2	1	1024	1	1	23845	-1	-1	-1	-1	6.2464e-05	# 377.70 Gflop/s, 654.69 GB/s, tuning took 0.054851 seconds at Mon Jul 11 18:23:18 2022
   32x64x16x16x2	N4quda31NdegTwistedCloverPreconditionedINS_34NdegTwistedCloverPreconditionedArgIfLi3ELi4EL21QudaReconstructType_s18EEEEE	policy_kernel=exterior_z,commDim=0011,parity=1,zero_copy,p2p=1	64	2	1	1024	1	1	16692	-1	-1	-1	-1	6.2464e-05	# 377.70 Gflop/s, 654.69 GB/s, tuning took 0.054884 seconds at Mon Jul 11 18:23:18 2022
   32x64x16x16x2	N4quda31NdegTwistedCloverPreconditionedINS_34NdegTwistedCloverPreconditionedArgIfLi3ELi4EL21QudaReconstructType_s18EEEEE	policy_kernel=interior,comm=0011,commDim=0011,dagger,parity=1	64	2	1	8192	1	1	18546	-1	-1	-1	-1	0.000594261	# 3319.03 Gflop/s, 2742.04 GB/s, tuning took 0.397884 seconds at Mon Jul 11 18:23:01 2022
   32x64x16x16x2	N4quda31NdegTwistedCloverPreconditionedINS_34NdegTwistedCloverPreconditionedArgIfLi3ELi4EL21QudaReconstructType_s18EEEEE	policy_kernel=interior,comm=0011,commDim=0011,dagger,parity=1,host-device	64	2	1	8192	1	1	18546	2	-1	-1	-1	0.000609963	# 3238.75 Gflop/s, 2733.34 GB/s, tuning took 2.670444 seconds at Mon Jul 11 18:23:05 2022
   32x64x16x16x2	N4quda31NdegTwistedCloverPreconditionedINS_34NdegTwistedCloverPreconditionedArgIfLi3ELi4EL21QudaReconstructType_s18EEEEE	policy_kernel=interior,comm=0011,commDim=0011,dagger,parity=1,host-remote	64	2	1	8192	1	1	12840	2	-1	-1	-1	0.000606891	# 3255.14 Gflop/s, 2747.18 GB/s, tuning took 2.671042 seconds at Mon Jul 11 18:23:10 2022
   32x64x16x16x2	N4quda31NdegTwistedCloverPreconditionedINS_34NdegTwistedCloverPreconditionedArgIfLi3ELi4EL21QudaReconstructType_s18EEEEE	policy_kernel=interior,comm=0011,commDim=0011,parity=1	64	2	1	8192	1	1	18546	-1	-1	-1	-1	0.000595627	# 3311.42 Gflop/s, 2735.75 GB/s, tuning took 0.398588 seconds at Mon Jul 11 18:23:18 2022
   32x64x16x16x2	N4quda31NdegTwistedCloverPreconditionedINS_34NdegTwistedCloverPreconditionedArgIfLi3ELi4EL21QudaReconstructType_s18EEEEE	policy_kernel=interior,comm=0011,commDim=0011,parity=1,host-device	64	2	1	8192	1	1	11923	2	-1	-1	-1	0.000611669	# 3229.71 Gflop/s, 2725.71 GB/s, tuning took 2.675524 seconds at Mon Jul 11 18:23:21 2022
   32x64x16x16x2	N4quda31NdegTwistedCloverPreconditionedINS_34NdegTwistedCloverPreconditionedArgIfLi3ELi4EL21QudaReconstructType_s18EEEEE	policy_kernel=interior,comm=0011,commDim=0011,parity=1,host-remote	64	2	1	8192	1	1	27819	2	-1	-1	-1	0.000608597	# 3246.02 Gflop/s, 2739.47 GB/s, tuning took 2.669610 seconds at Mon Jul 11 18:23:26 2022
   32x64x16x16x2	N4quda31NdegTwistedCloverPreconditionedINS_34NdegTwistedCloverPreconditionedArgIsLi3ELi4EL21QudaReconstructType_s18EEEEE	policy,commDim=0011,dagger,parity=1,topo=1148,order=0123,p2p=7,gdr=1,nvshmem=0,pol=111111111111110000	32	1	1	1	1	1	0	2	1	0	-1	0.000557397	# 3611.90 Gflop/s, 1610.31 GB/s, tuning took 0.082288 seconds at Mon Jul 11 18:24:34 2022
   32x64x16x16x2	N4quda31NdegTwistedCloverPreconditionedINS_34NdegTwistedCloverPreconditionedArgIsLi3ELi4EL21QudaReconstructType_s18EEEEE	policy,commDim=0011,parity=1,topo=1148,order=0123,p2p=7,gdr=1,nvshmem=0,pol=111111111111110000	32	1	1	1	1	1	0	5	1	0	-1	0.000568661	# 3540.36 Gflop/s, 1578.41 GB/s, tuning took 0.081919 seconds at Mon Jul 11 18:24:47 2022
   32x64x16x16x2	N4quda31NdegTwistedCloverPreconditionedINS_34NdegTwistedCloverPreconditionedArgIsLi3ELi4EL21QudaReconstructType_s18EEEEE	policy_kernel=exterior_all,commDim=0011,dagger,parity=1	64	2	1	2048	1	1	27819	-1	-1	-1	-1	6.69696e-05	# 704.59 Gflop/s, 649.79 GB/s, tuning took 0.064780 seconds at Mon Jul 11 18:24:27 2022
   32x64x16x16x2	N4quda31NdegTwistedCloverPreconditionedINS_34NdegTwistedCloverPreconditionedArgIsLi3ELi4EL21QudaReconstructType_s18EEEEE	policy_kernel=exterior_all,commDim=0011,dagger,parity=1,zero_copy,p2p=1	64	2	1	2048	1	1	6144	-1	-1	-1	-1	0.000177835	# 265.34 Gflop/s, 244.70 GB/s, tuning took 0.126021 seconds at Mon Jul 11 18:24:27 2022
   32x64x16x16x2	N4quda31NdegTwistedCloverPreconditionedINS_34NdegTwistedCloverPreconditionedArgIsLi3ELi4EL21QudaReconstructType_s18EEEEE	policy_kernel=exterior_all,commDim=0011,parity=1	64	2	1	2048	1	1	15174	-1	-1	-1	-1	6.69013e-05	# 705.31 Gflop/s, 650.45 GB/s, tuning took 0.064915 seconds at Mon Jul 11 18:24:40 2022
   32x64x16x16x2	N4quda31NdegTwistedCloverPreconditionedINS_34NdegTwistedCloverPreconditionedArgIsLi3ELi4EL21QudaReconstructType_s18EEEEE	policy_kernel=exterior_all,commDim=0011,parity=1,zero_copy,p2p=1	64	2	1	2048	1	1	23845	-1	-1	-1	-1	0.000178005	# 265.08 Gflop/s, 244.46 GB/s, tuning took 0.126102 seconds at Mon Jul 11 18:24:40 2022
   32x64x16x16x2	N4quda31NdegTwistedCloverPreconditionedINS_34NdegTwistedCloverPreconditionedArgIsLi3ELi4EL21QudaReconstructType_s18EEEEE	policy_kernel=exterior_t,commDim=0011,dagger,parity=1	64	2	1	1024	1	1	10433	-1	-1	-1	-1	3.22395e-05	# 731.80 Gflop/s, 674.89 GB/s, tuning took 0.036360 seconds at Mon Jul 11 18:24:27 2022
   32x64x16x16x2	N4quda31NdegTwistedCloverPreconditionedINS_34NdegTwistedCloverPreconditionedArgIsLi3ELi4EL21QudaReconstructType_s18EEEEE	policy_kernel=exterior_t,commDim=0011,dagger,parity=1,zero_copy,p2p=1	32	2	1	2048	1	1	83457	-1	-1	-1	-1	0.000149211	# 158.12 Gflop/s, 145.82 GB/s, tuning took 0.101400 seconds at Mon Jul 11 18:24:27 2022
   32x64x16x16x2	N4quda31NdegTwistedCloverPreconditionedINS_34NdegTwistedCloverPreconditionedArgIsLi3ELi4EL21QudaReconstructType_s18EEEEE	policy_kernel=exterior_t,commDim=0011,parity=1	32	2	1	2048	1	1	9819	-1	-1	-1	-1	3.24267e-05	# 727.58 Gflop/s, 670.99 GB/s, tuning took 0.036077 seconds at Mon Jul 11 18:24:40 2022
   32x64x16x16x2	N4quda31NdegTwistedCloverPreconditionedINS_34NdegTwistedCloverPreconditionedArgIsLi3ELi4EL21QudaReconstructType_s18EEEEE	policy_kernel=exterior_t,commDim=0011,parity=1,zero_copy,p2p=1	32	2	1	2048	1	1	83457	-1	-1	-1	-1	0.000149211	# 158.12 Gflop/s, 145.82 GB/s, tuning took 0.101389 seconds at Mon Jul 11 18:24:40 2022
   32x64x16x16x2	N4quda31NdegTwistedCloverPreconditionedINS_34NdegTwistedCloverPreconditionedArgIsLi3ELi4EL21QudaReconstructType_s18EEEEE	policy_kernel=exterior_z,commDim=0011,dagger,parity=1	64	2	1	1024	1	1	13910	-1	-1	-1	-1	3.328e-05	# 708.92 Gflop/s, 653.78 GB/s, tuning took 0.036916 seconds at Mon Jul 11 18:24:27 2022
   32x64x16x16x2	N4quda31NdegTwistedCloverPreconditionedINS_34NdegTwistedCloverPreconditionedArgIsLi3ELi4EL21QudaReconstructType_s18EEEEE	policy_kernel=exterior_z,commDim=0011,dagger,parity=1,zero_copy,p2p=1	64	2	1	1024	1	1	12840	-1	-1	-1	-1	3.31776e-05	# 711.11 Gflop/s, 655.80 GB/s, tuning took 0.036796 seconds at Mon Jul 11 18:24:27 2022
   32x64x16x16x2	N4quda31NdegTwistedCloverPreconditionedINS_34NdegTwistedCloverPreconditionedArgIsLi3ELi4EL21QudaReconstructType_s18EEEEE	policy_kernel=exterior_z,commDim=0011,parity=1	64	2	1	1024	1	1	6144	-1	-1	-1	-1	3.31917e-05	# 710.81 Gflop/s, 655.52 GB/s, tuning took 0.036502 seconds at Mon Jul 11 18:24:40 2022
   32x64x16x16x2	N4quda31NdegTwistedCloverPreconditionedINS_34NdegTwistedCloverPreconditionedArgIsLi3ELi4EL21QudaReconstructType_s18EEEEE	policy_kernel=exterior_z,commDim=0011,parity=1,zero_copy,p2p=1	64	2	1	1024	1	1	33383	-1	-1	-1	-1	3.31435e-05	# 711.84 Gflop/s, 656.48 GB/s, tuning took 0.036733 seconds at Mon Jul 11 18:24:40 2022
   32x64x16x16x2	N4quda31NdegTwistedCloverPreconditionedINS_34NdegTwistedCloverPreconditionedArgIsLi3ELi4EL21QudaReconstructType_s18EEEEE	policy_kernel=interior,comm=0011,commDim=0011,dagger,parity=1	64	2	1	8192	1	1	11923	-1	-1	-1	-1	0.000371029	# 5315.94 Gflop/s, 2301.88 GB/s, tuning took 0.306384 seconds at Mon Jul 11 18:24:27 2022
   32x64x16x16x2	N4quda31NdegTwistedCloverPreconditionedINS_34NdegTwistedCloverPreconditionedArgIsLi3ELi4EL21QudaReconstructType_s18EEEEE	policy_kernel=interior,comm=0011,commDim=0011,dagger,parity=1,host-device	64	2	1	8192	1	1	20865	2	-1	-1	-1	0.000379563	# 5204.72 Gflop/s, 2299.86 GB/s, tuning took 2.253686 seconds at Mon Jul 11 18:24:30 2022
   32x64x16x16x2	N4quda31NdegTwistedCloverPreconditionedINS_34NdegTwistedCloverPreconditionedArgIsLi3ELi4EL21QudaReconstructType_s18EEEEE	policy_kernel=interior,comm=0011,commDim=0011,dagger,parity=1,host-remote	64	2	1	8192	1	1	15174	2	-1	-1	-1	0.000378539	# 5218.80 Gflop/s, 2306.08 GB/s, tuning took 2.253547 seconds at Mon Jul 11 18:24:34 2022
   32x64x16x16x2	N4quda31NdegTwistedCloverPreconditionedINS_34NdegTwistedCloverPreconditionedArgIsLi3ELi4EL21QudaReconstructType_s18EEEEE	policy_kernel=interior,comm=0011,commDim=0011,parity=1	64	2	1	8192	1	1	11128	-1	-1	-1	-1	0.00036864	# 5350.40 Gflop/s, 2316.80 GB/s, tuning took 0.305778 seconds at Mon Jul 11 18:24:40 2022
   32x64x16x16x2	N4quda31NdegTwistedCloverPreconditionedINS_34NdegTwistedCloverPreconditionedArgIsLi3ELi4EL21QudaReconstructType_s18EEEEE	policy_kernel=interior,comm=0011,commDim=0011,parity=1,host-device	64	2	1	8192	1	1	12840	2	-1	-1	-1	0.000376832	# 5242.43 Gflop/s, 2316.52 GB/s, tuning took 2.248615 seconds at Mon Jul 11 18:24:43 2022
   32x64x16x16x2	N4quda31NdegTwistedCloverPreconditionedINS_34NdegTwistedCloverPreconditionedArgIsLi3ELi4EL21QudaReconstructType_s18EEEEE	policy_kernel=interior,comm=0011,commDim=0011,parity=1,host-remote	64	2	1	8192	1	1	23845	2	-1	-1	-1	0.000376832	# 5242.43 Gflop/s, 2316.52 GB/s, tuning took 2.243626 seconds at Mon Jul 11 18:24:47 2022
   32x64x16x16x2	N4quda4PackIdLi3ELb1EEE	policy_kernel,vol=1048576,parity=1,precision=8,order=2,Ns=4,Nc=3,TwistFlavor=2,comm=0011,topo=1148,order=0123,dagger,nFace=1,device-device	800	1	1	164	2	1	0	-1	-1	-1	-1	5.26552e-05	# 59.74 Gflop/s, 1433.81 GB/s, tuning took 2.544880 seconds at Mon Jul 11 18:23:39 2022
   32x64x16x16x2	N4quda4PackIdLi3ELb1EEE	policy_kernel,vol=1048576,parity=1,precision=8,order=2,Ns=4,Nc=3,TwistFlavor=2,comm=0011,topo=1148,order=0123,dagger,nFace=1,device-remote	160	2	1	55	1	1	0	-1	-1	-1	-1	8.6016e-05	# 36.57 Gflop/s, 877.71 GB/s, tuning took 3.730321 seconds at Mon Jul 11 18:23:48 2022
   32x64x16x16x2	N4quda4PackIdLi3ELb1EEE	policy_kernel,vol=1048576,parity=1,precision=8,order=2,Ns=4,Nc=3,TwistFlavor=2,comm=0011,topo=1148,order=0123,dagger,nFace=1,host-device	160	2	1	4	1	1	0	-1	-1	-1	-1	0.000485035	# 6.49 Gflop/s, 155.65 GB/s, tuning took 0.491801 seconds at Mon Jul 11 18:23:40 2022
   32x64x16x16x2	N4quda4PackIdLi3ELb1EEE	policy_kernel,vol=1048576,parity=1,precision=8,order=2,Ns=4,Nc=3,TwistFlavor=2,comm=0011,topo=1148,order=0123,dagger,nFace=1,host-remote	128	2	1	4	1	1	0	-1	-1	-1	-1	0.000485035	# 6.49 Gflop/s, 155.65 GB/s, tuning took 0.487208 seconds at Mon Jul 11 18:23:48 2022
   32x64x16x16x2	N4quda4PackIdLi3ELb1EEE	policy_kernel,vol=1048576,parity=1,precision=8,order=2,Ns=4,Nc=3,TwistFlavor=2,comm=0011,topo=1148,order=0123,nFace=1,device-device	672	1	1	205	2	1	0	-1	-1	-1	-1	5.248e-05	# 59.94 Gflop/s, 1438.60 GB/s, tuning took 2.543086 seconds at Mon Jul 11 18:24:01 2022
   32x64x16x16x2	N4quda4PackIdLi3ELb1EEE	policy_kernel,vol=1048576,parity=1,precision=8,order=2,Ns=4,Nc=3,TwistFlavor=2,comm=0011,topo=1148,order=0123,nFace=1,device-remote	96	1	1	32	2	1	0	-1	-1	-1	-1	8.54187e-05	# 36.83 Gflop/s, 883.85 GB/s, tuning took 3.709604 seconds at Mon Jul 11 18:24:10 2022
   32x64x16x16x2	N4quda4PackIdLi3ELb1EEE	policy_kernel,vol=1048576,parity=1,precision=8,order=2,Ns=4,Nc=3,TwistFlavor=2,comm=0011,topo=1148,order=0123,nFace=1,host-device	256	2	1	4	1	1	0	-1	-1	-1	-1	0.000485035	# 6.49 Gflop/s, 155.65 GB/s, tuning took 0.490875 seconds at Mon Jul 11 18:24:02 2022
   32x64x16x16x2	N4quda4PackIdLi3ELb1EEE	policy_kernel,vol=1048576,parity=1,precision=8,order=2,Ns=4,Nc=3,TwistFlavor=2,comm=0011,topo=1148,order=0123,nFace=1,host-remote	128	2	1	4	1	1	0	-1	-1	-1	-1	0.000484693	# 6.49 Gflop/s, 155.76 GB/s, tuning took 0.488215 seconds at Mon Jul 11 18:24:10 2022
   32x64x16x16x2	N4quda4PackIfLi3ELb1EEE	policy_kernel,vol=1048576,parity=1,precision=4,order=4,Ns=4,Nc=3,TwistFlavor=2,comm=0011,topo=1148,order=0123,dagger,nFace=1,device-device	320	1	1	205	2	1	0	-1	-1	-1	-1	1.32819e-05	# 236.84 Gflop/s, 2842.12 GB/s, tuning took 1.225908 seconds at Mon Jul 11 18:23:01 2022
   32x64x16x16x2	N4quda4PackIfLi3ELb1EEE	policy_kernel,vol=1048576,parity=1,precision=4,order=4,Ns=4,Nc=3,TwistFlavor=2,comm=0011,topo=1148,order=0123,dagger,nFace=1,device-remote	480	1	1	55	2	1	0	-1	-1	-1	-1	4.5056e-05	# 69.82 Gflop/s, 837.82 GB/s, tuning took 2.076496 seconds at Mon Jul 11 18:23:07 2022
   32x64x16x16x2	N4quda4PackIfLi3ELb1EEE	policy_kernel,vol=1048576,parity=1,precision=4,order=4,Ns=4,Nc=3,TwistFlavor=2,comm=0011,topo=1148,order=0123,dagger,nFace=1,host-device	224	2	1	4	1	1	0	-1	-1	-1	-1	0.00024535	# 12.82 Gflop/s, 153.86 GB/s, tuning took 0.257340 seconds at Mon Jul 11 18:23:02 2022
   32x64x16x16x2	N4quda4PackIfLi3ELb1EEE	policy_kernel,vol=1048576,parity=1,precision=4,order=4,Ns=4,Nc=3,TwistFlavor=2,comm=0011,topo=1148,order=0123,dagger,nFace=1,host-remote	256	2	1	4	1	1	0	-1	-1	-1	-1	0.00024535	# 12.82 Gflop/s, 153.86 GB/s, tuning took 0.248881 seconds at Mon Jul 11 18:23:07 2022
   32x64x16x16x2	N4quda4PackIfLi3ELb1EEE	policy_kernel,vol=1048576,parity=1,precision=4,order=4,Ns=4,Nc=3,TwistFlavor=2,comm=0011,topo=1148,order=0123,nFace=1,device-device	384	1	1	205	2	1	0	-1	-1	-1	-1	1.29463e-05	# 242.98 Gflop/s, 2915.80 GB/s, tuning took 1.208416 seconds at Mon Jul 11 18:23:17 2022
   32x64x16x16x2	N4quda4PackIfLi3ELb1EEE	policy_kernel,vol=1048576,parity=1,precision=4,order=4,Ns=4,Nc=3,TwistFlavor=2,comm=0011,topo=1148,order=0123,nFace=1,device-remote	224	2	1	55	1	1	0	-1	-1	-1	-1	4.48233e-05	# 70.18 Gflop/s, 842.17 GB/s, tuning took 2.052193 seconds at Mon Jul 11 18:23:23 2022
   32x64x16x16x2	N4quda4PackIfLi3ELb1EEE	policy_kernel,vol=1048576,parity=1,precision=4,order=4,Ns=4,Nc=3,TwistFlavor=2,comm=0011,topo=1148,order=0123,nFace=1,host-device	192	2	1	4	1	1	0	-1	-1	-1	-1	0.00024535	# 12.82 Gflop/s, 153.86 GB/s, tuning took 0.255193 seconds at Mon Jul 11 18:23:18 2022
   32x64x16x16x2	N4quda4PackIfLi3ELb1EEE	policy_kernel,vol=1048576,parity=1,precision=4,order=4,Ns=4,Nc=3,TwistFlavor=2,comm=0011,topo=1148,order=0123,nFace=1,host-remote	224	2	1	4	1	1	0	-1	-1	-1	-1	0.000245146	# 12.83 Gflop/s, 153.98 GB/s, tuning took 0.246808 seconds at Mon Jul 11 18:23:24 2022
   32x64x16x16x2	N4quda4PackIsLi3ELb1EEE	policy_kernel,vol=1048576,parity=1,precision=2,order=8,Ns=4,Nc=3,TwistFlavor=2,comm=0011,topo=1148,order=0123,dagger,nFace=1,device-device	640	1	1	205	2	1	0	-1	-1	-1	-1	1.00674e-05	# 312.47 Gflop/s, 2083.11 GB/s, tuning took 1.037634 seconds at Mon Jul 11 18:24:26 2022
   32x64x16x16x2	N4quda4PackIsLi3ELb1EEE	policy_kernel,vol=1048576,parity=1,precision=2,order=8,Ns=4,Nc=3,TwistFlavor=2,comm=0011,topo=1148,order=0123,dagger,nFace=1,device-remote	512	1	1	32	2	1	0	-1	-1	-1	-1	3.0656e-05	# 102.61 Gflop/s, 684.09 GB/s, tuning took 1.640399 seconds at Mon Jul 11 18:24:31 2022
   32x64x16x16x2	N4quda4PackIsLi3ELb1EEE	policy_kernel,vol=1048576,parity=1,precision=2,order=8,Ns=4,Nc=3,TwistFlavor=2,comm=0011,topo=1148,order=0123,dagger,nFace=1,host-device	448	2	1	4	1	1	0	-1	-1	-1	-1	0.000150235	# 20.94 Gflop/s, 139.59 GB/s, tuning took 0.203837 seconds at Mon Jul 11 18:24:27 2022
   32x64x16x16x2	N4quda4PackIsLi3ELb1EEE	policy_kernel,vol=1048576,parity=1,precision=2,order=8,Ns=4,Nc=3,TwistFlavor=2,comm=0011,topo=1148,order=0123,dagger,nFace=1,host-remote	512	2	1	4	1	1	0	-1	-1	-1	-1	0.000149943	# 20.98 Gflop/s, 139.86 GB/s, tuning took 0.202169 seconds at Mon Jul 11 18:24:31 2022
   32x64x16x16x2	N4quda4PackIsLi3ELb1EEE	policy_kernel,vol=1048576,parity=1,precision=2,order=8,Ns=4,Nc=3,TwistFlavor=2,comm=0011,topo=1148,order=0123,nFace=1,device-device	672	1	1	205	2	1	0	-1	-1	-1	-1	9.81429e-06	# 320.53 Gflop/s, 2136.83 GB/s, tuning took 0.967245 seconds at Mon Jul 11 18:24:39 2022
   32x64x16x16x2	N4quda4PackIsLi3ELb1EEE	policy_kernel,vol=1048576,parity=1,precision=2,order=8,Ns=4,Nc=3,TwistFlavor=2,comm=0011,topo=1148,order=0123,nFace=1,device-remote	352	1	1	64	2	1	0	-1	-1	-1	-1	3.0656e-05	# 102.61 Gflop/s, 684.09 GB/s, tuning took 1.610640 seconds at Mon Jul 11 18:24:44 2022
   32x64x16x16x2	N4quda4PackIsLi3ELb1EEE	policy_kernel,vol=1048576,parity=1,precision=2,order=8,Ns=4,Nc=3,TwistFlavor=2,comm=0011,topo=1148,order=0123,nFace=1,host-device	512	2	1	4	1	1	0	-1	-1	-1	-1	0.000146871	# 21.42 Gflop/s, 142.79 GB/s, tuning took 0.199869 seconds at Mon Jul 11 18:24:40 2022
   32x64x16x16x2	N4quda4PackIsLi3ELb1EEE	policy_kernel,vol=1048576,parity=1,precision=2,order=8,Ns=4,Nc=3,TwistFlavor=2,comm=0011,topo=1148,order=0123,nFace=1,host-remote	512	2	1	4	1	1	0	-1	-1	-1	-1	0.000147017	# 21.40 Gflop/s, 142.65 GB/s, tuning took 0.199261 seconds at Mon Jul 11 18:24:44 2022
   32x64x16x16x2	N4quda4blas11axpbyzNorm2IddEE	GPU-offline,nParity=1,vol=1048576,parity=1,precision=8,order=2,Ns=4,Nc=3,TwistFlavor=2	992	1	1	90	1	1	0	-1	-1	-1	-1	0.000454656	# 221.41 Gflop/s, 1328.43 GB/s, tuning took 2.940343 seconds at Mon Jul 11 18:24:23 2022
   32x64x16x16x2	N4quda4blas11axpbyzNorm2IdfEE	GPU-offline,nParity=1,vol=1048576,parity=1,precision=2,order=8,Ns=4,Nc=3,TwistFlavor=2	352	1	1	192	1	1	0	-1	-1	-1	-1	0.000135296	# 744.02 Gflop/s, 1209.04 GB/s, tuning took 0.883100 seconds at Mon Jul 11 18:24:54 2022
   32x64x16x16x2	N4quda4blas11axpbyzNorm2IdfEE	GPU-offline,nParity=1,vol=1048576,parity=1,precision=4,order=4,Ns=4,Nc=3,TwistFlavor=2	928	1	1	96	1	1	0	-1	-1	-1	-1	0.000234291	# 429.65 Gflop/s, 1288.95 GB/s, tuning took 1.563735 seconds at Fri Jul 29 15:16:25 2022
   32x64x16x16x2	N4quda4blas11axpyCGNorm2IddEE	GPU-offline,nParity=1,vol=1048576,parity=1,precision=8,order=2,Ns=4,Nc=3,TwistFlavor=2	992	1	1	96	1	1	0	-1	-1	-1	-1	0.000456021	# 331.11 Gflop/s, 1324.45 GB/s, tuning took 2.935866 seconds at Fri Jul 29 13:30:38 2022
   32x64x16x16x2	N4quda4blas11axpyCGNorm2IdfEE	GPU-offline,nParity=1,vol=1048576,parity=1,precision=4,order=4,Ns=4,Nc=3,TwistFlavor=2	832	1	1	108	1	1	0	-1	-1	-1	-1	0.000236134	# 639.44 Gflop/s, 1278.89 GB/s, tuning took 1.586783 seconds at Mon Jul 11 18:23:36 2022
   32x64x16x16x2	N4quda4blas11multicaxpy_IdEE	GPU-offline,vol=1048576,parity=1,precision=2,order=8,Ns=4,Nc=3,TwistFlavor=2,vol=1048576,parity=1,precision=8,order=2,Ns=4,Nc=3,TwistFlavor=2,Nxz=1,Nyw=1	256	1	1	216	1	1	0	1	0	0	0	0.000347819	# 289.41 Gflop/s, 1314.42 GB/s, tuning took 0.040365 seconds at Mon Jul 11 18:24:53 2022
   32x64x16x16x2	N4quda4blas11multicaxpy_IdEE	GPU-offline,vol=1048576,parity=1,precision=4,order=4,Ns=4,Nc=3,TwistFlavor=2,vol=1048576,parity=1,precision=8,order=2,Ns=4,Nc=3,TwistFlavor=2,Nxz=1,Nyw=1	544	1	1	216	1	1	0	1	0	0	0	0.000380245	# 264.73 Gflop/s, 1323.66 GB/s, tuning took 0.039676 seconds at Fri Jul 29 15:16:23 2022
   32x64x16x16x2	N4quda4blas11multicaxpy_IdEE	GPU-offline,vol=1048576,parity=1,precision=8,order=2,Ns=4,Nc=3,TwistFlavor=2,Nxz=1,Nyw=1	512	1	1	216	1	1	0	1	0	0	0	0.000451584	# 222.91 Gflop/s, 1337.47 GB/s, tuning took 0.066163 seconds at Fri Jul 29 15:11:52 2022
   32x64x16x16x2	N4quda4blas15tripleCGUpdate_IdEE	GPU-offline,vol=1048576,parity=1,precision=2,order=8,Ns=4,Nc=3,TwistFlavor=2,vol=1048576,parity=1,precision=8,order=2,Ns=4,Nc=3,TwistFlavor=2	128	1	1	216	1	1	0	-1	-1	-1	-1	0.000518485	# 291.22 Gflop/s, 1302.41 GB/s, tuning took 0.030673 seconds at Mon Jul 11 18:24:53 2022
   32x64x16x16x2	N4quda4blas15tripleCGUpdate_IdEE	GPU-offline,vol=1048576,parity=1,precision=4,order=4,Ns=4,Nc=3,TwistFlavor=2,vol=1048576,parity=1,precision=8,order=2,Ns=4,Nc=3,TwistFlavor=2	128	1	1	216	1	1	0	-1	-1	-1	-1	0.000677205	# 222.97 Gflop/s, 1337.81 GB/s, tuning took 0.039049 seconds at Fri Jul 29 15:16:21 2022
   32x64x16x16x2	N4quda4blas16multi_axpyBzpcx_IdEE	GPU-offline,vol=1048576,parity=1,precision=4,order=4,Ns=4,Nc=3,TwistFlavor=2,vol=1048576,parity=1,precision=8,order=2,Ns=4,Nc=3,TwistFlavor=2,Nxz=1,Nyw=1	384	1	1	216	1	1	0	1	0	0	0	0.000524971	# 239.69 Gflop/s, 1342.25 GB/s, tuning took 0.041075 seconds at Mon Jul 11 18:23:36 2022
   32x64x16x16x2	N4quda4blas16multi_axpyBzpcx_IdEE	GPU-offline,vol=1048576,parity=1,precision=4,order=4,Ns=4,Nc=3,TwistFlavor=2,vol=1048576,parity=1,precision=8,order=2,Ns=4,Nc=3,TwistFlavor=2,Nxz=1,Nyw=2	64	2	1	216	1	1	0	1	0	0	0	0.000985429	# 255.38 Gflop/s, 1430.12 GB/s, tuning took 0.096543 seconds at Tue Jul 12 12:24:16 2022
   32x64x16x16x2	N4quda4blas16multi_axpyBzpcx_IdEE	GPU-offline,vol=1048576,parity=1,precision=4,order=4,Ns=4,Nc=3,TwistFlavor=2,vol=1048576,parity=1,precision=8,order=2,Ns=4,Nc=3,TwistFlavor=2,Nxz=1,Nyw=3	128	3	1	216	1	1	0	1	0	0	0	0.00142711	# 264.51 Gflop/s, 1481.26 GB/s, tuning took 0.160846 seconds at Tue Jul 12 12:24:17 2022
   32x64x16x16x2	N4quda4blas16multi_axpyBzpcx_IdEE	GPU-offline,vol=1048576,parity=1,precision=8,order=2,Ns=4,Nc=3,TwistFlavor=2,Nxz=1,Nyw=1	608	1	1	216	1	1	0	1	0	0	0	0.000752981	# 167.11 Gflop/s, 1336.86 GB/s, tuning took 0.105617 seconds at Fri Jul 29 13:30:40 2022
   32x64x16x16x2	N4quda4blas16multi_axpyBzpcx_IdEE	GPU-offline,vol=1048576,parity=1,precision=8,order=2,Ns=4,Nc=3,TwistFlavor=2,Nxz=1,Nyw=2	96	1	1	216	2	1	0	1	0	0	0	0.00135339	# 185.95 Gflop/s, 1487.58 GB/s, tuning took 0.263039 seconds at Fri Jul 29 13:30:39 2022
   32x64x16x16x2	N4quda4blas16multi_axpyBzpcx_IdEE	GPU-offline,vol=1048576,parity=1,precision=8,order=2,Ns=4,Nc=3,TwistFlavor=2,Nxz=1,Nyw=3	96	3	1	216	1	1	0	1	0	0	0	0.00196267	# 192.33 Gflop/s, 1538.67 GB/s, tuning took 0.451115 seconds at Fri Jul 29 13:30:39 2022
   32x64x16x16x2	N4quda4blas18tripleCGReduction_IddEE	GPU-offline,nParity=1,vol=1048576,parity=1,precision=8,order=2,Ns=4,Nc=3,TwistFlavor=2	608	1	1	216	1	1	0	-1	-1	-1	-1	0.000418133	# 361.12 Gflop/s, 1444.47 GB/s, tuning took 2.762428 seconds at Fri Jul 29 15:11:52 2022
   32x64x16x16x2	N4quda4blas18tripleCGReduction_IdfEE	GPU-offline,nParity=1,vol=1048576,parity=1,precision=2,order=8,Ns=4,Nc=3,TwistFlavor=2	640	1	1	192	1	1	0	-1	-1	-1	-1	0.00012992	# 1162.21 Gflop/s, 1259.07 GB/s, tuning took 1.164362 seconds at Mon Jul 11 18:24:53 2022
   32x64x16x16x2	N4quda4blas18tripleCGReduction_IdfEE	GPU-offline,nParity=1,vol=1048576,parity=1,precision=4,order=4,Ns=4,Nc=3,TwistFlavor=2	768	1	1	216	1	1	0	-1	-1	-1	-1	0.000218112	# 692.28 Gflop/s, 1384.56 GB/s, tuning took 1.553196 seconds at Fri Jul 29 15:16:21 2022
   32x64x16x16x2	N4quda4blas23HeavyQuarkResidualNorm_IddEE	GPU-offline,nParity=1,vol=1048576,parity=1,precision=8,order=2,Ns=4,Nc=3,TwistFlavor=2	640	1	1	192	1	1	0	-1	-1	-1	-1	0.000285184	# 352.98 Gflop/s, 1411.91 GB/s, tuning took 1.813860 seconds at Mon Jul 11 18:24:56 2022
   32x64x16x16x2	N4quda4blas4CdotIddEE	GPU-offline,nParity=1,vol=1048576,parity=1,precision=8,order=2,Ns=4,Nc=3,TwistFlavor=2	992	1	1	210	1	1	0	-1	-1	-1	-1	0.00028544	# 352.66 Gflop/s, 1410.64 GB/s, tuning took 2.326158 seconds at Fri Jul 29 13:30:48 2022
   32x64x16x16x2	N4quda4blas4CdotIdfEE	GPU-offline,nParity=1,vol=1048576,parity=1,precision=2,order=8,Ns=4,Nc=3,TwistFlavor=2	640	1	1	192	1	1	0	-1	-1	-1	-1	9.23462e-05	# 1090.06 Gflop/s, 1180.90 GB/s, tuning took 0.775233 seconds at Mon Jul 11 18:24:25 2022
   32x64x16x16x2	N4quda4blas4CdotIdfEE	GPU-offline,nParity=1,vol=1048576,parity=1,precision=4,order=4,Ns=4,Nc=3,TwistFlavor=2	768	1	1	216	1	1	0	-1	-1	-1	-1	0.000150821	# 667.44 Gflop/s, 1334.87 GB/s, tuning took 1.321790 seconds at Mon Jul 11 18:24:24 2022
   32x64x16x16x2	N4quda4blas5Norm2IddEE	GPU-offline,nParity=1,vol=1048576,parity=1,precision=8,order=2,Ns=4,Nc=3,TwistFlavor=2	1024	1	1	192	1	1	0	-1	-1	-1	-1	0.000151845	# 331.47 Gflop/s, 1325.87 GB/s, tuning took 1.893952 seconds at Mon Jul 11 18:22:59 2022
   32x64x16x16x2	N4quda4blas6caxpy_IdEE	GPU-offline,vol=1048576,parity=1,precision=8,order=2,Ns=4,Nc=3,TwistFlavor=2	352	1	1	216	1	1	0	-1	-1	-1	-1	0.000448171	# 224.61 Gflop/s, 1347.66 GB/s, tuning took 0.065259 seconds at Fri Jul 29 13:30:48 2022
   32x64x16x16x2	N4quda4blas6caxpy_IfEE	GPU-offline,vol=1048576,parity=1,precision=2,order=8,Ns=4,Nc=3,TwistFlavor=2	160	1	1	216	1	1	0	-1	-1	-1	-1	0.000128256	# 784.86 Gflop/s, 1275.40 GB/s, tuning took 0.025057 seconds at Mon Jul 11 18:24:25 2022
   32x64x16x16x2	N4quda4blas6caxpy_IfEE	GPU-offline,vol=1048576,parity=1,precision=4,order=4,Ns=4,Nc=3,TwistFlavor=2	352	1	1	216	1	1	0	-1	-1	-1	-1	0.000227123	# 443.21 Gflop/s, 1329.63 GB/s, tuning took 0.037986 seconds at Mon Jul 11 18:24:24 2022
   32x64x16x16x2	N4quda4blas7axpbyz_IdEE	GPU-offline,vol=1048576,parity=1,precision=4,order=4,Ns=4,Nc=3,TwistFlavor=2,vol=1048576,parity=1,precision=8,order=2,Ns=4,Nc=3,TwistFlavor=2	640	1	1	216	1	1	0	-1	-1	-1	-1	0.000373419	# 202.18 Gflop/s, 1347.86 GB/s, tuning took 0.047330 seconds at Mon Jul 11 18:23:36 2022
   32x64x16x16x2	N4quda4blas7axpbyz_IdEE	GPU-offline,vol=1048576,parity=1,precision=8,order=2,Ns=4,Nc=3,TwistFlavor=2	352	1	1	216	1	1	0	-1	-1	-1	-1	0.000447829	# 168.59 Gflop/s, 1348.68 GB/s, tuning took 0.065268 seconds at Mon Jul 11 18:24:20 2022
   32x64x16x16x2	N4quda4blas7axpbyz_IfEE	GPU-offline,vol=1048576,parity=1,precision=2,order=8,Ns=4,Nc=3,TwistFlavor=2	192	1	1	216	1	1	0	-1	-1	-1	-1	0.000128	# 589.82 Gflop/s, 1277.95 GB/s, tuning took 0.025070 seconds at Mon Jul 11 18:24:25 2022
   32x64x16x16x2	N4quda4blas7axpbyz_IfEE	GPU-offline,vol=1048576,parity=1,precision=4,order=4,Ns=4,Nc=3,TwistFlavor=2	352	1	1	216	1	1	0	-1	-1	-1	-1	0.000226714	# 333.01 Gflop/s, 1332.03 GB/s, tuning took 0.038025 seconds at Mon Jul 11 18:24:24 2022
   32x64x16x16x2	N4quda4blas9AxpyReDotIddEE	GPU-offline,nParity=1,vol=1048576,parity=1,precision=8,order=2,Ns=4,Nc=3,TwistFlavor=2	928	1	1	96	1	1	0	-1	-1	-1	-1	0.000456363	# 220.58 Gflop/s, 1323.46 GB/s, tuning took 2.955667 seconds at Fri Jul 29 13:30:35 2022
   32x64x16x16x2	N4quda4blas9AxpyReDotIdfEE	GPU-offline,nParity=1,vol=1048576,parity=1,precision=4,order=4,Ns=4,Nc=3,TwistFlavor=2	928	1	1	96	1	1	0	-1	-1	-1	-1	0.000235315	# 427.78 Gflop/s, 1283.34 GB/s, tuning took 1.571456 seconds at Mon Jul 11 18:23:34 2022
   32x64x16x16x2	N4quda4blas9axpyZpbx_IdEE	GPU-offline,vol=1048576,parity=1,precision=2,order=8,Ns=4,Nc=3,TwistFlavor=2,vol=1048576,parity=1,precision=8,order=2,Ns=4,Nc=3,TwistFlavor=2	192	1	1	216	1	1	0	-1	-1	-1	-1	0.000430421	# 233.87 Gflop/s, 1315.53 GB/s, tuning took 0.033935 seconds at Mon Jul 11 18:24:54 2022
   32x64x16x16x2	N4quda4blas9axpyZpbx_IdEE	GPU-offline,vol=1048576,parity=1,precision=4,order=4,Ns=4,Nc=3,TwistFlavor=2,vol=1048576,parity=1,precision=8,order=2,Ns=4,Nc=3,TwistFlavor=2	256	1	1	216	1	1	0	-1	-1	-1	-1	0.000522923	# 192.50 Gflop/s, 1347.51 GB/s, tuning took 0.047101 seconds at Mon Jul 11 18:23:36 2022
   32x64x16x16x2	N4quda4blas9axpyZpbx_IdEE	GPU-offline,vol=1048576,parity=1,precision=8,order=2,Ns=4,Nc=3,TwistFlavor=2	896	1	1	216	1	1	0	-1	-1	-1	-1	0.000745472	# 135.03 Gflop/s, 1350.33 GB/s, tuning took 0.105218 seconds at Fri Jul 29 13:30:38 2022
         4718592	N4quda15TransformReduceINS_7maximumIfEENS_7complexIfEEjNS_8abs_max_IffEENS_8identityEEE	GPU-offline,batch_size=2	1024	1	1	96	1	2	0	-1	-1	-1	-1	6.5152e-05	# 0.00 Gflop/s, 1158.79 GB/s, tuning took 0.319191 seconds at Mon Jul 11 18:31:40 2022
         4718592	N4quda15TransformReduceINS_7maximumIfEENS_7complexIiEEjNS_8abs_max_IfiEENS_8identityEEE	GPU-offline,batch_size=2	512	1	1	216	1	2	0	-1	-1	-1	-1	6.5408e-05	# 0.00 Gflop/s, 1154.25 GB/s, tuning took 0.355942 seconds at Mon Jul 11 18:29:20 2022
         4x4x2x2	N4quda10CalculateYILb1EL19QudaFieldLocation_s2ENS_13CalculateYArgILb1EfLi2ELi2ELi24ELi32ENS_5gauge10FieldOrderIfLi64ELi2EL21QudaGaugeFieldOrder_s13ELb1EsEENS4_IfLi64ELi2ELS5_13ELb1EiEENS4_IfLi48ELi2ELS5_13ELb1EsEENS_11colorspinor12FieldOrderCBIfLi2ELi24ELi32EL16QudaFieldOrder_s9EssLb0ELb0EEENSA_IfLi4ELi24ELi32ELSB_9EssLb0ELb0EEESC_S8_EEEE	GPU-offline,vol=4096,parity=2,precision=2,order=9,Ns=2,Nc=768,TwistFlavor=1,comm=0011,computeCoarseDiagonal,GPU-device	32	1	1	1	2	32	2049	1	0	0	0	3.32957e-06	# 1.23 Gflop/s, 9.84 GB/s, tuning took 0.028316 seconds at Mon Jul 11 18:32:48 2022
         4x4x2x2	N4quda10CalculateYILb1EL19QudaFieldLocation_s2ENS_13CalculateYArgILb1EfLi2ELi2ELi24ELi32ENS_5gauge10FieldOrderIfLi64ELi2EL21QudaGaugeFieldOrder_s13ELb1EsEENS4_IfLi64ELi2ELS5_13ELb1EiEENS4_IfLi48ELi2ELS5_13ELb1EsEENS_11colorspinor12FieldOrderCBIfLi2ELi24ELi32EL16QudaFieldOrder_s9EssLb0ELb0EEENSA_IfLi4ELi24ELi32ELSB_9EssLb0ELb0EEESC_S8_EEEE	GPU-offline,vol=4096,parity=2,precision=2,order=9,Ns=2,Nc=768,TwistFlavor=1,comm=0011,computeCoarseTmDiagonal,GPU-device	64	1	1	1	2	32	4916	1	0	0	0	3.41124e-06	# 1.20 Gflop/s, 9.61 GB/s, tuning took 0.028727 seconds at Mon Jul 11 18:32:48 2022
         4x4x2x2	N4quda10CalculateYILb1EL19QudaFieldLocation_s2ENS_13CalculateYArgILb1EfLi2ELi2ELi24ELi32ENS_5gauge10FieldOrderIfLi64ELi2EL21QudaGaugeFieldOrder_s13ELb1EsEENS4_IfLi64ELi2ELS5_13ELb1EiEENS4_IfLi48ELi2ELS5_13ELb1EsEENS_11colorspinor12FieldOrderCBIfLi2ELi24ELi32EL16QudaFieldOrder_s9EssLb0ELb0EEENSA_IfLi4ELi24ELi32ELSB_9EssLb0ELb0EEESC_S8_EEEE	GPU-offline,vol=4096,parity=2,precision=2,order=9,Ns=2,Nc=768,TwistFlavor=1,comm=0011,computeConvert,GPU-device	32	4	1	1	16	32	0	1	0	0	0	1.23501e-05	# 0.33 Gflop/s, 254.71 GB/s, tuning took 0.081534 seconds at Mon Jul 11 18:32:48 2022
         4x4x2x2	N4quda10CalculateYILb1EL19QudaFieldLocation_s2ENS_13CalculateYArgILb1EfLi2ELi2ELi24ELi32ENS_5gauge10FieldOrderIfLi64ELi2EL21QudaGaugeFieldOrder_s13ELb1EsEENS4_IfLi64ELi2ELS5_13ELb1EiEENS4_IfLi48ELi2ELS5_13ELb1EsEENS_11colorspinor12FieldOrderCBIfLi2ELi24ELi32EL16QudaFieldOrder_s9EssLb0ELb0EEENSA_IfLi4ELi24ELi32ELSB_9EssLb0ELb0EEESC_S8_EEEE	GPU-offline,vol=4096,parity=2,precision=2,order=9,Ns=2,Nc=768,TwistFlavor=1,comm=0011,computeRescale,GPU-device	32	12	1	1	6	32	0	1	0	0	0	1.24276e-05	# 0.33 Gflop/s, 168.75 GB/s, tuning took 0.096256 seconds at Mon Jul 11 18:32:48 2022
         4x4x2x2	N4quda12ExtractGhostIsLi64ENS_5gauge10FieldOrderIfLi64ELi1EL21QudaGaugeFieldOrder_s13ELb1EsEEEE	GPU-offline,vol=64stride=64precision=2geometry=8Nc=64fine-grained,extract	32	1	3	1	64	3	3781	-1	-1	-1	-1	1.62251e-05	# 0.00 Gflop/s, 193.88 GB/s, tuning took 0.132749 seconds at Mon Jul 11 18:32:48 2022
         4x4x2x2	N4quda12ExtractGhostIsLi64ENS_5gauge10FieldOrderIfLi64ELi1EL21QudaGaugeFieldOrder_s2ELb0EsEEEE	GPU-offline,vol=64stride=64precision=2geometry=8Nc=64fine-grained,extract	32	2	1	1	32	8	1756	-1	-1	-1	-1	1.91634e-05	# 0.00 Gflop/s, 164.15 GB/s, tuning took 0.147998 seconds at Mon Jul 11 18:32:49 2022
         4x4x2x2	N4quda12ExtractGhostIsLi64ENS_5gauge10FieldOrderIfLi64ELi1EL21QudaGaugeFieldOrder_s2ELb0EsEEEE	GPU-offline,vol=64stride=64precision=2geometry=8Nc=64fine-grained,inject	32	1	1	1	64	8	2341	-1	-1	-1	-1	1.8693e-05	# 0.00 Gflop/s, 168.28 GB/s, tuning took 0.122559 seconds at Mon Jul 11 18:32:49 2022
         4x4x2x2	N4quda13CalculateYhatIL19QudaFieldLocation_s2EfNS_5gauge10FieldOrderIfLi64ELi1EL21QudaGaugeFieldOrder_s13ELb1EsEES5_NS3_IfLi64ELi1ELS4_13ELb1EfEELi64ELi4ELi2ELb0ELb1EEE	GPU-offline,vol=64stride=64precision=2geometry=8Nc=64,GPU-device,comm=0011,mma	8	1	1	4	32	128	0	0	0	0	0	3.456e-05	# 30947.56 Gflop/s, 34952.54 GB/s, tuning took 0.001163 seconds at Mon Jul 11 18:32:48 2022
         4x4x2x2	N4quda13CalculateYhatIL19QudaFieldLocation_s2EfNS_5gauge10FieldOrderIfLi64ELi1EL21QudaGaugeFieldOrder_s13ELb1EsEES5_NS3_IfLi64ELi1ELS4_13ELb1EfEELi64ELi4ELi2ELb1ELb1EEE	GPU-offline,vol=64stride=64precision=2geometry=8Nc=64,GPU-device,comm=0011,mma,compute_max	8	1	1	4	32	128	0	0	0	0	0	3.14709e-05	# 33985.25 Gflop/s, 21324.08 GB/s, tuning took 0.001138 seconds at Mon Jul 11 18:32:48 2022
         4x4x2x2	N4quda7RNGInitE	GPU-offline,vol=64,parity=2,precision=4,order=2,Ns=2,Nc=32,TwistFlavor=1	192	2	1	1	1	1	0	-1	-1	-1	-1	0.000217498	# 0.00 Gflop/s, 0.00 GB/s, tuning took 0.033907 seconds at Mon Jul 11 18:32:49 2022
         4x4x2x2	N4quda9CopyGaugeINS_12CopyGaugeArgIffLi8192ELb1ENS_5gauge10FieldOrderIfLi64ELi1EL21QudaGaugeFieldOrder_s13ELb1EfEENS3_IfLi64ELi1ELS4_13ELb1EsEEEEEE	GPU-offline,vol=64stride=32precision=2geometry=1Nc=64,vol=64stride=32precision=4geometry=1Nc=64,fine-grained	256	1	2	1	64	1	12289	-1	-1	-1	-1	1.31365e-05	# 0.00 Gflop/s, 239.47 GB/s, tuning took 0.091985 seconds at Mon Jul 11 18:32:48 2022
         4x4x2x2	N4quda9CopyGaugeINS_12CopyGaugeArgIffLi8192ELb1ENS_5gauge10FieldOrderIfLi64ELi1EL21QudaGaugeFieldOrder_s2ELb0EsEENS3_IfLi64ELi1ELS4_2ELb1EsEEEEEE	GPU-offline,vol=64stride=64precision=2geometry=8Nc=64,vol=64stride=64precision=2geometry=8Nc=64,fine-grained,ghost	32	2	1	1	32	8	2235	-1	-1	-1	-1	1.87131e-05	# 0.00 Gflop/s, 672.41 GB/s, tuning took 0.145083 seconds at Mon Jul 11 18:32:49 2022
         4x4x2x2	N4quda9CopyGaugeINS_12CopyGaugeArgIffLi8192ELb1ENS_5gauge10FieldOrderIfLi64ELi1EL21QudaGaugeFieldOrder_s2ELb1EsEENS3_IfLi64ELi1ELS4_13ELb1EfEEEEEE	GPU-offline,vol=64stride=32precision=4geometry=1Nc=64,vol=64stride=32precision=2geometry=1Nc=64,fine-grained	32	1	1	1	64	2	1695	-1	-1	-1	-1	1.26387e-05	# 0.00 Gflop/s, 248.90 GB/s, tuning took 0.070087 seconds at Mon Jul 11 18:32:48 2022
         4x4x2x2	N4quda9CopyGaugeINS_12CopyGaugeArgIffLi8192ELb1ENS_5gauge10FieldOrderIfLi64ELi1EL21QudaGaugeFieldOrder_s2ELb1EsEENS3_IfLi64ELi1ELS4_13ELb1EsEEEEEE	GPU-offline,vol=64stride=32precision=2geometry=1Nc=64,vol=64stride=32precision=2geometry=1Nc=64,fine-grained	32	1	1	1	64	2	2138	-1	-1	-1	-1	1.28585e-05	# 0.00 Gflop/s, 163.09 GB/s, tuning took 0.069617 seconds at Mon Jul 11 18:32:48 2022
         4x4x2x2	N4quda9CopyGaugeINS_12CopyGaugeArgIffLi8192ELb1ENS_5gauge10FieldOrderIfLi64ELi1EL21QudaGaugeFieldOrder_s2ELb1EsEENS3_IfLi64ELi1ELS4_13ELb1EsEEEEEE	GPU-offline,vol=64stride=64precision=2geometry=8Nc=64,vol=64stride=64precision=2geometry=8Nc=64,fine-grained	128	1	1	1	64	16	0	-1	-1	-1	-1	2.0569e-05	# 0.00 Gflop/s, 1631.31 GB/s, tuning took 0.187532 seconds at Mon Jul 11 18:32:49 2022
         4x4x2x2	N4quda9CopyGaugeINS_12CopyGaugeArgIffLi8192ELb1ENS_5gauge10FieldOrderIfLi64ELi1EL21QudaGaugeFieldOrder_s2ELb1EsEENS3_IfLi64ELi1ELS4_13ELb1EsEEEEEE	GPU-offline,vol=64stride=64precision=2geometry=8Nc=64,vol=64stride=64precision=2geometry=8Nc=64,fine-grained,ghost	32	2	1	1	32	8	2049	-1	-1	-1	-1	1.24283e-05	# 0.00 Gflop/s, 1012.44 GB/s, tuning took 0.105797 seconds at Mon Jul 11 18:32:49 2022
         4x4x2x2	N4quda9CopyGaugeINS_12CopyGaugeArgIffLi8192ELb1ENS_5gauge10FieldOrderIfLi64ELi1EL21QudaGaugeFieldOrder_s2ELb1EsEENS3_IfLi64ELi1ELS4_2ELb0EsEEEEEE	GPU-offline,vol=64stride=64precision=2geometry=8Nc=64,vol=64stride=64precision=2geometry=8Nc=64,fine-grained,ghost	64	1	1	1	64	8	1821	-1	-1	-1	-1	1.91634e-05	# 0.00 Gflop/s, 656.61 GB/s, tuning took 0.146465 seconds at Mon Jul 11 18:32:49 2022
4x4x2x2,8x16x4x4	N4quda16ProlongateLaunchIfsLi2ELi24ELi2ELi32EEE	GPU-offline,vol=64,parity=2,precision=4,order=2,Ns=2,Nc=32,TwistFlavor=1,vol=2048,parity=1,precision=4,order=2,Ns=2,Nc=24,TwistFlavor=1	32	1	3	64	1	8	0	-1	-1	-1	-1	1.00232e-05	# 2510.77 Gflop/s, 1338.75 GB/s, tuning took 0.042569 seconds at Mon Jul 11 18:33:04 2022
     64x64x16x16	N4quda10BlockOrthoIssLi4ELi2ELi3ELi2ELi24EEE	GPU-offline,vol=1048576,parity=2,precision=2,order=2,Ns=4,Nc=72,TwistFlavor=1,block_size=4x4x4x4,n_block_ortho=1,mVec=4	256	1	1	4096	1	2	0	1	-1	-1	-1	0.0162632	# 3528.10 Gflop/s, 1012.14 GB/s, tuning took 1.165335 seconds at Mon Jul 11 18:28:11 2022
     64x64x16x16	N4quda10CalculateYILb0EL19QudaFieldLocation_s2ENS_13CalculateYArgILb0EfLi4ELi2ELi3ELi24ENS_5gauge10FieldOrderIfLi48ELi2EL21QudaGaugeFieldOrder_s2ELb1EsEENS4_IfLi48ELi2ELS5_2ELb1EiEENS4_IfLi3ELi1ELS5_2ELb1EfEENS_11colorspinor12FieldOrderCBIfLi4ELi3ELi24EL16QudaFieldOrder_s2EssLb0ELb0EEESC_SC_NS_6clover10FieldOrderIfLi3ELi4EL22QudaCloverFieldOrder_s4EEEEEEE	GPU-offline,vol=1048576,parity=2,precision=2,order=2,Ns=4,Nc=72,TwistFlavor=1,comm=0011,computeTmcAV,Dynamic,GPU-device	32	1	4	16384	4	6	0	1	0	0	0	0.00680004	# 4263.36 Gflop/s, 1006.63 GB/s, tuning took 19.627540 seconds at Mon Jul 11 18:29:00 2022
     64x64x16x16	N4quda10CalculateYILb0EL19QudaFieldLocation_s2ENS_13CalculateYArgILb0EfLi4ELi2ELi3ELi24ENS_5gauge10FieldOrderIfLi48ELi2EL21QudaGaugeFieldOrder_s2ELb1EsEENS4_IfLi48ELi2ELS5_2ELb1EiEENS4_IfLi3ELi1ELS5_2ELb1EfEENS_11colorspinor12FieldOrderCBIfLi4ELi3ELi24EL16QudaFieldOrder_s2EssLb0ELb0EEESC_SC_NS_6clover10FieldOrderIfLi3ELi4EL22QudaCloverFieldOrder_s4EEEEEEE	GPU-offline,vol=1048576,parity=2,precision=2,order=2,Ns=4,Nc=72,TwistFlavor=1,comm=0011,computeTmcAV,compute_max,Dynamic,GPU-device	32	4	1	16384	1	24	0	1	0	0	0	0.00634027	# 4572.53 Gflop/s, 1270.15 GB/s, tuning took 18.692447 seconds at Mon Jul 11 18:28:40 2022
     64x64x16x16	N4quda10CalculateYILb0EL19QudaFieldLocation_s2ENS_13CalculateYArgILb0EfLi4ELi2ELi3ELi24ENS_5gauge10FieldOrderIfLi48ELi2EL21QudaGaugeFieldOrder_s2ELb1EsEENS4_IfLi48ELi2ELS5_2ELb1EiEENS4_IfLi3ELi1ELS5_2ELb1EfEENS_11colorspinor12FieldOrderCBIfLi4ELi3ELi24EL16QudaFieldOrder_s2EssLb0ELb0EEESC_SC_NS_6clover10FieldOrderIfLi3ELi4EL22QudaCloverFieldOrder_s4EEEEEEE	GPU-offline,vol=1048576,parity=2,precision=2,order=2,Ns=4,Nc=72,TwistFlavor=1,comm=0011,computeUV,compute_max,tile_size=3x2x1,dim=0,dir=back,nFace=1,GPU-device	32	1	6	16384	2	2	0	1	1	1	1	0.00102741	# 7054.37 Gflop/s, 4115.05 GB/s, tuning took 2.912669 seconds at Mon Jul 11 18:30:22 2022
     64x64x16x16	N4quda10CalculateYILb0EL19QudaFieldLocation_s2ENS_13CalculateYArgILb0EfLi4ELi2ELi3ELi24ENS_5gauge10FieldOrderIfLi48ELi2EL21QudaGaugeFieldOrder_s2ELb1EsEENS4_IfLi48ELi2ELS5_2ELb1EiEENS4_IfLi3ELi1ELS5_2ELb1EfEENS_11colorspinor12FieldOrderCBIfLi4ELi3ELi24EL16QudaFieldOrder_s2EssLb0ELb0EEESC_SC_NS_6clover10FieldOrderIfLi3ELi4EL22QudaCloverFieldOrder_s4EEEEEEE	GPU-offline,vol=1048576,parity=2,precision=2,order=2,Ns=4,Nc=72,TwistFlavor=1,comm=0011,computeUV,compute_max,tile_size=3x2x1,dim=0,dir=fwd,nFace=1,GPU-device	64	1	12	8192	2	1	0	1	0	0	0	0.00103151	# 7026.36 Gflop/s, 4098.71 GB/s, tuning took 2.902947 seconds at Mon Jul 11 18:29:03 2022
     64x64x16x16	N4quda10CalculateYILb0EL19QudaFieldLocation_s2ENS_13CalculateYArgILb0EfLi4ELi2ELi3ELi24ENS_5gauge10FieldOrderIfLi48ELi2EL21QudaGaugeFieldOrder_s2ELb1EsEENS4_IfLi48ELi2ELS5_2ELb1EiEENS4_IfLi3ELi1ELS5_2ELb1EfEENS_11colorspinor12FieldOrderCBIfLi4ELi3ELi24EL16QudaFieldOrder_s2EssLb0ELb0EEESC_SC_NS_6clover10FieldOrderIfLi3ELi4EL22QudaCloverFieldOrder_s4EEEEEEE	GPU-offline,vol=1048576,parity=2,precision=2,order=2,Ns=4,Nc=72,TwistFlavor=1,comm=0011,computeUV,compute_max,tile_size=3x2x1,dim=1,dir=back,nFace=1,GPU-device	32	1	6	16384	2	2	0	1	1	1	1	0.00103014	# 7035.67 Gflop/s, 4104.14 GB/s, tuning took 2.911323 seconds at Mon Jul 11 18:30:42 2022
     64x64x16x16	N4quda10CalculateYILb0EL19QudaFieldLocation_s2ENS_13CalculateYArgILb0EfLi4ELi2ELi3ELi24ENS_5gauge10FieldOrderIfLi48ELi2EL21QudaGaugeFieldOrder_s2ELb1EsEENS4_IfLi48ELi2ELS5_2ELb1EiEENS4_IfLi3ELi1ELS5_2ELb1EfEENS_11colorspinor12FieldOrderCBIfLi4ELi3ELi24EL16QudaFieldOrder_s2EssLb0ELb0EEESC_SC_NS_6clover10FieldOrderIfLi3ELi4EL22QudaCloverFieldOrder_s4EEEEEEE	GPU-offline,vol=1048576,parity=2,precision=2,order=2,Ns=4,Nc=72,TwistFlavor=1,comm=0011,computeUV,compute_max,tile_size=3x2x1,dim=1,dir=fwd,nFace=1,GPU-device	32	2	12	16384	1	1	0	1	1	1	1	0.00104004	# 6968.71 Gflop/s, 4065.08 GB/s, tuning took 2.902515 seconds at Mon Jul 11 18:29:23 2022
     64x64x16x16	N4quda10CalculateYILb0EL19QudaFieldLocation_s2ENS_13CalculateYArgILb0EfLi4ELi2ELi3ELi24ENS_5gauge10FieldOrderIfLi48ELi2EL21QudaGaugeFieldOrder_s2ELb1EsEENS4_IfLi48ELi2ELS5_2ELb1EiEENS4_IfLi3ELi1ELS5_2ELb1EfEENS_11colorspinor12FieldOrderCBIfLi4ELi3ELi24EL16QudaFieldOrder_s2EssLb0ELb0EEESC_SC_NS_6clover10FieldOrderIfLi3ELi4EL22QudaCloverFieldOrder_s4EEEEEEE	GPU-offline,vol=1048576,parity=2,precision=2,order=2,Ns=4,Nc=72,TwistFlavor=1,comm=0011,computeUV,compute_max,tile_size=3x2x1,dim=2,dir=back,nFace=1,GPU-device	32	1	6	16384	2	2	0	1	1	1	1	0.00100966	# 7178.39 Gflop/s, 4187.39 GB/s, tuning took 2.847031 seconds at Mon Jul 11 18:31:02 2022
     64x64x16x16	N4quda10CalculateYILb0EL19QudaFieldLocation_s2ENS_13CalculateYArgILb0EfLi4ELi2ELi3ELi24ENS_5gauge10FieldOrderIfLi48ELi2EL21QudaGaugeFieldOrder_s2ELb1EsEENS4_IfLi48ELi2ELS5_2ELb1EiEENS4_IfLi3ELi1ELS5_2ELb1EfEENS_11colorspinor12FieldOrderCBIfLi4ELi3ELi24EL16QudaFieldOrder_s2EssLb0ELb0EEESC_SC_NS_6clover10FieldOrderIfLi3ELi4EL22QudaCloverFieldOrder_s4EEEEEEE	GPU-offline,vol=1048576,parity=2,precision=2,order=2,Ns=4,Nc=72,TwistFlavor=1,comm=0011,computeUV,compute_max,tile_size=3x2x1,dim=2,dir=fwd,nFace=1,GPU-device	32	1	6	16384	2	2	0	1	1	1	1	0.00101956	# 7108.69 Gflop/s, 4146.74 GB/s, tuning took 2.843961 seconds at Mon Jul 11 18:29:43 2022
     64x64x16x16	N4quda10CalculateYILb0EL19QudaFieldLocation_s2ENS_13CalculateYArgILb0EfLi4ELi2ELi3ELi24ENS_5gauge10FieldOrderIfLi48ELi2EL21QudaGaugeFieldOrder_s2ELb1EsEENS4_IfLi48ELi2ELS5_2ELb1EiEENS4_IfLi3ELi1ELS5_2ELb1EfEENS_11colorspinor12FieldOrderCBIfLi4ELi3ELi24EL16QudaFieldOrder_s2EssLb0ELb0EEESC_SC_NS_6clover10FieldOrderIfLi3ELi4EL22QudaCloverFieldOrder_s4EEEEEEE	GPU-offline,vol=1048576,parity=2,precision=2,order=2,Ns=4,Nc=72,TwistFlavor=1,comm=0011,computeUV,compute_max,tile_size=3x2x1,dim=3,dir=back,nFace=1,GPU-device	32	1	6	16384	2	2	0	1	1	1	1	0.00102298	# 7084.97 Gflop/s, 4132.90 GB/s, tuning took 2.863660 seconds at Mon Jul 11 18:31:21 2022
     64x64x16x16	N4quda10CalculateYILb0EL19QudaFieldLocation_s2ENS_13CalculateYArgILb0EfLi4ELi2ELi3ELi24ENS_5gauge10FieldOrderIfLi48ELi2EL21QudaGaugeFieldOrder_s2ELb1EsEENS4_IfLi48ELi2ELS5_2ELb1EiEENS4_IfLi3ELi1ELS5_2ELb1EfEENS_11colorspinor12FieldOrderCBIfLi4ELi3ELi24EL16QudaFieldOrder_s2EssLb0ELb0EEESC_SC_NS_6clover10FieldOrderIfLi3ELi4EL22QudaCloverFieldOrder_s4EEEEEEE	GPU-offline,vol=1048576,parity=2,precision=2,order=2,Ns=4,Nc=72,TwistFlavor=1,comm=0011,computeUV,compute_max,tile_size=3x2x1,dim=3,dir=fwd,nFace=1,GPU-device	32	1	6	16384	2	2	0	1	1	1	1	0.00102537	# 7068.46 Gflop/s, 4123.27 GB/s, tuning took 2.859971 seconds at Mon Jul 11 18:30:03 2022
     64x64x16x16	N4quda10CalculateYILb0EL19QudaFieldLocation_s2ENS_13CalculateYArgILb0EfLi4ELi2ELi3ELi24ENS_5gauge10FieldOrderIfLi48ELi2EL21QudaGaugeFieldOrder_s2ELb1EsEENS4_IfLi48ELi2ELS5_2ELb1EiEENS4_IfLi3ELi1ELS5_2ELb1EfEENS_11colorspinor12FieldOrderCBIfLi4ELi3ELi24EL16QudaFieldOrder_s2EssLb0ELb0EEESC_SC_NS_6clover10FieldOrderIfLi3ELi4EL22QudaCloverFieldOrder_s4EEEEEEE	GPU-offline,vol=1048576,parity=2,precision=2,order=2,Ns=4,Nc=72,TwistFlavor=1,comm=0011,computeUV,tile_size=3x2x1,dim=0,dir=back,nFace=1,GPU-device	32	1	6	16384	2	2	0	1	1	1	1	0.00191454	# 3785.64 Gflop/s, 1577.35 GB/s, tuning took 3.733602 seconds at Mon Jul 11 18:30:26 2022
     64x64x16x16	N4quda10CalculateYILb0EL19QudaFieldLocation_s2ENS_13CalculateYArgILb0EfLi4ELi2ELi3ELi24ENS_5gauge10FieldOrderIfLi48ELi2EL21QudaGaugeFieldOrder_s2ELb1EsEENS4_IfLi48ELi2ELS5_2ELb1EiEENS4_IfLi3ELi1ELS5_2ELb1EfEENS_11colorspinor12FieldOrderCBIfLi4ELi3ELi24EL16QudaFieldOrder_s2EssLb0ELb0EEESC_SC_NS_6clover10FieldOrderIfLi3ELi4EL22QudaCloverFieldOrder_s4EEEEEEE	GPU-offline,vol=1048576,parity=2,precision=2,order=2,Ns=4,Nc=72,TwistFlavor=1,comm=0011,computeUV,tile_size=3x2x1,dim=0,dir=fwd,nFace=1,GPU-device	32	1	6	16384	2	2	0	1	0	0	0	0.00196062	# 3696.67 Gflop/s, 1540.28 GB/s, tuning took 3.865783 seconds at Mon Jul 11 18:29:06 2022
     64x64x16x16	N4quda10CalculateYILb0EL19QudaFieldLocation_s2ENS_13CalculateYArgILb0EfLi4ELi2ELi3ELi24ENS_5gauge10FieldOrderIfLi48ELi2EL21QudaGaugeFieldOrder_s2ELb1EsEENS4_IfLi48ELi2ELS5_2ELb1EiEENS4_IfLi3ELi1ELS5_2ELb1EfEENS_11colorspinor12FieldOrderCBIfLi4ELi3ELi24EL16QudaFieldOrder_s2EssLb0ELb0EEESC_SC_NS_6clover10FieldOrderIfLi3ELi4EL22QudaCloverFieldOrder_s4EEEEEEE	GPU-offline,vol=1048576,parity=2,precision=2,order=2,Ns=4,Nc=72,TwistFlavor=1,comm=0011,computeUV,tile_size=3x2x1,dim=1,dir=back,nFace=1,GPU-device	32	1	6	16384	2	2	0	1	1	1	1	0.00191249	# 3789.70 Gflop/s, 1579.04 GB/s, tuning took 3.744630 seconds at Mon Jul 11 18:30:46 2022
     64x64x16x16	N4quda10CalculateYILb0EL19QudaFieldLocation_s2ENS_13CalculateYArgILb0EfLi4ELi2ELi3ELi24ENS_5gauge10FieldOrderIfLi48ELi2EL21QudaGaugeFieldOrder_s2ELb1EsEENS4_IfLi48ELi2ELS5_2ELb1EiEENS4_IfLi3ELi1ELS5_2ELb1EfEENS_11colorspinor12FieldOrderCBIfLi4ELi3ELi24EL16QudaFieldOrder_s2EssLb0ELb0EEESC_SC_NS_6clover10FieldOrderIfLi3ELi4EL22QudaCloverFieldOrder_s4EEEEEEE	GPU-offline,vol=1048576,parity=2,precision=2,order=2,Ns=4,Nc=72,TwistFlavor=1,comm=0011,computeUV,tile_size=3x2x1,dim=1,dir=fwd,nFace=1,GPU-device	32	1	4	16384	2	3	0	1	1	1	1	0.00196574	# 3687.04 Gflop/s, 1536.27 GB/s, tuning took 3.881756 seconds at Mon Jul 11 18:29:27 2022
     64x64x16x16	N4quda10CalculateYILb0EL19QudaFieldLocation_s2ENS_13CalculateYArgILb0EfLi4ELi2ELi3ELi24ENS_5gauge10FieldOrderIfLi48ELi2EL21QudaGaugeFieldOrder_s2ELb1EsEENS4_IfLi48ELi2ELS5_2ELb1EiEENS4_IfLi3ELi1ELS5_2ELb1EfEENS_11colorspinor12FieldOrderCBIfLi4ELi3ELi24EL16QudaFieldOrder_s2EssLb0ELb0EEESC_SC_NS_6clover10FieldOrderIfLi3ELi4EL22QudaCloverFieldOrder_s4EEEEEEE	GPU-offline,vol=1048576,parity=2,precision=2,order=2,Ns=4,Nc=72,TwistFlavor=1,comm=0011,computeUV,tile_size=3x2x1,dim=2,dir=back,nFace=1,GPU-device	32	1	6	16384	2	2	0	1	1	1	1	0.00191625	# 3782.27 Gflop/s, 1575.95 GB/s, tuning took 3.707116 seconds at Mon Jul 11 18:31:06 2022
     64x64x16x16	N4quda10CalculateYILb0EL19QudaFieldLocation_s2ENS_13CalculateYArgILb0EfLi4ELi2ELi3ELi24ENS_5gauge10FieldOrderIfLi48ELi2EL21QudaGaugeFieldOrder_s2ELb1EsEENS4_IfLi48ELi2ELS5_2ELb1EiEENS4_IfLi3ELi1ELS5_2ELb1EfEENS_11colorspinor12FieldOrderCBIfLi4ELi3ELi24EL16QudaFieldOrder_s2EssLb0ELb0EEESC_SC_NS_6clover10FieldOrderIfLi3ELi4EL22QudaCloverFieldOrder_s4EEEEEEE	GPU-offline,vol=1048576,parity=2,precision=2,order=2,Ns=4,Nc=72,TwistFlavor=1,comm=0011,computeUV,tile_size=3x2x1,dim=2,dir=fwd,nFace=1,GPU-device	32	1	6	16384	2	2	0	1	1	1	1	0.00195755	# 3702.47 Gflop/s, 1542.70 GB/s, tuning took 3.831175 seconds at Mon Jul 11 18:29:47 2022
     64x64x16x16	N4quda10CalculateYILb0EL19QudaFieldLocation_s2ENS_13CalculateYArgILb0EfLi4ELi2ELi3ELi24ENS_5gauge10FieldOrderIfLi48ELi2EL21QudaGaugeFieldOrder_s2ELb1EsEENS4_IfLi48ELi2ELS5_2ELb1EiEENS4_IfLi3ELi1ELS5_2ELb1EfEENS_11colorspinor12FieldOrderCBIfLi4ELi3ELi24EL16QudaFieldOrder_s2EssLb0ELb0EEESC_SC_NS_6clover10FieldOrderIfLi3ELi4EL22QudaCloverFieldOrder_s4EEEEEEE	GPU-offline,vol=1048576,parity=2,precision=2,order=2,Ns=4,Nc=72,TwistFlavor=1,comm=0011,computeUV,tile_size=3x2x1,dim=3,dir=back,nFace=1,GPU-device	32	1	6	16384	2	2	0	1	1	1	1	0.00191898	# 3776.89 Gflop/s, 1573.70 GB/s, tuning took 3.711394 seconds at Mon Jul 11 18:31:25 2022
     64x64x16x16	N4quda10CalculateYILb0EL19QudaFieldLocation_s2ENS_13CalculateYArgILb0EfLi4ELi2ELi3ELi24ENS_5gauge10FieldOrderIfLi48ELi2EL21QudaGaugeFieldOrder_s2ELb1EsEENS4_IfLi48ELi2ELS5_2ELb1EiEENS4_IfLi3ELi1ELS5_2ELb1EfEENS_11colorspinor12FieldOrderCBIfLi4ELi3ELi24EL16QudaFieldOrder_s2EssLb0ELb0EEESC_SC_NS_6clover10FieldOrderIfLi3ELi4EL22QudaCloverFieldOrder_s4EEEEEEE	GPU-offline,vol=1048576,parity=2,precision=2,order=2,Ns=4,Nc=72,TwistFlavor=1,comm=0011,computeUV,tile_size=3x2x1,dim=3,dir=fwd,nFace=1,GPU-device	32	1	6	16384	2	2	0	1	1	1	1	0.00196062	# 3696.67 Gflop/s, 1540.28 GB/s, tuning took 3.833178 seconds at Mon Jul 11 18:30:07 2022
     64x64x16x16	N4quda10CalculateYILb0EL19QudaFieldLocation_s2ENS_13CalculateYArgILb0EfLi4ELi2ELi3ELi24ENS_5gauge10FieldOrderIfLi48ELi2EL21QudaGaugeFieldOrder_s2ELb1EsEENS4_IfLi48ELi2ELS5_2ELb1EiEENS4_IfLi3ELi1ELS5_2ELb1EfEENS_11colorspinor12FieldOrderCBIfLi4ELi3ELi24EL16QudaFieldOrder_s2EssLb0ELb0EEESC_SC_NS_6clover10FieldOrderIfLi3ELi4EL22QudaCloverFieldOrder_s4EEEEEEE	GPU-offline,vol=1048576,parity=2,precision=2,order=2,Ns=4,Nc=72,TwistFlavor=1,comm=0011,computeVUV,tile_size=4x2x1,dim=0,dir=back,nFace=1,bidirectional,GPU-device,coarse_vol=16x16x4x4	128	1	1	4096	2	4	16384	4	1	1	0	0.0284474	# 4076.44 Gflop/s, 2048.84 GB/s, tuning took 13.136487 seconds at Mon Jul 11 18:30:39 2022
     64x64x16x16	N4quda10CalculateYILb0EL19QudaFieldLocation_s2ENS_13CalculateYArgILb0EfLi4ELi2ELi3ELi24ENS_5gauge10FieldOrderIfLi48ELi2EL21QudaGaugeFieldOrder_s2ELb1EsEENS4_IfLi48ELi2ELS5_2ELb1EiEENS4_IfLi3ELi1ELS5_2ELb1EfEENS_11colorspinor12FieldOrderCBIfLi4ELi3ELi24EL16QudaFieldOrder_s2EssLb0ELb0EEESC_SC_NS_6clover10FieldOrderIfLi3ELi4EL22QudaCloverFieldOrder_s4EEEEEEE	GPU-offline,vol=1048576,parity=2,precision=2,order=2,Ns=4,Nc=72,TwistFlavor=1,comm=0011,computeVUV,tile_size=4x2x1,dim=0,dir=fwd,nFace=1,bidirectional,GPU-device,coarse_vol=16x16x4x4	128	1	1	4096	2	4	16384	4	1	1	0	0.0280006	# 4141.49 Gflop/s, 2081.53 GB/s, tuning took 12.989390 seconds at Mon Jul 11 18:29:20 2022
     64x64x16x16	N4quda10CalculateYILb0EL19QudaFieldLocation_s2ENS_13CalculateYArgILb0EfLi4ELi2ELi3ELi24ENS_5gauge10FieldOrderIfLi48ELi2EL21QudaGaugeFieldOrder_s2ELb1EsEENS4_IfLi48ELi2ELS5_2ELb1EiEENS4_IfLi3ELi1ELS5_2ELb1EfEENS_11colorspinor12FieldOrderCBIfLi4ELi3ELi24EL16QudaFieldOrder_s2EssLb0ELb0EEESC_SC_NS_6clover10FieldOrderIfLi3ELi4EL22QudaCloverFieldOrder_s4EEEEEEE	GPU-offline,vol=1048576,parity=2,precision=2,order=2,Ns=4,Nc=72,TwistFlavor=1,comm=0011,computeVUV,tile_size=4x2x1,dim=1,dir=back,nFace=1,bidirectional,GPU-device,coarse_vol=16x16x4x4	128	1	1	4096	2	4	16385	4	1	1	0	0.0277985	# 4171.59 Gflop/s, 2096.66 GB/s, tuning took 13.044429 seconds at Mon Jul 11 18:30:59 2022
     64x64x16x16	N4quda10CalculateYILb0EL19QudaFieldLocation_s2ENS_13CalculateYArgILb0EfLi4ELi2ELi3ELi24ENS_5gauge10FieldOrderIfLi48ELi2EL21QudaGaugeFieldOrder_s2ELb1EsEENS4_IfLi48ELi2ELS5_2ELb1EiEENS4_IfLi3ELi1ELS5_2ELb1EfEENS_11colorspinor12FieldOrderCBIfLi4ELi3ELi24EL16QudaFieldOrder_s2EssLb0ELb0EEESC_SC_NS_6clover10FieldOrderIfLi3ELi4EL22QudaCloverFieldOrder_s4EEEEEEE	GPU-offline,vol=1048576,parity=2,precision=2,order=2,Ns=4,Nc=72,TwistFlavor=1,comm=0011,computeVUV,tile_size=4x2x1,dim=1,dir=fwd,nFace=1,bidirectional,GPU-device,coarse_vol=16x16x4x4	128	1	1	4096	2	4	16385	4	1	1	0	0.027633	# 4196.58 Gflop/s, 2109.22 GB/s, tuning took 12.939524 seconds at Mon Jul 11 18:29:40 2022
     64x64x16x16	N4quda10CalculateYILb0EL19QudaFieldLocation_s2ENS_13CalculateYArgILb0EfLi4ELi2ELi3ELi24ENS_5gauge10FieldOrderIfLi48ELi2EL21QudaGaugeFieldOrder_s2ELb1EsEENS4_IfLi48ELi2ELS5_2ELb1EiEENS4_IfLi3ELi1ELS5_2ELb1EfEENS_11colorspinor12FieldOrderCBIfLi4ELi3ELi24EL16QudaFieldOrder_s2EssLb0ELb0EEESC_SC_NS_6clover10FieldOrderIfLi3ELi4EL22QudaCloverFieldOrder_s4EEEEEEE	GPU-offline,vol=1048576,parity=2,precision=2,order=2,Ns=4,Nc=72,TwistFlavor=1,comm=0011,computeVUV,tile_size=4x2x1,dim=2,dir=back,nFace=1,bidirectional,GPU-device,coarse_vol=16x16x4x4	128	1	1	4096	2	4	16385	4	1	1	0	0.0274237	# 4228.60 Gflop/s, 2125.31 GB/s, tuning took 12.829318 seconds at Mon Jul 11 18:31:18 2022
     64x64x16x16	N4quda10CalculateYILb0EL19QudaFieldLocation_s2ENS_13CalculateYArgILb0EfLi4ELi2ELi3ELi24ENS_5gauge10FieldOrderIfLi48ELi2EL21QudaGaugeFieldOrder_s2ELb1EsEENS4_IfLi48ELi2ELS5_2ELb1EiEENS4_IfLi3ELi1ELS5_2ELb1EfEENS_11colorspinor12FieldOrderCBIfLi4ELi3ELi24EL16QudaFieldOrder_s2EssLb0ELb0EEESC_SC_NS_6clover10FieldOrderIfLi3ELi4EL22QudaCloverFieldOrder_s4EEEEEEE	GPU-offline,vol=1048576,parity=2,precision=2,order=2,Ns=4,Nc=72,TwistFlavor=1,comm=0011,computeVUV,tile_size=4x2x1,dim=2,dir=fwd,nFace=1,bidirectional,GPU-device,coarse_vol=16x16x4x4	128	1	1	4096	2	4	16384	4	1	1	0	0.0269913	# 4296.36 Gflop/s, 2159.37 GB/s, tuning took 12.718374 seconds at Mon Jul 11 18:30:00 2022
     64x64x16x16	N4quda10CalculateYILb0EL19QudaFieldLocation_s2ENS_13CalculateYArgILb0EfLi4ELi2ELi3ELi24ENS_5gauge10FieldOrderIfLi48ELi2EL21QudaGaugeFieldOrder_s2ELb1EsEENS4_IfLi48ELi2ELS5_2ELb1EiEENS4_IfLi3ELi1ELS5_2ELb1EfEENS_11colorspinor12FieldOrderCBIfLi4ELi3ELi24EL16QudaFieldOrder_s2EssLb0ELb0EEESC_SC_NS_6clover10FieldOrderIfLi3ELi4EL22QudaCloverFieldOrder_s4EEEEEEE	GPU-offline,vol=1048576,parity=2,precision=2,order=2,Ns=4,Nc=72,TwistFlavor=1,comm=0011,computeVUV,tile_size=4x2x1,dim=3,dir=back,nFace=1,bidirectional,GPU-device,coarse_vol=16x16x4x4	128	1	1	4096	2	4	16384	4	1	1	0	0.0269633	# 4300.82 Gflop/s, 2161.61 GB/s, tuning took 12.862547 seconds at Mon Jul 11 18:31:38 2022
     64x64x16x16	N4quda10CalculateYILb0EL19QudaFieldLocation_s2ENS_13CalculateYArgILb0EfLi4ELi2ELi3ELi24ENS_5gauge10FieldOrderIfLi48ELi2EL21QudaGaugeFieldOrder_s2ELb1EsEENS4_IfLi48ELi2ELS5_2ELb1EiEENS4_IfLi3ELi1ELS5_2ELb1EfEENS_11colorspinor12FieldOrderCBIfLi4ELi3ELi24EL16QudaFieldOrder_s2EssLb0ELb0EEESC_SC_NS_6clover10FieldOrderIfLi3ELi4EL22QudaCloverFieldOrder_s4EEEEEEE	GPU-offline,vol=1048576,parity=2,precision=2,order=2,Ns=4,Nc=72,TwistFlavor=1,comm=0011,computeVUV,tile_size=4x2x1,dim=3,dir=fwd,nFace=1,bidirectional,GPU-device,coarse_vol=16x16x4x4	128	1	1	4096	2	4	16385	4	1	1	0	0.0265878	# 4361.55 Gflop/s, 2192.13 GB/s, tuning took 12.696980 seconds at Mon Jul 11 18:30:19 2022
     64x64x16x16	N4quda10CopyCloverINS_6clover11FloatNOrderIdLi72ELi2ELb0ELb1ELb0EEENS2_IfLi72ELi4ELb0ELb1ELb0EEEdfEE	GPU-offline,vol=1048576precision=4Nc=3	32	2	1	16384	1	1	1891	-1	-1	-1	-1	0.000552277	# 0.00 Gflop/s, 1275.89 GB/s, tuning took 0.544707 seconds at Mon Jul 11 18:26:50 2022
     64x64x16x16	N4quda10CopyCloverINS_6clover11FloatNOrderIdLi72ELi2ELb0ELb1ELb0EEENS2_IsLi72ELi8ELb0ELb1ELb0EEEdsEE	GPU-offline,vol=1048576precision=2Nc=3	1024	1	1	512	2	1	24577	-1	-1	-1	-1	0.000448171	# 0.00 Gflop/s, 1310.22 GB/s, tuning took 0.487807 seconds at Mon Jul 11 18:25:02 2022
     64x64x16x16	N4quda10CopyCloverINS_6clover11FloatNOrderIfLi72ELi4ELb0ELb1ELb0EEENS2_IdLi72ELi2ELb0ELb1ELb0EEEfdEE	GPU-offline,vol=1048576precision=8Nc=3	32	2	1	16384	1	1	0	-1	-1	-1	-1	0.000511317	# 0.00 Gflop/s, 1378.09 GB/s, tuning took 0.473205 seconds at Mon Jul 11 18:22:53 2022
     64x64x16x16	N4quda10CopyCloverINS_6clover11FloatNOrderIsLi72ELi8ELb0ELb1ELb0EEENS2_IdLi72ELi2ELb0ELb1ELb0EEEsdEE	GPU-offline,vol=1048576precision=8Nc=3	32	1	1	16384	2	1	0	-1	-1	-1	-1	0.000419157	# 0.00 Gflop/s, 1400.91 GB/s, tuning took 0.436953 seconds at Mon Jul 11 18:22:55 2022
     64x64x16x16	N4quda10CopyCloverINS_6clover11FloatNOrderIsLi72ELi8ELb0ELb1ELb0EEENS2_IfLi72ELi4ELb0ELb1ELb0EEEsfEE	GPU-offline,vol=1048576precision=4Nc=3	128	1	1	4096	2	1	3511	-1	-1	-1	-1	0.000259328	# 0.00 Gflop/s, 1358.59 GB/s, tuning took 0.299325 seconds at Mon Jul 11 18:22:57 2022
     64x64x16x16	N4quda11CopyGaugeExIddLi18ENS_5gauge11FloatNOrderIdLi18ELi2ELi18EL20QudaStaggeredPhase_s0ELb1EL19QudaGhostExchange_sn2147483648ELb0EEES5_EE	GPU-offline,vol=1048576stride=524288precision=8geometry=4Nc=3vol=1638400stride=819200precision=8geometry=4Nc=3r=0022	352	1	1	1490	2	1	0	-1	-1	-1	-1	0.000892928	# 0.00 Gflop/s, 1352.81 GB/s, tuning took 0.928221 seconds at Mon Jul 11 18:37:00 2022
     64x64x16x16	N4quda11CopyGaugeExIddLi18ENS_5gauge11FloatNOrderIdLi18ELi2ELi18EL20QudaStaggeredPhase_s0ELb1EL19QudaGhostExchange_sn2147483648ELb0EEES5_EE	GPU-offline,vol=1048576stride=557056precision=8geometry=4Nc=3vol=1327104stride=663552precision=8geometry=4Nc=3r=0011	32	1	1	16384	2	1	0	-1	-1	-1	-1	0.000887467	# 0.00 Gflop/s, 1403.67 GB/s, tuning took 0.927507 seconds at Mon Jul 11 18:22:41 2022
     64x64x16x16	N4quda11SpinorNoiseIfLi4ELi3EL16QudaFieldOrder_s4EEE	GPU-offline,vol=1048576,parity=2,precision=4,order=4,Ns=4,Nc=3,TwistFlavor=1,uniform	64	1	1	8192	2	1	1821	-1	-1	-1	-1	0.000168448	# 0.00 Gflop/s, 597.59 GB/s, tuning took 0.264576 seconds at Mon Jul 11 18:26:51 2022
     64x64x16x16	N4quda12ExtractGhostIdLi3ENS_5gauge11FloatNOrderIdLi18ELi2ELi18EL20QudaStaggeredPhase_s0ELb1EL19QudaGhostExchange_sn2147483648ELb0EEEEE	GPU-offline,vol=1048576stride=557056precision=8geometry=4Nc=3,extract	64	1	8	1024	1	1	0	-1	-1	-1	-1	4.64058e-05	# 0.00 Gflop/s, 1016.81 GB/s, tuning took 0.109432 seconds at Mon Jul 11 18:22:37 2022
     64x64x16x16	N4quda13ComputeCloverIdEE	GPU-offline,vol=1048576precision=8Nc=3	32	2	1	16384	1	1	0	-1	-1	-1	-1	0.000920235	# 546.94 Gflop/s, 1494.98 GB/s, tuning took 0.075502 seconds at Mon Jul 11 18:22:52 2022
     64x64x16x16	N4quda15CopyColorSpinorILi4ELi3ENS_11colorspinor11FloatNOrderIfLi4ELi3ELi4ELb0ELb0EEENS2_IsLi4ELi3ELi8ELb0ELb0EEESt5tupleIJRNS_16ColorSpinorFieldERKS6_19QudaFieldLocation_sPfPKsEEEE	GPU-offline,vol=1048576,parity=2,precision=2,order=8,Ns=4,Nc=3,TwistFlavor=1vol=1048576,parity=2,precision=4,order=4,Ns=4,Nc=3,TwistFlavor=1,NonRelBasis	512	2	1	1024	1	1	0	-1	-1	-1	-1	0.000124814	# 0.00 Gflop/s, 1243.36 GB/s, tuning took 0.037103 seconds at Mon Jul 11 18:26:52 2022
     64x64x16x16	N4quda15CopyColorSpinorILi4ELi3ENS_11colorspinor11FloatNOrderIsLi4ELi3ELi8ELb0ELb0EEENS2_IfLi4ELi3ELi4ELb0ELb0EEESt5tupleIJRNS_16ColorSpinorFieldERKS6_19QudaFieldLocation_sPsPKfEEEE	GPU-offline,vol=1048576,parity=2,precision=4,order=4,Ns=4,Nc=3,TwistFlavor=1vol=1048576,parity=2,precision=2,order=8,Ns=4,Nc=3,TwistFlavor=1,RelBasis	32	1	1	16384	2	1	0	-1	-1	-1	-1	0.000117077	# 0.00 Gflop/s, 1325.53 GB/s, tuning took 0.029834 seconds at Mon Jul 11 18:26:51 2022
     64x64x16x16	N4quda4blas3ax_IfEE	GPU-offline,vol=1048576,parity=2,precision=2,order=8,Ns=4,Nc=3,TwistFlavor=1	256	1	1	216	2	1	0	-1	-1	-1	-1	8.4992e-05	# 296.10 Gflop/s, 1283.08 GB/s, tuning took 0.024448 seconds at Mon Jul 11 18:28:09 2022
     64x64x16x16	N4quda4blas4CdotIdfEE	GPU-offline,nParity=2,vol=1048576,parity=2,precision=2,order=8,Ns=4,Nc=3,TwistFlavor=1	576	1	1	192	1	1	0	-1	-1	-1	-1	9.20669e-05	# 1093.37 Gflop/s, 1184.49 GB/s, tuning took 0.774867 seconds at Mon Jul 11 18:28:09 2022
     64x64x16x16	N4quda4blas5Norm2IdfEE	GPU-offline,nParity=2,vol=1048576,parity=2,precision=2,order=8,Ns=4,Nc=3,TwistFlavor=1	320	1	1	192	1	1	0	-1	-1	-1	-1	5.1968e-05	# 968.51 Gflop/s, 1049.22 GB/s, tuning took 0.443244 seconds at Mon Jul 11 18:28:09 2022
     64x64x16x16	N4quda4blas6caxpy_IfEE	GPU-offline,vol=1048576,parity=2,precision=2,order=8,Ns=4,Nc=3,TwistFlavor=1	512	1	1	216	2	1	0	-1	-1	-1	-1	0.00012736	# 790.38 Gflop/s, 1284.37 GB/s, tuning took 0.031108 seconds at Mon Jul 11 18:28:09 2022
     64x64x16x16	N4quda7RNGInitE	GPU-offline,vol=1048576,parity=2,precision=2,order=8,Ns=4,Nc=3,TwistFlavor=1	320	2	1	1639	1	1	0	-1	-1	-1	-1	0.00943923	# 0.00 Gflop/s, 0.00 GB/s, tuning took 1.320530 seconds at Mon Jul 11 18:26:51 2022
     64x64x16x16	N4quda9CopyGaugeINS_12CopyGaugeArgIddLi10ELb0ENS_5gauge8QDPOrderIdLi10EEENS2_11FloatNOrderIdLi10ELi2ELi10EL20QudaStaggeredPhase_s0ELb1EL19QudaGhostExchange_sn2147483648ELb0EEEEEEE	GPU-offline,vol=1048576stride=524288precision=8geometry=4Nc=3,vol=1048576stride=524288precision=8geometry=4Nc=3	32	1	1	16384	1	8	0	-1	-1	-1	-1	0.000489131	# 0.00 Gflop/s, 1372.00 GB/s, tuning took 0.855042 seconds at Mon Jul 11 18:37:58 2022
     64x64x16x16	N4quda9CopyGaugeINS_12CopyGaugeArgIddLi18ELb0ENS_5gauge11FloatNOrderIdLi18ELi2ELi18EL20QudaStaggeredPhase_s0ELb1EL19QudaGhostExchange_sn2147483648ELb0EEENS2_8QDPOrderIdLi18EEEEEEE	GPU-offline,vol=1048576stride=524288precision=8geometry=4Nc=3,vol=1048576stride=524288precision=8geometry=4Nc=3	64	1	1	8192	1	8	3781	-1	-1	-1	-1	0.000885419	# 0.00 Gflop/s, 1364.28 GB/s, tuning took 1.476622 seconds at Mon Jul 11 18:36:59 2022
     64x64x16x16	N4quda9CopyGaugeINS_12CopyGaugeArgIddLi18ELb0ENS_5gauge11FloatNOrderIdLi18ELi2ELi18EL20QudaStaggeredPhase_s0ELb1EL19QudaGhostExchange_sn2147483648ELb0EEENS2_8QDPOrderIdLi18EEEEEEE	GPU-offline,vol=1048576stride=524288precision=8geometry=4Nc=3,vol=1048576stride=557056precision=8geometry=4Nc=3	64	1	1	8192	1	8	3781	-1	-1	-1	-1	0.000874496	# 0.00 Gflop/s, 1424.49 GB/s, tuning took 1.468535 seconds at Mon Jul 11 18:22:37 2022
     64x64x16x16	N4quda9CopyGaugeINS_12CopyGaugeArgIddLi18ELb0ENS_5gauge11FloatNOrderIdLi18ELi2ELi18EL20QudaStaggeredPhase_s0ELb1EL19QudaGhostExchange_sn2147483648ELb0EEES6_EEEE	GPU-offline,vol=1048576stride=557056precision=8geometry=4Nc=3,vol=1048576stride=557056precision=8geometry=4Nc=3,ghost	224	1	1	147	1	8	0	-1	-1	-1	-1	3.43923e-05	# 0.00 Gflop/s, 1457.74 GB/s, tuning took 0.080265 seconds at Mon Jul 11 18:22:37 2022
     64x64x16x16	N4quda9CopyGaugeINS_12CopyGaugeArgIdfLi18ELb0ENS_5gauge11FloatNOrderIdLi18ELi2ELi18EL20QudaStaggeredPhase_s0ELb1EL19QudaGhostExchange_sn2147483648ELb0EEENS3_IfLi18ELi2ELi18ELS4_0ELb1ELS5_n2147483648ELb0EEEEEEE	GPU-offline,vol=1048576stride=557056precision=4geometry=4Nc=3,vol=1048576stride=557056precision=8geometry=4Nc=3	64	1	1	8192	1	8	2458	-1	-1	-1	-1	0.000705195	# 0.00 Gflop/s, 1365.00 GB/s, tuning took 1.173842 seconds at Mon Jul 11 18:26:49 2022
     64x64x16x16	N4quda9CopyGaugeINS_12CopyGaugeArgIdfLi18ELb0ENS_5gauge11FloatNOrderIdLi18ELi2ELi18EL20QudaStaggeredPhase_s0ELb1EL19QudaGhostExchange_sn2147483648ELb0EEENS3_IfLi18ELi2ELi18ELS4_0ELb1ELS5_n2147483648ELb0EEEEEEE	GPU-offline,vol=1048576stride=557056precision=4geometry=4Nc=3,vol=1048576stride=557056precision=8geometry=4Nc=3,ghost	160	1	2	205	1	4	0	-1	-1	-1	-1	1.83918e-05	# 0.00 Gflop/s, 2044.45 GB/s, tuning took 0.058463 seconds at Mon Jul 11 18:26:49 2022
     64x64x16x16	N4quda9CopyGaugeINS_12CopyGaugeArgIdsLi18ELb0ENS_5gauge11FloatNOrderIdLi18ELi2ELi18EL20QudaStaggeredPhase_s0ELb1EL19QudaGhostExchange_sn2147483648ELb0EEENS3_IsLi18ELi2ELi18ELS4_0ELb1ELS5_n2147483648ELb0EEEEEEE	GPU-offline,vol=1048576stride=557056precision=2geometry=4Nc=3,vol=1048576stride=557056precision=8geometry=4Nc=3	128	1	1	4096	1	8	7022	-1	-1	-1	-1	0.000592896	# 0.00 Gflop/s, 1352.95 GB/s, tuning took 1.044204 seconds at Mon Jul 11 18:25:02 2022
     64x64x16x16	N4quda9CopyGaugeINS_12CopyGaugeArgIdsLi18ELb0ENS_5gauge11FloatNOrderIdLi18ELi2ELi18EL20QudaStaggeredPhase_s0ELb1EL19QudaGhostExchange_sn2147483648ELb0EEENS3_IsLi18ELi2ELi18ELS4_0ELb1ELS5_n2147483648ELb0EEEEEEE	GPU-offline,vol=1048576stride=557056precision=2geometry=4Nc=3,vol=1048576stride=557056precision=8geometry=4Nc=3,ghost	64	1	1	512	1	8	1695	-1	-1	-1	-1	1.4608e-05	# 0.00 Gflop/s, 2145.02 GB/s, tuning took 0.051015 seconds at Mon Jul 11 18:25:02 2022
     64x64x16x16	N4quda9CopyGaugeINS_12CopyGaugeArgIfdLi18ELb0ENS_5gauge11FloatNOrderIfLi18ELi2ELi18EL20QudaStaggeredPhase_s0ELb1EL19QudaGhostExchange_sn2147483648ELb0EEENS3_IdLi18ELi2ELi18ELS4_0ELb1ELS5_n2147483648ELb0EEEEEEE	GPU-offline,vol=1048576stride=557056precision=8geometry=4Nc=3,vol=1048576stride=557056precision=4geometry=4Nc=3	32	1	2	16384	1	4	0	-1	-1	-1	-1	0.000654336	# 0.00 Gflop/s, 1471.10 GB/s, tuning took 1.193561 seconds at Mon Jul 11 18:22:38 2022
     64x64x16x16	N4quda9CopyGaugeINS_12CopyGaugeArgIfdLi18ELb0ENS_5gauge11FloatNOrderIfLi18ELi2ELi18EL20QudaStaggeredPhase_s0ELb1EL19QudaGhostExchange_sn2147483648ELb0EEENS3_IdLi18ELi2ELi18ELS4_0ELb1ELS5_n2147483648ELb0EEEEEEE	GPU-offline,vol=1048576stride=557056precision=8geometry=4Nc=3,vol=1048576stride=557056precision=4geometry=4Nc=3,ghost	256	1	1	128	1	8	0	-1	-1	-1	-1	1.81107e-05	# 0.00 Gflop/s, 2076.19 GB/s, tuning took 0.059070 seconds at Mon Jul 11 18:22:38 2022
     64x64x16x16	N4quda9CopyGaugeINS_12CopyGaugeArgIsdLi18ELb0ENS_5gauge11FloatNOrderIsLi18ELi2ELi18EL20QudaStaggeredPhase_s0ELb1EL19QudaGhostExchange_sn2147483648ELb0EEENS3_IdLi18ELi2ELi18ELS4_0ELb1ELS5_n2147483648ELb0EEEEEEE	GPU-offline,vol=1048576stride=557056precision=8geometry=4Nc=3,vol=1048576stride=557056precision=2geometry=4Nc=3	32	1	1	16384	1	8	0	-1	-1	-1	-1	0.000539989	# 0.00 Gflop/s, 1485.51 GB/s, tuning took 1.053962 seconds at Mon Jul 11 18:22:39 2022
     64x64x16x16	N4quda9CopyGaugeINS_12CopyGaugeArgIsdLi18ELb0ENS_5gauge11FloatNOrderIsLi18ELi2ELi18EL20QudaStaggeredPhase_s0ELb1EL19QudaGhostExchange_sn2147483648ELb0EEENS3_IdLi18ELi2ELi18ELS4_0ELb1ELS5_n2147483648ELb0EEEEEEE	GPU-offline,vol=1048576stride=557056precision=8geometry=4Nc=3,vol=1048576stride=557056precision=2geometry=4Nc=3,ghost	384	1	1	86	1	8	0	-1	-1	-1	-1	1.06289e-05	# 0.00 Gflop/s, 2948.05 GB/s, tuning took 0.051010 seconds at Mon Jul 11 18:22:39 2022
     64x64x16x16	N4quda9CopyGaugeINS_12CopyGaugeArgIsfLi18ELb0ENS_5gauge11FloatNOrderIsLi18ELi2ELi18EL20QudaStaggeredPhase_s0ELb1EL19QudaGhostExchange_sn2147483648ELb0EEENS3_IfLi18ELi2ELi18ELS4_0ELb1ELS5_n2147483648ELb0EEEEEEE	GPU-offline,vol=1048576stride=557056precision=4geometry=4Nc=3,vol=1048576stride=557056precision=2geometry=4Nc=3	96	1	1	5462	1	8	0	-1	-1	-1	-1	0.000331264	# 0.00 Gflop/s, 1452.91 GB/s, tuning took 0.650857 seconds at Mon Jul 11 18:22:40 2022
     64x64x16x16	N4quda9CopyGaugeINS_12CopyGaugeArgIsfLi18ELb0ENS_5gauge11FloatNOrderIsLi18ELi2ELi18EL20QudaStaggeredPhase_s0ELb1EL19QudaGhostExchange_sn2147483648ELb0EEENS3_IfLi18ELi2ELi18ELS4_0ELb1ELS5_n2147483648ELb0EEEEEEE	GPU-offline,vol=1048576stride=557056precision=4geometry=4Nc=3,vol=1048576stride=557056precision=2geometry=4Nc=3,ghost	64	1	1	512	1	8	0	-1	-1	-1	-1	7.49681e-06	# 0.00 Gflop/s, 2507.82 GB/s, tuning took 0.039677 seconds at Mon Jul 11 18:22:40 2022
     64x64x16x16	N4quda9GhostPackIssL16QudaFieldOrder_s2ELi4ELi72EEE	GPU-offline,vol=1048576,parity=2,precision=2,order=2,Ns=4,Nc=72,TwistFlavor=1,halo_prec=2,comm=0011,topo=1148,order=0123,dest=00001111,nFace=1,spins_per_thread=2,colors_per_thread=2,shmem=0	256	1	1	512	72	2	0	-1	-1	-1	-1	0.000485035	# 0.00 Gflop/s, 622.62 GB/s, tuning took 0.290923 seconds at Mon Jul 11 18:28:21 2022
     64x64x18x18	N4quda14ExtractGhostExINS_5gauge11FloatNOrderIdLi18ELi2ELi18EL20QudaStaggeredPhase_s0ELb1EL19QudaGhostExchange_sn2147483648ELb0EEEEE	GPU-offline,vol=1327104stride=663552precision=8geometry=4Nc=3r=0011,extract,dim2	32	1	1	8192	2	2	0	-1	-1	-1	-1	0.00011776	# 0.00 Gflop/s, 641.11 GB/s, tuning took 0.218036 seconds at Mon Jul 11 18:22:41 2022
     64x64x18x18	N4quda14ExtractGhostExINS_5gauge11FloatNOrderIdLi18ELi2ELi18EL20QudaStaggeredPhase_s0ELb1EL19QudaGhostExchange_sn2147483648ELb0EEEEE	GPU-offline,vol=1327104stride=663552precision=8geometry=4Nc=3r=0011,extract,dim3	32	1	1	9216	2	2	0	-1	-1	-1	-1	0.000129792	# 0.00 Gflop/s, 654.39 GB/s, tuning took 0.236582 seconds at Mon Jul 11 18:22:42 2022
     64x64x18x18	N4quda14ExtractGhostExINS_5gauge11FloatNOrderIdLi18ELi2ELi18EL20QudaStaggeredPhase_s0ELb1EL19QudaGhostExchange_sn2147483648ELb0EEEEE	GPU-offline,vol=1327104stride=663552precision=8geometry=4Nc=3r=0011,inject,dim2	64	2	1	4096	1	2	0	-1	-1	-1	-1	0.000118784	# 0.00 Gflop/s, 635.59 GB/s, tuning took 0.218339 seconds at Mon Jul 11 18:22:42 2022
     64x64x18x18	N4quda14ExtractGhostExINS_5gauge11FloatNOrderIdLi18ELi2ELi18EL20QudaStaggeredPhase_s0ELb1EL19QudaGhostExchange_sn2147483648ELb0EEEEE	GPU-offline,vol=1327104stride=663552precision=8geometry=4Nc=3r=0011,inject,dim3	32	1	1	9216	2	2	0	-1	-1	-1	-1	0.000131456	# 0.00 Gflop/s, 646.11 GB/s, tuning took 0.239647 seconds at Mon Jul 11 18:22:42 2022
     64x64x18x18	N4quda5FmunuIdLi3EL21QudaReconstructType_s18EEE	GPU-offline,vol=1327104stride=663552precision=8geometry=4Nc=3r=0011,comm=0011	32	2	2	16384	1	3	0	-1	-1	-1	-1	0.00395708	# 3920.75 Gflop/s, 3892.14 GB/s, tuning took 10.019352 seconds at Mon Jul 11 18:22:52 2022
     64x64x20x20	N4quda10ForceGaugeIdLi3EL21QudaReconstructType_s18ELb1EEE	GPU-offline,vol=1638400stride=819200precision=8geometry=4Nc=3r=0022,num_paths=24,comm=0011	96	2	2	5462	1	2	12289	-1	-1	-1	-1	0.0180589	# 3908.88 Gflop/s, 5733.25 GB/s, tuning took 55.119925 seconds at Mon Jul 11 18:37:58 2022
     64x64x20x20	N4quda14ExtractGhostExINS_5gauge11FloatNOrderIdLi18ELi2ELi18EL20QudaStaggeredPhase_s0ELb1EL19QudaGhostExchange_sn2147483648ELb0EEEEE	GPU-offline,vol=1638400stride=819200precision=8geometry=4Nc=3r=0022,extract,dim2	32	1	2	16384	2	1	0	-1	-1	-1	-1	0.000252928	# 0.00 Gflop/s, 596.99 GB/s, tuning took 0.429091 seconds at Mon Jul 11 18:37:01 2022
     64x64x20x20	N4quda14ExtractGhostExINS_5gauge11FloatNOrderIdLi18ELi2ELi18EL20QudaStaggeredPhase_s0ELb1EL19QudaGhostExchange_sn2147483648ELb0EEEEE	GPU-offline,vol=1638400stride=819200precision=8geometry=4Nc=3r=0022,extract,dim3	32	1	1	20480	2	2	0	-1	-1	-1	-1	0.000281344	# 0.00 Gflop/s, 670.86 GB/s, tuning took 0.500699 seconds at Mon Jul 11 18:37:02 2022
     64x64x20x20	N4quda14ExtractGhostExINS_5gauge11FloatNOrderIdLi18ELi2ELi18EL20QudaStaggeredPhase_s0ELb1EL19QudaGhostExchange_sn2147483648ELb0EEEEE	GPU-offline,vol=1638400stride=819200precision=8geometry=4Nc=3r=0022,inject,dim2	32	1	2	16384	2	1	0	-1	-1	-1	-1	0.000256256	# 0.00 Gflop/s, 589.23 GB/s, tuning took 0.434230 seconds at Mon Jul 11 18:37:01 2022
     64x64x20x20	N4quda14ExtractGhostExINS_5gauge11FloatNOrderIdLi18ELi2ELi18EL20QudaStaggeredPhase_s0ELb1EL19QudaGhostExchange_sn2147483648ELb0EEEEE	GPU-offline,vol=1638400stride=819200precision=8geometry=4Nc=3r=0022,inject,dim3	64	1	1	10240	2	2	0	-1	-1	-1	-1	0.000284672	# 0.00 Gflop/s, 663.02 GB/s, tuning took 0.508235 seconds at Mon Jul 11 18:37:02 2022
        8x16x4x4	N4quda10CopySpinorIffLi2ELi24ENS_11colorspinor12FieldOrderCBIfLi2ELi24ELi1EL16QudaFieldOrder_s2EffLb0ELb0EEES4_EE	GPU-offline,vol=2048,parity=1,precision=4,order=2,Ns=2,Nc=24,TwistFlavor=1	224	1	1	10	1	1	0	-1	-1	-1	-1	1.11085e-05	# 0.00 Gflop/s, 141.59 GB/s, tuning took 0.010938 seconds at Mon Jul 11 18:32:08 2022
        8x16x4x4	N4quda12DslashCoarseIfssLi2ELi24ELb0ELb1ELb0ELNS_10DslashTypeE2EEE	policy_kernel,GPU-offline,vol=2048,parity=1,precision=4,order=2,Ns=2,Nc=24,TwistFlavor=1,comm=0011,full,halo=00001111	32	1	16	64	1	3	8192	1	1	1	1	1.03149e-05	# 3640.56 Gflop/s, 1982.30 GB/s, tuning took 0.161283 seconds at Mon Jul 11 18:32:04 2022
        8x16x4x4	N4quda12DslashCoarseIfssLi2ELi24ELb0ELb1ELb0ELNS_10DslashTypeE2EEE	policy_kernel,GPU-offline,vol=2048,parity=1,precision=4,order=2,Ns=2,Nc=24,TwistFlavor=1,comm=0011,full,halo=00002222	32	1	16	64	1	3	8192	1	1	1	1	1.02882e-05	# 3650.02 Gflop/s, 1987.45 GB/s, tuning took 0.161517 seconds at Mon Jul 11 18:32:04 2022
        8x16x4x4	N4quda12DslashCoarseIfssLi2ELi24ELb1ELb0ELb0ELNS_10DslashTypeE2EEE	policy_kernel,GPU-offline,vol=2048,parity=1,precision=4,order=2,Ns=2,Nc=24,TwistFlavor=1,comm=0011,full,halo=00001111	128	1	4	64	1	24	8192	4	2	1	1	0.000127232	# 2371.99 Gflop/s, 1242.40 GB/s, tuning took 0.708236 seconds at Mon Jul 11 18:32:05 2022
        8x16x4x4	N4quda12DslashCoarseIfssLi2ELi24ELb1ELb0ELb0ELNS_10DslashTypeE2EEE	policy_kernel,GPU-offline,vol=2048,parity=1,precision=4,order=2,Ns=2,Nc=24,TwistFlavor=1,comm=0011,full,halo=00002222	64	1	12	64	1	4	24577	2	1	1	1	0.00014336	# 2105.14 Gflop/s, 1102.63 GB/s, tuning took 1.252802 seconds at Mon Jul 11 18:32:06 2022
        8x16x4x4	N4quda12DslashCoarseIfssLi2ELi24ELb1ELb0ELb1ELNS_10DslashTypeE2EEE	policy_kernel,GPU-offline,vol=2048,parity=1,precision=4,order=2,Ns=2,Nc=24,TwistFlavor=1,comm=0011,full,halo=00001111	128	1	4	64	1	24	8192	4	2	1	1	0.000126848	# 2379.17 Gflop/s, 1246.16 GB/s, tuning took 0.715252 seconds at Mon Jul 11 18:32:07 2022
        8x16x4x4	N4quda12DslashCoarseIfssLi2ELi24ELb1ELb0ELb1ELNS_10DslashTypeE2EEE	policy_kernel,GPU-offline,vol=2048,parity=1,precision=4,order=2,Ns=2,Nc=24,TwistFlavor=1,comm=0011,full,halo=00002222	64	1	12	64	1	4	24577	2	1	1	1	0.000143506	# 2103.00 Gflop/s, 1101.50 GB/s, tuning took 1.253089 seconds at Mon Jul 11 18:32:08 2022
        8x16x4x4	N4quda22DslashCoarsePolicyTuneINS_18DslashCoarseLaunchILb0EEEEE	policy,clover,vol=2048,parity=1,precision=4,order=2,Ns=2,Nc=24,TwistFlavor=1,gauge_prec=2,halo_prec=2,comm=0011,topo=1148,order=0123,p2p=7,gdr=1,nvshmem=0,pol=11110011111,full	32	1	1	1	1	1	0	2	0	0	0	1.02882e-05	# 3650.02 Gflop/s, 1987.45 GB/s, tuning took 0.008739 seconds at Mon Jul 11 18:32:04 2022
        8x16x4x4	N4quda22DslashCoarsePolicyTuneINS_18DslashCoarseLaunchILb0EEEEE	policy,dslash,vol=2048,parity=1,precision=4,order=2,Ns=2,Nc=24,TwistFlavor=1,gauge_prec=2,halo_prec=2,comm=0011,topo=1148,order=0123,p2p=7,gdr=1,nvshmem=0,pol=11110011111,full	32	1	1	1	1	1	0	8	0	0	0	0.000185344	# 1628.29 Gflop/s, 852.86 GB/s, tuning took 0.020339 seconds at Mon Jul 11 18:32:06 2022
        8x16x4x4	N4quda22DslashCoarsePolicyTuneINS_18DslashCoarseLaunchILb1EEEEE	policy,dslash,vol=2048,parity=1,precision=4,order=2,Ns=2,Nc=24,TwistFlavor=1,gauge_prec=2,halo_prec=2,comm=0011,topo=1148,order=0123,p2p=7,gdr=1,nvshmem=0,pol=11110011111,full	32	1	1	1	1	1	0	8	0	0	0	0.000182613	# 1652.64 Gflop/s, 865.61 GB/s, tuning took 0.019563 seconds at Mon Jul 11 18:32:08 2022
        8x16x4x4	N4quda4blas10CdotNormABIdfEE	GPU-offline,nParity=1,vol=2048,parity=1,precision=4,order=2,Ns=2,Nc=24,TwistFlavor=1	384	1	1	32	1	1	0	-1	-1	-1	-1	1.24901e-05	# 125.93 Gflop/s, 125.93 GB/s, tuning took 0.076692 seconds at Mon Jul 11 18:33:04 2022
        8x16x4x4	N4quda4blas11axpbyzNorm2IdfEE	GPU-offline,nParity=1,vol=2048,parity=1,precision=4,order=2,Ns=2,Nc=24,TwistFlavor=1	768	1	1	64	1	1	0	-1	-1	-1	-1	1.06496e-05	# 73.85 Gflop/s, 221.54 GB/s, tuning took 0.073076 seconds at Mon Jul 11 18:32:08 2022
        8x16x4x4	N4quda4blas11multicaxpy_IfEE	GPU-offline,vol=2048,parity=1,precision=4,order=2,Ns=2,Nc=24,TwistFlavor=1,Nxz=1,Nyw=1	672	1	1	216	1	1	0	1	0	0	0	7.48741e-06	# 105.03 Gflop/s, 315.10 GB/s, tuning took 0.010008 seconds at Mon Jul 11 18:32:08 2022
        8x16x4x4	N4quda4blas11multicaxpy_IfEE	GPU-offline,vol=2048,parity=1,precision=4,order=2,Ns=2,Nc=24,TwistFlavor=1,Nxz=16,Nyw=1	256	1	1	216	1	1	0	1	0	0	0	1.14661e-05	# 1097.40 Gflop/s, 1234.58 GB/s, tuning took 0.011257 seconds at Mon Jul 11 18:33:24 2022
        8x16x4x4	N4quda4blas11multicaxpy_IfEE	GPU-offline,vol=2048,parity=1,precision=4,order=2,Ns=2,Nc=24,TwistFlavor=1,Nxz=2,Nyw=1	576	1	1	216	1	1	0	1	0	0	0	8.25165e-06	# 190.61 Gflop/s, 381.22 GB/s, tuning took 0.010481 seconds at Mon Jul 11 18:33:23 2022
        8x16x4x4	N4quda4blas11multicaxpy_IfEE	GPU-offline,vol=2048,parity=1,precision=4,order=2,Ns=2,Nc=24,TwistFlavor=1,Nxz=3,Nyw=1	640	1	1	216	1	1	0	1	0	0	0	8.30694e-06	# 284.02 Gflop/s, 473.36 GB/s, tuning took 0.010090 seconds at Mon Jul 11 18:33:23 2022
        8x16x4x4	N4quda4blas11multicaxpy_IfEE	GPU-offline,vol=2048,parity=1,precision=4,order=2,Ns=2,Nc=24,TwistFlavor=1,Nxz=4,Nyw=1	608	1	1	216	1	1	0	1	0	0	0	8.54726e-06	# 368.04 Gflop/s, 552.06 GB/s, tuning took 0.010356 seconds at Mon Jul 11 18:33:04 2022
        8x16x4x4	N4quda4blas11multicaxpy_IfEE	GPU-offline,vol=2048,parity=1,precision=4,order=2,Ns=2,Nc=24,TwistFlavor=1,Nxz=8,Nyw=1	480	1	1	216	1	1	0	1	0	0	0	9.60719e-06	# 654.87 Gflop/s, 818.59 GB/s, tuning took 0.010763 seconds at Mon Jul 11 18:33:24 2022
        8x16x4x4	N4quda4blas12TileSizeTuneINS0_9multiCdotES2_St7complexIdEEE	nested_policy,vol=2048,parity=1,precision=4,order=2,Ns=2,Nc=24,TwistFlavor=1,vol=2048,parity=1,precision=4,order=2,Ns=2,Nc=24,TwistFlavor=1,n=4,m=5,multi-blas-n=4,max_nyw_tile=8	32	1	1	1	1	1	0	4	5	0	0	1.83934e-05	# 0.00 Gflop/s, 0.00 GB/s, tuning took 0.022568 seconds at Mon Jul 11 18:33:04 2022
        8x16x4x4	N4quda4blas12TileSizeTuneINS0_9multiCdotES2_St7complexIdEEE	nested_policy,vol=2048,parity=1,precision=4,order=2,Ns=2,Nc=24,TwistFlavor=1,vol=2048,parity=1,precision=4,order=2,Ns=2,Nc=24,TwistFlavor=1,n=5,m=4,multi-blas-n=4,max_nyw_tile=8	32	1	1	1	1	1	0	4	4	0	0	3.23716e-05	# 0.00 Gflop/s, 0.00 GB/s, tuning took 0.013242 seconds at Mon Jul 11 18:33:04 2022
        8x16x4x4	N4quda4blas13TransposeTuneINS0_9multiCdotES2_St7complexIdEEE	policy,vol=2048,parity=1,precision=4,order=2,Ns=2,Nc=24,TwistFlavor=1,vol=2048,parity=1,precision=4,order=2,Ns=2,Nc=24,TwistFlavor=1,n=4,m=5,multi-blas-n=4,max_nyw_tile=8	32	1	1	1	1	1	0	0	0	0	0	1.90798e-05	# 0.00 Gflop/s, 0.00 GB/s, tuning took 0.002822 seconds at Mon Jul 11 18:33:04 2022
        8x16x4x4	N4quda4blas13cabxpyzaxnormIdfEE	GPU-offline,nParity=1,vol=2048,parity=1,precision=4,order=2,Ns=2,Nc=24,TwistFlavor=1	800	1	1	64	1	1	0	-1	-1	-1	-1	1.08785e-05	# 180.73 Gflop/s, 289.17 GB/s, tuning took 0.075674 seconds at Mon Jul 11 18:33:04 2022
        8x16x4x4	N4quda4blas15tripleCGUpdate_IfEE	GPU-offline,vol=2048,parity=1,precision=4,order=2,Ns=2,Nc=24,TwistFlavor=1	288	1	1	216	1	1	0	-1	-1	-1	-1	4.07874e-06	# 289.22 Gflop/s, 1349.69 GB/s, tuning took 0.008734 seconds at Mon Jul 11 18:32:08 2022
        8x16x4x4	N4quda4blas18tripleCGReduction_IdfEE	GPU-offline,nParity=1,vol=2048,parity=1,precision=4,order=2,Ns=2,Nc=24,TwistFlavor=1	384	1	1	64	1	1	0	-1	-1	-1	-1	1.18603e-05	# 99.46 Gflop/s, 198.92 GB/s, tuning took 0.076798 seconds at Mon Jul 11 18:32:08 2022
        8x16x4x4	N4quda4blas4CdotIdfEE	GPU-offline,nParity=1,vol=2048,parity=1,precision=4,order=2,Ns=2,Nc=24,TwistFlavor=1	352	1	1	64	1	1	0	-1	-1	-1	-1	1.15138e-05	# 68.30 Gflop/s, 136.61 GB/s, tuning took 0.073665 seconds at Mon Jul 11 18:32:08 2022
        8x16x4x4	N4quda4blas5Norm2IdfEE	GPU-offline,nParity=1,vol=2048,parity=1,precision=4,order=2,Ns=2,Nc=24,TwistFlavor=1	832	1	1	64	1	1	0	-1	-1	-1	-1	1.0309e-05	# 38.14 Gflop/s, 76.29 GB/s, tuning took 0.069285 seconds at Mon Jul 11 18:32:06 2022
        8x16x4x4	N4quda4blas6caxpy_IfEE	GPU-offline,vol=2048,parity=1,precision=4,order=2,Ns=2,Nc=24,TwistFlavor=1	608	1	1	216	1	1	0	-1	-1	-1	-1	3.28807e-06	# 239.18 Gflop/s, 717.53 GB/s, tuning took 0.008496 seconds at Mon Jul 11 18:32:08 2022
        8x16x4x4	N4quda4blas7axpbyz_IfEE	GPU-offline,vol=2048,parity=1,precision=4,order=2,Ns=2,Nc=24,TwistFlavor=1	288	1	1	216	1	1	0	-1	-1	-1	-1	3.29747e-06	# 178.87 Gflop/s, 715.49 GB/s, tuning took 0.008437 seconds at Mon Jul 11 18:32:06 2022
        8x16x4x4	N4quda4blas9axpyZpbx_IfEE	GPU-offline,vol=2048,parity=1,precision=4,order=2,Ns=2,Nc=24,TwistFlavor=1	448	1	1	216	1	1	0	-1	-1	-1	-1	3.67804e-06	# 213.82 Gflop/s, 1069.09 GB/s, tuning took 0.008551 seconds at Mon Jul 11 18:32:08 2022
        8x16x4x4	N4quda4blas9multiCdotIdfEE	policy_kernel,GPU-offline,nParity=1,vol=2048,parity=1,precision=4,order=2,Ns=2,Nc=24,TwistFlavor=1,Nxz=1,Nyw=1,max_nyw_tile=8	256	1	1	64	1	1	0	-1	-1	-1	-1	1.21843e-05	# 64.54 Gflop/s, 129.09 GB/s, tuning took 0.026553 seconds at Mon Jul 11 18:33:04 2022
        8x16x4x4	N4quda4blas9multiCdotIdfEE	policy_kernel,GPU-offline,nParity=1,vol=2048,parity=1,precision=4,order=2,Ns=2,Nc=24,TwistFlavor=1,Nxz=1,Nyw=1,max_nyw_tile=8,norm	256	1	1	64	1	1	0	-1	-1	-1	-1	1.19639e-05	# 65.73 Gflop/s, 131.47 GB/s, tuning took 0.026478 seconds at Mon Jul 11 18:33:04 2022
        8x16x4x4	N4quda4blas9multiCdotIdfEE	policy_kernel,GPU-offline,nParity=1,vol=2048,parity=1,precision=4,order=2,Ns=2,Nc=24,TwistFlavor=1,Nxz=1,Nyw=2,max_nyw_tile=8	256	1	1	64	1	2	0	-1	-1	-1	-1	1.27369e-05	# 123.49 Gflop/s, 246.98 GB/s, tuning took 0.039829 seconds at Mon Jul 11 18:33:04 2022
        8x16x4x4	N4quda4blas9multiCdotIdfEE	policy_kernel,GPU-offline,nParity=1,vol=2048,parity=1,precision=4,order=2,Ns=2,Nc=24,TwistFlavor=1,Nxz=1,Nyw=3,max_nyw_tile=8	256	1	1	64	1	3	0	-1	-1	-1	-1	1.30174e-05	# 181.24 Gflop/s, 362.48 GB/s, tuning took 0.053116 seconds at Mon Jul 11 18:33:23 2022
        8x16x4x4	N4quda4blas9multiCdotIdfEE	policy_kernel,GPU-offline,nParity=1,vol=2048,parity=1,precision=4,order=2,Ns=2,Nc=24,TwistFlavor=1,Nxz=1,Nyw=4,max_nyw_tile=8	256	1	1	64	1	4	0	-1	-1	-1	-1	1.34144e-05	# 234.50 Gflop/s, 469.01 GB/s, tuning took 0.065942 seconds at Mon Jul 11 18:33:23 2022
        8x16x4x4	N4quda4blas9multiCdotIdfEE	policy_kernel,GPU-offline,nParity=1,vol=2048,parity=1,precision=4,order=2,Ns=2,Nc=24,TwistFlavor=1,Nxz=1,Nyw=5,max_nyw_tile=8	256	1	1	64	1	5	0	-1	-1	-1	-1	1.37801e-05	# 285.35 Gflop/s, 570.70 GB/s, tuning took 0.076828 seconds at Mon Jul 11 18:33:23 2022
        8x16x4x4	N4quda4blas9multiCdotIdfEE	policy_kernel,GPU-offline,nParity=1,vol=2048,parity=1,precision=4,order=2,Ns=2,Nc=24,TwistFlavor=1,Nxz=1,Nyw=6,max_nyw_tile=8	256	1	2	64	1	3	0	-1	-1	-1	-1	1.39849e-05	# 337.41 Gflop/s, 674.81 GB/s, tuning took 0.087806 seconds at Mon Jul 11 18:33:23 2022
        8x16x4x4	N4quda4blas9multiCdotIdfEE	policy_kernel,GPU-offline,nParity=1,vol=2048,parity=1,precision=4,order=2,Ns=2,Nc=24,TwistFlavor=1,Nxz=1,Nyw=7,max_nyw_tile=8	256	1	2	64	1	4	0	-1	-1	-1	-1	1.42456e-05	# 386.44 Gflop/s, 772.87 GB/s, tuning took 0.099022 seconds at Mon Jul 11 18:33:24 2022
        8x16x4x4	N4quda4blas9multiCdotIdfEE	policy_kernel,GPU-offline,nParity=1,vol=2048,parity=1,precision=4,order=2,Ns=2,Nc=24,TwistFlavor=1,Nxz=1,Nyw=8,max_nyw_tile=8	128	1	2	64	1	4	0	-1	-1	-1	-1	1.46773e-05	# 428.65 Gflop/s, 857.30 GB/s, tuning took 0.110498 seconds at Mon Jul 11 18:33:24 2022
        8x16x4x4	N4quda4blas9multiCdotIdfEE	policy_kernel,GPU-offline,nParity=1,vol=2048,parity=1,precision=4,order=2,Ns=2,Nc=24,TwistFlavor=1,Nxz=2,Nyw=1,max_nyw_tile=8	256	1	1	64	1	1	0	-1	-1	-1	-1	1.33413e-05	# 117.89 Gflop/s, 176.84 GB/s, tuning took 0.026369 seconds at Mon Jul 11 18:33:04 2022
        8x16x4x4	N4quda4blas9multiCdotIdfEE	policy_kernel,GPU-offline,nParity=1,vol=2048,parity=1,precision=4,order=2,Ns=2,Nc=24,TwistFlavor=1,Nxz=2,Nyw=2,max_nyw_tile=8	256	1	1	50	1	2	0	-1	-1	-1	-1	1.41854e-05	# 221.76 Gflop/s, 332.64 GB/s, tuning took 0.041655 seconds at Mon Jul 11 18:33:04 2022
        8x16x4x4	N4quda4blas9multiCdotIdfEE	policy_kernel,GPU-offline,nParity=1,vol=2048,parity=1,precision=4,order=2,Ns=2,Nc=24,TwistFlavor=1,Nxz=2,Nyw=2,max_nyw_tile=8,norm	256	1	1	50	1	2	0	-1	-1	-1	-1	1.39264e-05	# 225.88 Gflop/s, 338.82 GB/s, tuning took 0.041289 seconds at Mon Jul 11 18:33:04 2022
        8x16x4x4	N4quda4blas9multiCdotIdfEE	policy_kernel,GPU-offline,nParity=1,vol=2048,parity=1,precision=4,order=2,Ns=2,Nc=24,TwistFlavor=1,Nxz=2,Nyw=4,max_nyw_tile=8	256	1	1	54	1	4	0	-1	-1	-1	-1	1.4752e-05	# 426.48 Gflop/s, 639.72 GB/s, tuning took 0.068315 seconds at Mon Jul 11 18:33:04 2022
        8x16x4x4	N4quda4blas9multiCdotIdfEE	policy_kernel,GPU-offline,nParity=1,vol=2048,parity=1,precision=4,order=2,Ns=2,Nc=24,TwistFlavor=1,Nxz=3,Nyw=4,max_nyw_tile=8	256	1	1	54	1	4	0	-1	-1	-1	-1	1.62304e-05	# 581.45 Gflop/s, 775.27 GB/s, tuning took 0.087582 seconds at Mon Jul 11 18:33:04 2022
        8x16x4x4	N4quda4blas9multiCdotIdfEE	policy_kernel,GPU-offline,nParity=1,vol=2048,parity=1,precision=4,order=2,Ns=2,Nc=24,TwistFlavor=1,Nxz=4,Nyw=2,max_nyw_tile=8	512	1	1	32	1	2	0	-1	-1	-1	-1	1.5839e-05	# 397.21 Gflop/s, 496.52 GB/s, tuning took 0.052560 seconds at Mon Jul 11 18:33:04 2022
        8x16x4x4	N4quda4blas9multiCdotIdfEE	policy_kernel,GPU-offline,nParity=1,vol=2048,parity=1,precision=4,order=2,Ns=2,Nc=24,TwistFlavor=1,Nxz=4,Nyw=3,max_nyw_tile=8	256	1	1	64	1	3	0	-1	-1	-1	-1	1.63157e-05	# 578.41 Gflop/s, 723.01 GB/s, tuning took 0.070205 seconds at Mon Jul 11 18:33:04 2022
        8x16x4x4	N4quda4blas9multiCdotIdfEE	policy_kernel,GPU-offline,nParity=1,vol=2048,parity=1,precision=4,order=2,Ns=2,Nc=24,TwistFlavor=1,Nxz=4,Nyw=5,max_nyw_tile=8	256	1	1	64	1	5	0	-1	-1	-1	-1	1.79103e-05	# 878.19 Gflop/s, 1097.73 GB/s, tuning took 0.106566 seconds at Mon Jul 11 18:33:04 2022
        8x16x4x4	N4quda9GhostPackIfsL16QudaFieldOrder_s2ELi2ELi24EEE	GPU-offline,vol=2048,parity=1,precision=4,order=2,Ns=2,Nc=24,TwistFlavor=1,halo_prec=2,comm=0011,topo=1148,order=0123,dest=00001111,nFace=1,spins_per_thread=2,colors_per_thread=2,shmem=0	28	12	1	74	1	1	4608	-1	-1	-1	-1	5.53691e-06	# 0.00 Gflop/s, 213.05 GB/s, tuning took 0.009830 seconds at Mon Jul 11 18:32:04 2022
        8x16x4x4	N4quda9GhostPackIfsL16QudaFieldOrder_s2ELi2ELi24EEE	GPU-offline,vol=2048,parity=1,precision=4,order=2,Ns=2,Nc=24,TwistFlavor=1,halo_prec=2,comm=0011,topo=1148,order=0123,dest=00002222,nFace=1,spins_per_thread=2,colors_per_thread=2,shmem=0	32	12	1	64	1	1	4608	-1	-1	-1	-1	2.11399e-05	# 0.00 Gflop/s, 55.80 GB/s, tuning took 0.016863 seconds at Mon Jul 11 18:32:05 2022
8x16x4x4,4x4x2x2	N4quda14RestrictLaunchIfsLi2ELi24ELi2ELi32EEE	GPU-offline,vol=2048,parity=1,precision=4,order=2,Ns=2,Nc=24,TwistFlavor=1,vol=64,parity=2,precision=4,order=2,Ns=2,Nc=32,TwistFlavor=1	64	1	2	64	1	8	0	2	-1	-1	-1	1.52235e-05	# 1653.09 Gflop/s, 881.43 GB/s, tuning took 0.151001 seconds at Mon Jul 11 18:33:03 2022
 bytes=100663296	cudaMemcpyDefault	copy,color_spinor_field.cpp,498	32	1	1	1	1	1	0	-1	-1	-1	-1	0.00767795	# 0.00 Gflop/s, 13.11 GB/s, tuning took 0.055095 seconds at Mon Jul 11 18:25:02 2022
 bytes=100663296	cudaMemcpyDefault	copy,color_spinor_field.cpp,543	32	1	1	1	1	1	0	-1	-1	-1	-1	0.01048	# 0.00 Gflop/s, 9.61 GB/s, tuning took 0.073497 seconds at Mon Jul 11 18:26:40 2022
 bytes=100663296	cudaMemsetAsync	copy,color_spinor_field.cpp,505	32	1	1	1	1	1	0	-1	-1	-1	-1	6.82667e-05	# 0.00 Gflop/s, 1474.56 GB/s, tuning took 0.001385 seconds at Mon Jul 11 18:25:02 2022
 bytes=100663296	cudaMemsetAsync	zero,color_spinor_field.cpp,465	32	1	1	1	1	1	0	-1	-1	-1	-1	6.99733e-05	# 0.00 Gflop/s, 1438.60 GB/s, tuning took 0.001373 seconds at Mon Jul 11 18:25:02 2022
      bytes=1024	cudaMemcpyHostToDevice	BatchInvertMatrix,blas_lapack_cublas.cpp,117	32	1	1	1	1	1	0	-1	-1	-1	-1	9.55301e-06	# 0.00 Gflop/s, 0.11 GB/s, tuning took 0.000837 seconds at Mon Jul 11 18:32:48 2022
   bytes=1048576	cudaMemset	cudaGaugeField,cuda_gauge_field.cpp,54	32	1	1	1	1	1	0	-1	-1	-1	-1	3.02972e-06	# 0.00 Gflop/s, 346.10 GB/s, tuning took 0.000712 seconds at Mon Jul 11 18:32:46 2022
bytes=1212153856	cudaMemsetAsync	zero,color_spinor_field.cpp,465	32	1	1	1	1	1	0	-1	-1	-1	-1	0.000787797	# 0.00 Gflop/s, 1538.66 GB/s, tuning took 0.005566 seconds at Mon Jul 11 18:28:21 2022
 bytes=150994944	cudaMemcpyDefault	copy,cuda_gauge_field.cpp,576	32	1	1	1	1	1	0	-1	-1	-1	-1	0.0114917	# 0.00 Gflop/s, 13.14 GB/s, tuning took 0.081319 seconds at Mon Jul 11 18:22:35 2022
   bytes=1572864	cudaMemsetAsync	zero,color_spinor_field.cpp,465	32	1	1	1	1	1	0	-1	-1	-1	-1	3.08767e-06	# 0.00 Gflop/s, 509.40 GB/s, tuning took 0.016879 seconds at Mon Jul 11 18:28:21 2022
     bytes=16384	cudaMemcpyDeviceToHost	BatchInvertMatrix,blas_lapack_cublas.cpp,125	32	1	1	1	1	1	0	-1	-1	-1	-1	9.37708e-06	# 0.00 Gflop/s, 1.75 GB/s, tuning took 0.002637 seconds at Mon Jul 11 18:31:40 2022
     bytes=16384	cudaMemcpyDeviceToHost	BatchInvertMatrix,blas_lapack_cublas.cpp,141	32	1	1	1	1	1	0	-1	-1	-1	-1	9.42298e-06	# 0.00 Gflop/s, 1.74 GB/s, tuning took 0.002450 seconds at Mon Jul 11 18:31:40 2022
     bytes=16384	cudaMemcpyHostToDevice	createGeoMap,transfer.cpp,340	32	1	1	1	1	1	0	-1	-1	-1	-1	1.15802e-05	# 0.00 Gflop/s, 1.41 GB/s, tuning took 0.000878 seconds at Mon Jul 11 18:32:46 2022
     bytes=16384	cudaMemcpyHostToDevice	createGeoMap,transfer.cpp,341	32	1	1	1	1	1	0	-1	-1	-1	-1	1.16254e-05	# 0.00 Gflop/s, 1.41 GB/s, tuning took 0.000876 seconds at Mon Jul 11 18:32:46 2022
     bytes=16384	cudaMemsetAsync	zero,color_spinor_field.cpp,465	32	1	1	1	1	1	0	-1	-1	-1	-1	2.62478e-06	# 0.00 Gflop/s, 6.24 GB/s, tuning took 0.000704 seconds at Mon Jul 11 18:33:03 2022
  bytes=16777216	cudaMemset	cudaGaugeField,cuda_gauge_field.cpp,54	32	1	1	1	1	1	0	-1	-1	-1	-1	9.18332e-06	# 0.00 Gflop/s, 1826.92 GB/s, tuning took 0.000944 seconds at Mon Jul 11 18:32:46 2022
 bytes=169869312	cudaMemset	allocateGhostBuffer,lattice_field.cpp,287	32	1	1	1	1	1	0	-1	-1	-1	-1	0.000112526	# 0.00 Gflop/s, 1509.60 GB/s, tuning took 0.001510 seconds at Mon Jul 11 18:22:41 2022
 bytes=169869312	cudaMemset	allocateGhostBuffer,lattice_field.cpp,292	32	1	1	1	1	1	0	-1	-1	-1	-1	0.000113436	# 0.00 Gflop/s, 1497.48 GB/s, tuning took 0.001516 seconds at Mon Jul 11 18:22:41 2022
 bytes=188743680	cudaMemsetAsync	exchangeExtendedGhost,cuda_gauge_field.cpp,400	32	1	1	1	1	1	0	-1	-1	-1	-1	0.000128	# 0.00 Gflop/s, 1474.56 GB/s, tuning took 0.001611 seconds at Mon Jul 11 18:37:00 2022
 bytes=201326592	cudaMemcpyDefault	copy,color_spinor_field.cpp,498	32	1	1	1	1	1	0	-1	-1	-1	-1	0.0166564	# 0.00 Gflop/s, 12.09 GB/s, tuning took 0.118279 seconds at Mon Jul 11 18:22:57 2022
 bytes=201326592	cudaMemcpyDefault	copy,color_spinor_field.cpp,543	32	1	1	1	1	1	0	-1	-1	-1	-1	0.0210145	# 0.00 Gflop/s, 9.58 GB/s, tuning took 0.160509 seconds at Mon Jul 11 18:24:56 2022
 bytes=201326592	cudaMemsetAsync	copy,color_spinor_field.cpp,505	32	1	1	1	1	1	0	-1	-1	-1	-1	0.00013312	# 0.00 Gflop/s, 1512.37 GB/s, tuning took 0.001688 seconds at Mon Jul 11 18:22:57 2022
 bytes=201326592	cudaMemsetAsync	zero,color_spinor_field.cpp,465	32	1	1	1	1	1	0	-1	-1	-1	-1	0.000136704	# 0.00 Gflop/s, 1472.72 GB/s, tuning took 0.001684 seconds at Mon Jul 11 18:22:57 2022
   bytes=2097152	cudaMemset	zero,cuda_gauge_field.cpp,729	32	1	1	1	1	1	0	-1	-1	-1	-1	3.39611e-06	# 0.00 Gflop/s, 617.52 GB/s, tuning took 0.000802 seconds at Mon Jul 11 18:32:48 2022
      bytes=2208	cudaMemcpyHostToDevice	paths,gauge_force.cuh,50	32	1	1	1	1	1	0	-1	-1	-1	-1	7.64712e-06	# 0.00 Gflop/s, 0.29 GB/s, tuning took 0.000898 seconds at Mon Jul 11 18:37:02 2022
   bytes=2359296	cudaMemcpyDeviceToDevice	exchangeGhost,cuda_gauge_field.cpp,193	32	1	1	1	1	1	0	-1	-1	-1	-1	1.18838e-05	# 0.00 Gflop/s, 397.06 GB/s, tuning took 0.001016 seconds at Mon Jul 11 18:22:37 2022
   bytes=2359296	cudaMemset	cudaGaugeField,cuda_gauge_field.cpp,80	32	1	1	1	1	1	0	-1	-1	-1	-1	3.46894e-06	# 0.00 Gflop/s, 680.12 GB/s, tuning took 0.000679 seconds at Mon Jul 11 18:31:42 2022
   bytes=2359296	cudaMemset	cudaGaugeField,cuda_gauge_field.cpp,81	32	1	1	1	1	1	0	-1	-1	-1	-1	3.52653e-06	# 0.00 Gflop/s, 669.01 GB/s, tuning took 0.000746 seconds at Mon Jul 11 18:31:42 2022
  bytes=23592960	cudaMemset	allocateGhostBuffer,lattice_field.cpp,287	32	1	1	1	1	1	0	-1	-1	-1	-1	1.21224e-05	# 0.00 Gflop/s, 1946.24 GB/s, tuning took 0.000935 seconds at Mon Jul 11 18:22:37 2022
  bytes=23592960	cudaMemset	allocateGhostBuffer,lattice_field.cpp,292	32	1	1	1	1	1	0	-1	-1	-1	-1	1.20539e-05	# 0.00 Gflop/s, 1957.28 GB/s, tuning took 0.000942 seconds at Mon Jul 11 18:22:37 2022
       bytes=256	cudaMemcpyDeviceToHost	BatchInvertMatrix,blas_lapack_cublas.cpp,125	32	1	1	1	1	1	0	-1	-1	-1	-1	8.80849e-06	# 0.00 Gflop/s, 0.03 GB/s, tuning took 0.001067 seconds at Mon Jul 11 18:32:48 2022
       bytes=256	cudaMemcpyDeviceToHost	BatchInvertMatrix,blas_lapack_cublas.cpp,141	32	1	1	1	1	1	0	-1	-1	-1	-1	8.86073e-06	# 0.00 Gflop/s, 0.03 GB/s, tuning took 0.001106 seconds at Mon Jul 11 18:32:48 2022
    bytes=262144	cudaMemcpyDeviceToDevice	exchangeGhost,cuda_gauge_field.cpp,193	32	1	1	1	1	1	0	-1	-1	-1	-1	1.03123e-05	# 0.00 Gflop/s, 50.84 GB/s, tuning took 0.000967 seconds at Mon Jul 11 18:32:48 2022
    bytes=262144	cudaMemcpyDeviceToDevice	exchangeGhost,cuda_gauge_field.cpp,202	32	1	1	1	1	1	0	-1	-1	-1	-1	1.03896e-05	# 0.00 Gflop/s, 50.46 GB/s, tuning took 0.000999 seconds at Mon Jul 11 18:32:48 2022
    bytes=262144	cudaMemset	cudaGaugeField,cuda_gauge_field.cpp,80	32	1	1	1	1	1	0	-1	-1	-1	-1	2.69622e-06	# 0.00 Gflop/s, 97.23 GB/s, tuning took 0.000639 seconds at Mon Jul 11 18:32:46 2022
    bytes=262144	cudaMemset	cudaGaugeField,cuda_gauge_field.cpp,81	32	1	1	1	1	1	0	-1	-1	-1	-1	2.67494e-06	# 0.00 Gflop/s, 98.00 GB/s, tuning took 0.000577 seconds at Mon Jul 11 18:32:46 2022
 bytes=303038464	cudaMemset	allocateGhostBuffer,lattice_field.cpp,287	32	1	1	1	1	1	0	-1	-1	-1	-1	0.000198861	# 0.00 Gflop/s, 1523.87 GB/s, tuning took 0.001863 seconds at Mon Jul 11 18:28:21 2022
 bytes=303038464	cudaMemset	allocateGhostBuffer,lattice_field.cpp,292	32	1	1	1	1	1	0	-1	-1	-1	-1	0.000198656	# 0.00 Gflop/s, 1525.44 GB/s, tuning took 0.001831 seconds at Mon Jul 11 18:28:21 2022
     bytes=32768	cudaMemsetAsync	zero,color_spinor_field.cpp,465	32	1	1	1	1	1	0	-1	-1	-1	-1	2.62478e-06	# 0.00 Gflop/s, 12.48 GB/s, tuning took 0.001722 seconds at Mon Jul 11 18:32:46 2022
 bytes=335544320	cudaMemset	cudaGaugeField,cuda_gauge_field.cpp,54	32	1	1	1	1	1	0	-1	-1	-1	-1	0.000225485	# 0.00 Gflop/s, 1488.10 GB/s, tuning took 0.002079 seconds at Mon Jul 11 18:36:59 2022
  bytes=37748736	cudaMemset	cudaGaugeField,cuda_gauge_field.cpp,54	32	1	1	1	1	1	0	-1	-1	-1	-1	2.73554e-05	# 0.00 Gflop/s, 1379.94 GB/s, tuning took 0.001118 seconds at Mon Jul 11 18:28:21 2022
 bytes=377487360	cudaMemset	allocateGhostBuffer,lattice_field.cpp,287	32	1	1	1	1	1	0	-1	-1	-1	-1	0.000248013	# 0.00 Gflop/s, 1522.05 GB/s, tuning took 0.002308 seconds at Mon Jul 11 18:37:00 2022
 bytes=377487360	cudaMemset	allocateGhostBuffer,lattice_field.cpp,292	32	1	1	1	1	1	0	-1	-1	-1	-1	0.000247808	# 0.00 Gflop/s, 1523.31 GB/s, tuning took 0.002276 seconds at Mon Jul 11 18:37:00 2022
         bytes=4	cudaMemsetAsync	Launch,coarse_op.cuh,393	32	1	1	1	1	1	0	-1	-1	-1	-1	1.87246e-06	# 0.00 Gflop/s, 0.00 GB/s, tuning took 0.000573 seconds at Mon Jul 11 18:28:40 2022
         bytes=4	cudaMemsetAsync	apply,coarse_op_preconditioned.cu,79	32	1	1	1	1	1	0	-1	-1	-1	-1	1.81029e-06	# 0.00 Gflop/s, 0.00 GB/s, tuning took 0.000552 seconds at Mon Jul 11 18:31:58 2022
   bytes=4194304	cudaMemcpyHostToDevice	createGeoMap,transfer.cpp,340	32	1	1	1	1	1	0	-1	-1	-1	-1	0.000183501	# 0.00 Gflop/s, 22.86 GB/s, tuning took 0.001914 seconds at Mon Jul 11 18:28:10 2022
   bytes=4194304	cudaMemcpyHostToDevice	createGeoMap,transfer.cpp,341	32	1	1	1	1	1	0	-1	-1	-1	-1	0.000176128	# 0.00 Gflop/s, 23.81 GB/s, tuning took 0.001785 seconds at Mon Jul 11 18:28:10 2022
 bytes=452984832	cudaMemset	cudaGaugeField,cuda_gauge_field.cpp,54	32	1	1	1	1	1	0	-1	-1	-1	-1	0.00029696	# 0.00 Gflop/s, 1525.41 GB/s, tuning took 0.002422 seconds at Mon Jul 11 18:28:21 2022
  bytes=50331648	cudaMemsetAsync	zero,color_spinor_field.cpp,465	32	1	1	1	1	1	0	-1	-1	-1	-1	3.57669e-05	# 0.00 Gflop/s, 1407.21 GB/s, tuning took 0.001186 seconds at Mon Jul 11 18:26:52 2022
  bytes=50348032	cudaMemsetAsync	zero,color_spinor_field.cpp,465	32	1	1	1	1	1	0	-1	-1	-1	-1	3.56571e-05	# 0.00 Gflop/s, 1412.00 GB/s, tuning took 0.001181 seconds at Mon Jul 11 18:32:46 2022
    bytes=524288	cudaMemcpyDeviceToDevice	exchangeGhost,cuda_gauge_field.cpp,202	32	1	1	1	1	1	0	-1	-1	-1	-1	1.04689e-05	# 0.00 Gflop/s, 100.16 GB/s, tuning took 0.000967 seconds at Mon Jul 11 18:32:48 2022
    bytes=524288	cudaMemset	cudaGaugeField,cuda_gauge_field.cpp,80	32	1	1	1	1	1	0	-1	-1	-1	-1	2.72091e-06	# 0.00 Gflop/s, 192.69 GB/s, tuning took 0.000719 seconds at Mon Jul 11 18:32:46 2022
    bytes=524288	cudaMemset	cudaGaugeField,cuda_gauge_field.cpp,81	32	1	1	1	1	1	0	-1	-1	-1	-1	2.67273e-06	# 0.00 Gflop/s, 196.16 GB/s, tuning took 0.000633 seconds at Mon Jul 11 18:32:46 2022
     bytes=65536	cudaMemcpyHostToDevice	BatchInvertMatrix,blas_lapack_cublas.cpp,117	32	1	1	1	1	1	0	-1	-1	-1	-1	1.32344e-05	# 0.00 Gflop/s, 4.95 GB/s, tuning took 0.000978 seconds at Mon Jul 11 18:31:40 2022
  bytes=75497472	cudaMemset	zero,cuda_gauge_field.cpp,729	32	1	1	1	1	1	0	-1	-1	-1	-1	5.19545e-05	# 0.00 Gflop/s, 1453.15 GB/s, tuning took 0.002531 seconds at Mon Jul 11 18:29:00 2022
    bytes=786432	cudaMemsetAsync	zero,color_spinor_field.cpp,465	32	1	1	1	1	1	0	-1	-1	-1	-1	2.82305e-06	# 0.00 Gflop/s, 278.58 GB/s, tuning took 0.000677 seconds at Mon Jul 11 18:32:08 2022
  bytes=83886080	cudaMemcpyDefault	saveCPUField,cuda_gauge_field.cpp,658	32	1	1	1	1	1	0	-1	-1	-1	-1	0.00874564	# 0.00 Gflop/s, 9.59 GB/s, tuning took 0.061816 seconds at Mon Jul 11 18:37:59 2022
  bytes=84934656	cudaMemsetAsync	exchangeExtendedGhost,cuda_gauge_field.cpp,400	32	1	1	1	1	1	0	-1	-1	-1	-1	5.78259e-05	# 0.00 Gflop/s, 1468.80 GB/s, tuning took 0.001298 seconds at Mon Jul 11 18:22:41 2022
   bytes=9437184	cudaMemset	cudaGaugeField,cuda_gauge_field.cpp,80	32	1	1	1	1	1	0	-1	-1	-1	-1	6.30815e-06	# 0.00 Gflop/s, 1496.03 GB/s, tuning took 0.000897 seconds at Mon Jul 11 18:31:42 2022
   bytes=9437184	cudaMemset	cudaGaugeField,cuda_gauge_field.cpp,81	32	1	1	1	1	1	0	-1	-1	-1	-1	6.2772e-06	# 0.00 Gflop/s, 1503.41 GB/s, tuning took 0.000842 seconds at Mon Jul 11 18:31:42 2022
